title,company,location,link,description,skills,details
Data Architect,MCA,"Marseille, Provence-Alpes-Côte d'Azur, France",https://fr.linkedin.com/jobs/view/data-architect-at-mca-3907802841?position=2&pageNum=0&refId=LKlSDx2iXah6OaZeWO8rpg%3D%3D&trackingId=Q%2BA2fQsiKnAe4H7OCGncog%3D%3D&trk=public_jobs_jserp-result_search-card,"MCA est un Groupe de Conseil en Ingénierie et Hautes Technologies qui compte 1500 collaborateurs en France et à l’International.
Fort de nos 30 ans d’expérience, nous accompagnons nos clients dans la réalisation de leurs projets.
Nous rejoindre, c'est intégrer une entreprise dynamique qui a à cœur d’accompagner ses collaborateurs.
Vous bénéficiez d'un suivi personnalisé et régulier ainsi que de nombreuses formations qui participeront à votre montée en compétences.
Détail projet :
Date de démarrage :
ASAP
Expérience nécessaire :
6 - 9 ans
Langue :
français et anglais
(Niveau C1)
Contexte de la mission
:
Nous cherchons un Data Architect qui aura la responsabilité complète de l'architecture.
Nous recherchons une personne ayant une bonne compréhension globale des services disponibles d’Azure Analytics.
Cette personne travaillera en collaboration avec plusieurs équipes Produits. Il aura en charge l’architecture des données, et viendra en soutien aux équipes dans l’intégralité du cycle de vie de la gestion des données.
Le consultant devra par ailleurs avoir une expérience opérationnelle afin d’être en mesure de configurer différents environnements et services.
Il/Elle devra faire preuve de leadership dans le but d'endosser le rôle de Leader Technique, et point d’entrée avec les parties prenantes de l’entreprise
Usage quotidien de l’anglais comme langue de communication dans la fonction
Tâches à réaliser
:
Vous assurez le leadership technique, participez au développement, et représentez les ressources internes et externes de la plateforme
Vous serez un membre actif de l’équipe des architectes, afin de superviser le processus de gestion des données et fournir des conseils et orientations aux équipes de développement
Vous serez responsable de la conception, et de la documentation de la solution dans votre domaine
Compétences recherchées :
Obligatoires
:
Expérience dans le développement, la documentation et la maintenance de modèles de données logiques et physiques
Expérience sur Databricks, ADLS storage, SQL DB, ADF et Power BI
Expérience dans la définition et la maîtrise d'une architecture de données évolutive de bout en bout, en tenant compte de l'architecture de l'entreprise et des normes industrielles.
Participation à l'élaboration d'architectures, stratégies et politiques en matière de données, y compris la sécurité des données
Langage SQL Writing et modélisation de données
Data Architecture
Power BI
Azure ADFv2, Databricks, Synapse, Delta Lake
Environnement et technologie Azure Advanced Analytics
Python, Pyspark
Microsoft cloud basé sur modèle Delivery
Data Management, Data Governance et Data Quality
Déploiement d’APIs et micro-services
DevSecOps
Agile
Expérience professionnelle dans un environnement international
Optionnelles :
Expérience dans le secteur automobile
Vos perspectives d’évolution :
Notre objectif premier est de vous donner toutes les clés pour réussir et ainsi accéder aux différentes évolutions que nous proposons.
À terme, vous pourrez évoluer sur d'autres secteurs d'activités, mais aussi vous projeter en interne sur des postes en France ou à l'international.
Ce poste est ouvert aux personnes en situation de handicap.
Show more
Show less","{'ProgLanguage': ['Python', 'R', 'Go'], 'DataBase': ['SQL'], 'DataAnalytics': ['R'], 'BigData': ['Spark', 'Databricks'], 'MachingLearning': [], 'DataSerialization': [], 'DataVisualization': ['Power BI'], 'Statistics': [], 'CloudComputing': ['Azure'], 'DevTools': [], 'Os': [], 'DBMS': [], 'SoftBigDataProcessing': [], 'Automation': [], 'InfrastructureAsCode': [], 'NetworkSecurty': [], 'Virtualisation': [], 'Containers': [], 'Collaboration': [], 'Other': ['Cloud'], 'FrSoftSkills': ['Communication', 'Leadership', 'Collaboration'], 'EnSoftSkils': ['Communication', 'Leadership', 'Collaboration']}","{'JobDetail': [], 'TypeContract': [], 'Salary': [], 'Level': [], 'Experience': ['a', 'n', 's', '30', '30', '30']}"
Data Architect,Ippon Technologies,Greater Paris Metropolitan Region,https://fr.linkedin.com/jobs/view/data-architect-at-ippon-technologies-3884217848?position=3&pageNum=0&refId=LKlSDx2iXah6OaZeWO8rpg%3D%3D&trackingId=W9oL%2FdDP7SVAJ4u%2FOhRACw%3D%3D&trk=public_jobs_jserp-result_search-card,"Ippon : cabinet de conseil et d'expertise en technologie, international et indépendant.
En quelques mots : 700 passionnés de tech, 12 agences dans le monde, 6 communautés
d’expertise d’excellence
, contributeur actif et sponsor de l'écosystème numérique, des publications soutenues et reconnues sur nos réseaux.
Rejoignez notre communauté de 70
experts en data
, dont 30 à Paris, où la collaboration dynamique entre data engineers, data analysts et data architects est
le moteur de notre succès
. Avec une
communication proactive
sur des canaux internes, restez constamment informé des dernières tendances, participez à des
discussions stimulantes
et contribuez à l'organisation d'
événements passionnants
(dataday, datapéro, datalunch…).
Faites partie d'une équipe où
l'innovation
et
l'engagement
sont les clés de notre excellence collective !
Notre spécialité ?
Construire des data platforms dans le cloud public
avec les meilleures technos du moment.
Pour l’un de nos clients dans le secteur du luxe, nous recherchons un
Data Architect expérimenté
.
Au sein d’une équipe de 4 data architect, ton rôle sera de :
Concevoir l'architecture
et vérifier la mise en œuvre des briques technologiques des data platforms (Collecte, Stockage, Traitement, Visualisation)
Assurer le suivi des
principes d'architecture, de sécurité et de confidentialité des données
dans les data platforms établis au niveau du groupe
Soutenir la stratégie NFR en relation avec le Data Tech Lead de chaque Data Product Team
Soutenir la stratégie de données
élaborée par l'équipe data (bases techniques : GCP, Google Big Query, DBT et Airflow/Composer)
Piloter et gérer la feuille de route technique de la data platform
Apporter ton expertise sur les architectures et les data platforms
pour aider les différentes parties prenantes à suivre la stratégie Data.
Piloter l'évaluation et l'optimisation des architectures de données
Documenter l'architecture (Confluence) et suivre les actions d'implémentation (Jira).
Assurer le lien technologique avec les équipes de données externes
Animer la communauté technique
Si tu le souhaites, tu pourras également :
Participer aux évènements internes
à la communauté data (BBL, webinar, datapéro interne, meetup, blog, dojos) et externes (Salon du Big Data, GCP Summit, Spark Summit, AWS Summit, Devoxx, workshop partenaire, meetups)
Capitaliser sur les missions et les différents évènements de la communauté au travers d’articles de blogs, REX, BBL interne.
Tes compétences
Hard sills
Au moins 5 ans d'expérience en architecture de données
Expérience en Big Data (EMR, Spark,...) et en data platforms (GCP BigQuery, AWS Redshift/Athena/S3)
Bonne expérience dans la conception d'architecture et l'implémentation de briques technologiques de Data platforms (Collecte, Stockage, Traitement, Visualisation)
Bonne connaissance des architectures de données et du cloud (GCP, Azure, AWS, etc.)
Bonne connaissance des processus et outils de développement modernes (DevOps, Git, CI/CD...) ;
Une expérience sur l'approche data mesh est un plus
Une expérience autour de GCP, dbt, looker/sémantique layer est un vrai plus
Soft skills
Rigueur, proactif et bien organisé
Capacité à synthétiser et à fournir une visibilité claire sur les sujets
Empathie
Grande capacité de coopération / comportement d'intégrateur
Anglais fluent indispensable (communication régulière avec les équipes basées en Italie)
Ippon c’est aussi :
Travailler en équipe
au sein d'une communauté data à la pointe des évolutions
Un
suivi de proximité
réalisé par ton manager (expert data)
Devenir
ceinture noire en data
grâce à notre
programme d’accompagnement de carrière Blackbelt
Participer à nos apéros et divers évènements internes pour consolider la
cohésion d’équipe
Notre process de recrutement :
Préqualification téléphonique - 20 min
Un entretien RH / Sales - 1H00
Un entretien technique avec 2 consultants data
Si le match est bon des deux côtés : Hadjimé ! Tu te lanceras sur le tatami Ippon !
Show more
Show less","{'ProgLanguage': ['R', 'Go'], 'DataBase': [], 'DataAnalytics': ['R'], 'BigData': ['Spark'], 'MachingLearning': [], 'DataSerialization': [], 'DataVisualization': [], 'Statistics': [], 'CloudComputing': ['AWS', 'Azure'], 'DevTools': ['Git'], 'Os': [], 'DBMS': ['BigQuery', 'Big Query'], 'SoftBigDataProcessing': [], 'Automation': ['Airflow'], 'InfrastructureAsCode': [], 'NetworkSecurty': [], 'Virtualisation': [], 'Containers': [], 'Collaboration': ['JIRA', 'Confluence'], 'Other': ['DevOps', 'Big Data', 'Cloud', 'CI/CD'], 'FrSoftSkills': ['Communication', 'Empathie', 'Collaboration', 'Organisation'], 'EnSoftSkils': ['Communication', 'Collaboration']}","{'JobDetail': [], 'TypeContract': [], 'Salary': [], 'Level': [], 'Experience': ['a', 'n', 's', '5', '5', '5']}"
Data Architect (F/H),Micropole,"Levallois-Perret, Île-de-France, France",https://fr.linkedin.com/jobs/view/data-architect-f-h-at-micropole-3652819338?position=4&pageNum=0&refId=LKlSDx2iXah6OaZeWO8rpg%3D%3D&trackingId=SaOtUFb94IkRJF3waGfhjg%3D%3D&trk=public_jobs_jserp-result_search-card,"Rejoignez le Groupe Micropole. Devenez un #InnovativePeople !
Mission
En Résumé
Localité : Levallois-Perret
Type de contrat : CDI
Niveau d’expérience : au moins 7 ans
Accord de télétravail & Flex office
Vous êtes
passionné(e) par la data
? Vous êtes convaincus que l’optimisation du
patrimoine data des entreprises
est la clé de leur performance ? Vous voulez
rendre les entreprises data intelligentes
et les aider à se transformer pour préparer dès à présent leur futur ?
Vous souhaitez rejoindre un groupe pionnier des grandes innovations data et digitales ?
Si vous avez
répondu « Oui »
à chacune de ces questions alors devenez Data Architect pour l’un de
nos clients grands-comptes.
Prêt(e) à rejoindre l’aventure Micropole ? N’attendez plus !
Au sein de Micropole, nous vous proposons de rejoindre notre practice « Data Governance et Architecture », composée de 80 #InnovativePeople et reconnue comme leader européen de la Gouvernance des données.
En Tant Qu' Architect
Les données en entreprise sont trop souvent organisées en silos ne laissant aux métiers qu'une vision parcellaire de l'information.
Afin d'amener une plus grande valeur et de l'efficacité au niveau des processus opérationnels et décisionnels de l'entreprise, nous accompagnons nos clients dans la gouvernance de leurs données en les hiérarchisant au sein du système d'information. Nous abordons ainsi, le cycle de vie de la donnée produit depuis la R&D jusqu'au Digital.
Au sein de Micropole, nous vous proposons de rejoindre notre practice « Data Gouvernance et Architecture » basée à Levallois-Perret, composée de 80 #InnovativePeople et reconnue comme leader européen de la Gouvernance des données.
Dans Vos Missions Quotidiennes, Vous Êtes Amené(e)s à
Être l’interface entre le client et l’équipe projet :
Prise en compte des enjeux métier afin d’aligner l’architecture sur la stratégie de l’entreprise notamment vis-à-vis de la transformation digitale des entreprises et des enjeux réglementaires ;
Définir la roadmap de mise en œuvre ;
Définir les principes d’urbanisation autour des données ;
Cadrer les projets : référentiels (MDM), Data Hub, Big Data, gouvernance des données, échange (ETL/ESB/IPaaS) ;
Auditer les architectures existantes sur les axes qualité, et urbanisation des données ;
Animer les workshops de conception dans le cadre de projets d’implémentation ;
Accompagner sur les phases de cadrage à la définition des modèles de données et des processus de gouvernance opérationnelle ;
Réaliser la conception technique et fonctionnelle des interfaces d’échange.
Participer activement aux avant-ventes et démarche de validation de concepts :
Participation aux phases de réponses à appel d’offre ;
Participation sur la production de démonstrateur en lien avec nos partenaires éditeurs ;
Animation de séminaires d’acculturation à la data.
Profil
Vos Compétences Techniques
Vous maitrisez au moins une solution du marché liée à la gouvernance des données (MDM, Data Catalogue, DQM, Data Fabric, IPaaS, ETL/ESB).
Vos Atouts
Vous avez au moins 7 ans d’expérience professionnelle sur la définition d’architecture data ;
Vous maîtrisez les concepts de la gouvernance des données, et disposez d’une d’expérience projet sur une des solutions leaders du marché ;
Véritable coéquipier(e), vous avez à cœur de contribuer à la montée en compétence de votre équipe ;
Vous disposez d’un bon niveau de français et d’anglais, à l’oral comme à l’écrit.
La Vie Chez Micropole, C’est
Une vie interne rythmée pour se familiariser à la culture d’entreprise et aux valeurs de Micropole ;
Des évènements internes réguliers pour partager les connaissances aussi bien techniques que fonctionnelles ;
Une politique de formation attractive et éclectique ;
Un travail en équipe valorisé pour une meilleure cohésion ;
La participation à des projets internes sur la base du volontariat.
Devenir #INNOVATIVEPEOPLE, c’est :
Intégrer une communauté de 1100 experts passionnés répartis entre la France, la Belgique, le Luxembourg, la Suisse, l’Espagne et la Chine ;
Construire ensemble les solutions stratégiques et innovantes de demain pour accompagner nos clients dans leur transformation data et digitale ;
Participer au développement de nos 4 centres d’excellences cloud : AWS, Microsoft Azure, Salesforce, GCP ;
Evoluer continuellement au travers de formations et de certifications sur les plus grandes technologies grâce à Micropole Campus ;
S’assurer d’une innovation continue grâce à : notre écosystème de partenaires technologiques ; notre accélérateur de start’up databoost’R ; nos lieux d’innovations « innovativeSpaces » et de co-construction avec les clients ; notre management par les talents naturels.
Processus De Recrutement
Chez Micropole, le processus de recrutement est réactif et transparent.
Etape 1 – Si votre profil correspond à nos besoins, vous êtes recontactés dans les 72 heures qui suivent votre candidature par Victoria notre Talent Business Partner dédiée à Data Gouvernance & Architecture pour une qualification téléphonique ainsi qu'un premier entretien en visio ;
Etape 2 – Vous rencontrez un manager avec l’un de nos experts comme Aurélien, Régis ou Jofrey.
En fonction du poste, vous pouvez passer des étapes supplémentaires (entretien ou test technique).
À PROPOS DU GROUPE MICROPOLE
Groupe international de conseil et technologies innovantes, MICROPOLE est spécialisé dans les domaines de la Data & Digital. Depuis ses 14 agences situées en Europe et en Chine, les 1200 #INNOVATIVE PEOPLE du Groupe (consultants, Data scientists, architectes IT, experts métiers, ingénieurs, UX designers…) accompagnent leurs clients partout dans le monde sur l'ensemble des phases de leurs projets, du conseil à leur réalisation, et sur la conduite du changement.
MICROPOLE réalise 35% de son chiffre d’affaires à l’international et est coté sur le marché Eurolist compartiment C d’Euronext Paris, segment Next Economy.
Pour en savoir plus : https://www.linkedin.com/company/micropole/
Infos pratiques
A 200m, le métro Anatole France (Ligne 3) et un accès à l'ensemble des commerce du centre ville de Levallois-Perret à moins de 2 min à pied.
Mot du Manager
Face à des enjeux de compliance toujours plus exigeants et rigoureux, la gouvernance des données devient absolument indispensable pour garantir la cohérence, maitriser la qualité et la connaissance du socle des données des entreprises et assurer leur bonne mise en conformité.
Show more
Show less","{'ProgLanguage': ['R', 'Go'], 'DataBase': [], 'DataAnalytics': ['R'], 'BigData': [], 'MachingLearning': [], 'DataSerialization': [], 'DataVisualization': [], 'Statistics': [], 'CloudComputing': ['AWS', 'Azure'], 'DevTools': ['Git'], 'Os': [], 'DBMS': [], 'SoftBigDataProcessing': [], 'Automation': [], 'InfrastructureAsCode': [], 'NetworkSecurty': [], 'Virtualisation': [], 'Containers': [], 'Collaboration': [], 'Other': ['Big Data', 'Cloud'], 'FrSoftSkills': [], 'EnSoftSkils': []}","{'JobDetail': [], 'TypeContract': ['CDI'], 'Salary': [], 'Level': [], 'Experience': ['a', 'n', 's', '7', '7', '7']}"
"Architecte data F/H - Système, réseaux, données (H/F)",University of Strasbourg,"Strasbourg, Grand Est, France",https://fr.linkedin.com/jobs/view/architecte-data-f-h-syst%C3%A8me-r%C3%A9seaux-donn%C3%A9es-h-f-at-university-of-strasbourg-3912809071?position=5&pageNum=0&refId=LKlSDx2iXah6OaZeWO8rpg%3D%3D&trackingId=Sx3fM7Vun0mC%2FpAK2miTGA%3D%3D&trk=public_jobs_jserp-result_search-card,"Cette offre d’emploi est fournie par Pôle emploi
Description
Descriptif du poste: Emploi ouvert aux agents contractuels uniquement CDD de projet de 3 ans à compter du 10/06/2024 Catégorie : A Corps : Ingénieur d'études Rémunération selon grille de la Fonction Publique La fiche de poste détaillée est disponible sur le site de l'Université. Mission : L'architecte data aura pour principale mission d'optimiser les process de collecte de données issues des systèmes d'information des partenaires du Pôle Universitaire d'Innovation Alsace (PUI-A) et les bases de données disponibles en « open data », en vue d'assurer le déploiement de la démarche de pilotage stratégique et opérationnel par la donnée mise en œuvre dans le cadre du projet PUI-A. Activités principales : * Cartographier les données disponibles au sein des systèmes d'informations des membres fondateurs du PUI-A et des bases de données utiles aux activités du PUI-A notamment accessibles en « open data » * Définir et mettre en place les normes, méthodes, procédures, outils et référentiels de collecte et de gestion de données * Concevoir une approche de regroupement et d'organisation des données collectées. Activités associées : * Contribuer aux travaux d'exploitation des données * Contribuer à l'élaboration des outils de pilotage stratégique et opérationnel par la donnée du PUI-A. Contact pour renseignements sur le poste : David-Alexandre BONNE, Responsable du Pôle Universitaire d'Innovation Alsace Profil recherché: Profil recherché : Formation Bac+5 à Bac+8 dans un des domaines en lien avec le poste (statistique, économétrie, mathématiques, informatique, traitement de l'information). Connaissances : * Architecture et environnement technique d'un système d'information * Outils de gestion (ex. SQL, ETL) et d'exploitation (ex. R, Python) de bases de données * Techniques statistiques et informatiques de collecte et de traitement de données * Méthodes, outils, normes et procédures de la qualité * Méthodologie de conduite de projet * Organisation et fonctionnement de l'enseignement supérieur et de la recherche, ainsi que des écosystèmes de recherche et d'innovation (en Alsace ou dans d'autres territoires) * Langue anglaise : B2 à C1 (cadre européen commun de référence pour les langues). Compétences opérationnelles : * Piloter un projet * Construire et gérer une base de données * Rédiger la documentation fonctionnelle et technique pour les utilisateurs * Gérer la sécurité de l'information * Mettre au point ou adapter des techniques nouvelles, notamment d'automatisation * Apporter des réponses à des besoins spécifiques * Accompagner et conseiller * Communiquer et faire preuve de pédagogie * Travailler en équipe. Compétences comportementales : * Capacité de conceptualisation * Créativité : sens de l'innovation * Sens de l'initiative * Rigueur * Curiosité intellectuelle et ouverture d'esprit * Persévérance * Capacité d'adaptation * Sens de l'organisation * Sens relationnel * Capacité d'écoute.
PROFIL SOUHAITÉ
Expérience
Débutant accepté
Source: Pole emploi (https://www.pole-emploi.fr)
Show more
Show less","{'ProgLanguage': ['Python', 'R', 'Go'], 'DataBase': ['SQL'], 'DataAnalytics': ['R'], 'BigData': [], 'MachingLearning': [], 'DataSerialization': [], 'DataVisualization': [], 'Statistics': ['Statistiques'], 'CloudComputing': [], 'DevTools': [], 'Os': [], 'DBMS': [], 'SoftBigDataProcessing': [], 'Automation': [], 'InfrastructureAsCode': [], 'NetworkSecurty': [], 'Virtualisation': [], 'Containers': [], 'Collaboration': [], 'Other': ['Statistiques'], 'FrSoftSkills': ['Créativité', 'Organisation'], 'EnSoftSkils': ['Initiative']}","{'JobDetail': [], 'TypeContract': ['CDD'], 'Salary': [], 'Level': ['Bac+5'], 'Experience': ['a', 'n', 's', '3', '3', '3']}"
Architecte Data / IA (H/F),La Banque Postale,"Gradignan, Nouvelle-Aquitaine, France",https://fr.linkedin.com/jobs/view/architecte-data-ia-h-f-at-la-banque-postale-3888072106?position=6&pageNum=0&refId=LKlSDx2iXah6OaZeWO8rpg%3D%3D&trackingId=cVGDkaFwlty6V6LNewEjGQ%3D%3D&trk=public_jobs_jserp-result_search-card,"En tant qu’architecte Data / IA, Vous
apportez votre expertise technique sur les grandes déclinaisons Data et IA dans un modèle hybride
(privé / de confiance / public), vous
garantissez que les exigences d'architectures soient bien respectées
et que les produits / projets s’inscrivent bien dans la trajectoire prévue pour le SI.
A la DSI de la Banque Postale et Assurance (1700 collaborateurs à Nantes, Toulouse, Issy-Les- Moulineaux, Gradignan), vos actions auront un
impact positif
sur nos clients pour une finance plus responsable et une transition juste.
VOS MISSIONS
Garantir la définition de la stratégie d’architecture et du choix des solutions IT,
Participer à la phase exploratoire, avant-projet, notamment pour étudier différents scénarios fonctionnels et technologiques,
Contribuer à la formalisation des évolutions de processus impactés par le SI,
S’assurer de l’alignement des choix de conception des squads et des équipes,
Apporter conseil et expertise aux équipes de la DSI et faire le lien avec les architectes d’entreprise.
Environnement technique
:
Hortonworks, Cloudera, Databricks, SnowFlake, Cloud de confiance, cloud public, IA modèles cloud / OnPrem, Python …
VOTRE EQUIPE
Au sein de la Direction Architecture et innovation (400 personnes),
sous la responsabilité du CTO, vous intégrez un collectif d’architectes
avec qui vous échangez au quotidien. Vous collaborez étroitement avec les Directions études ainsi qu’avec vos pairs de La Banque Postale et La Poste.
Vous rejoignez ainsi un environnement dynamique, pour travailler sur des sujets variés et complexes où les nouvelles idées sont bienvenues.
POURQUOI PAS VOUS ?
Vous avez une solide expérience dans l’architecture Data et le monde de l’IA.
Vous aurez la responsabilité de décrire les différentes solutions d’architecture d’entreprise dans le périmètre qui est le vôtre et vous contribuerez activement à la définition et l’entretien du cadre de référence et des roadmaps associées.
Citoyenne, La Banque Postale s’engage en faveur de la diversité et de l’égalité des chances pour donner accès à tous ses métiers sans discrimination de genre, d’origine sociale ou culturelle, d’orientation sexuelle ou de handicap. Rejoignez-nous et construisons ensemble la Banque préférée des Français.
VOUS N’AVEZ PAS IDEE DE CE QUE L’ON PEUT REUSSIR ENSEMBLE
Saviez-vous qu’à La Banque Postale, on a un regard singulier sur notre métier ? Notre jeunesse fait de nous une banque avec des
convictions
et des
ambitions
, qui croit vraiment que la finance a un sens, qu’elle joue un réel rôle sociétal. D’ailleurs, on accompagne plus d’un million de clients financièrement fragiles et on est la
1ère banque mondiale en matière de RSE grâce à nos actions en faveur d’une finance durable
. Notre jeunesse nous rend aussi conquérants. A raison ! Notre Groupe Banque/Assurance accompagne plus de 20 millions de clients, ce qui fait de nous le 3ème groupe du secteur en France.
On bouillonne d’idées et de projets innovants pour continuer à nous développer, avec toujours le même engagement vis-à-vis de nos collaborateurs : leur offrir toutes les conditions pour s’étonner.
Show more
Show less","{'ProgLanguage': ['Python', 'R'], 'DataBase': [], 'DataAnalytics': ['R'], 'BigData': ['Databricks'], 'MachingLearning': [], 'DataSerialization': [], 'DataVisualization': [], 'Statistics': [], 'CloudComputing': [], 'DevTools': [], 'Os': [], 'DBMS': ['Snowflake', 'Snowflake'], 'SoftBigDataProcessing': [], 'Automation': [], 'InfrastructureAsCode': [], 'NetworkSecurty': [], 'Virtualisation': [], 'Containers': [], 'Collaboration': [], 'Other': ['Cloud'], 'FrSoftSkills': [], 'EnSoftSkils': []}","{'JobDetail': ['Hybride'], 'TypeContract': [], 'Salary': [], 'Level': [], 'Experience': ['a', 'n', 's']}"
