title,company,location,link,description,skills,details
Architecte Data F/H,Ippon Technologies,Greater Lyon Area,https://fr.linkedin.com/jobs/view/architecte-data-f-h-at-ippon-technologies-3893256404?position=3&pageNum=2&refId=Hr1jrWraPrOM1ewZklXlRA%3D%3D&trackingId=0mnN26psen4KVoJo47tRAw%3D%3D&trk=public_jobs_jserp-result_search-card,"Qui sommes-nous ?
Ippon
, c'est l’énergie du collectif au service de la technologie ! Nous sommes un cabinet de conseil et d’expertise technique. Nos équipes ont pour leitmotive de transformer des idées innovantes en solutions logicielles de haute qualité avec un focus particulier sur la valeur apportée aux utilisateurs.
Créée en 2017, l’agence de Lyon, ce sont des passionnés intervenant sur des projets à forte technicité ou en conseil et architecture : Fullstack, Data, DevOps, Cloud, Agile, Design et ne compte pas s’arrêter en si bon chemin !
La pluridisciplinarité, l’expertise, l’écoute, l’adaptabilité mais aussi le partage de connaissances fondent notre engagement au service de nos partenariats.
Vous intégrerez notre Communauté Data
, composée d’une équipe de
80 experts sur 10 agences en France.
Notre spécialité est de
construire des data platforms dans le Cloud public avec les meilleures technos du moment.
La
Data chez Ippon, c’est déjà plus de
250 certifications AWS, GCP et AZURE,
des
speakers à l’AWS Summit, des partenariats avec Snowflake, Databricks, DBT, un blog technique
avec des publications régulières.
Ce poste est un vrai challenge aussi bien en termes de
défis techniques que de gestion d'équipe.
La
réussite de vos projets sera portée par votre capacité à vous adapter et à monopoliser un large panel de compétences techniques. Vous devrez être le/la leader de votre équipe en gardant à l’esprit l’ensemble des
bonnes pratiques d'architectes
, de sécurité et d’automatisation nécessaires à la réussite du projet. En tant que
représentant(e) de l’engagement d’Ippon
sur les sujets qui vous seront confiés, vous serez amené(e) à
travailler avec notre équipe Commerce dès les phases de qualification
et lors de la validation de jalons de la roadmap que vous aurez préalablement validé avec le client. Vous interviendrez également dans la sélection de l’équipe qui sera affectée à votre projet.
Votre rôle :
- Grâce à votre position d’architecte vous avez une vision experte et systémique de l’ensemble des composants d’une Modern Data Platform.
- Vous maîtrisez le panel des exigences fonctionnelles et non fonctionnelles à collecter afin d’assurer l’efficience opérationnelle et la pérennité de la data platform.
- Vous êtes expert(e) et maîtrisez tous les outils et services d’au moins un écosystème parmi les 3 principaux leaders du marché (AWS, Azure et GCP) et avez des facilités pour étendre votre champ de compétences.
- Vous êtes proactif/ve sur la veille technique et la capitalisation et veillez à garder toujours un temps d’avance sur l’état de l’art du secteur afin de pouvoir guider vos clients.
- En tant qu’architecte expérimenté(e) vous pouvez indifféremment intervenir sur des missions de delivery pour concevoir la solution cible ou en phase de cadrage amont pour guider les choix et construire les roadmaps.
- Vous êtes pédagogue et savez communiquer et vulgariser des réflexions complexes pour les rendre accessibles à tous.
Notre éco-système technique :
- Cloud : AWS, GCP, Azure
- Langage de programmation data : Python, SQL, Scala
- Approche Data Warehouse : Redshift, Snowflake, BigQuery
- Approche Data Lakehouse : Databricks, Starburst, Glue-Athena-S3Ingestion : AWS Glue, Airbyte, dbt Stockage : AWS S3, Google Cloud Storage, Azure Blob Storage
- Orchestration : Airflow, AWS Step function
- Gouvernance : cataloging, sécurité, scope d'accèsBatch et Streaming : Kafka, Amazon Kinesis, Google DataFlow
- Outil de visualisation : Tableau, Power BI, Metabase, Superset
Votre évolution chez Ippon :
Vous serez accompagné(e) dans votre montée en compétences aussi bien technique que leadership grâce à
notre programme BlackBelt
(programme de formation continue : mentoring, formations, certifications).
En tant que membre d’une communauté,
vous pouvez avoir différents rôles :
- Celui de Manager Technique (MT) : manager d’une équipe de 7 ingénieur(e)s Ippon (onboarding, suivis, accompagnement, mise en place d’objectifs…). Vous conduirez les entretiens techniques en binôme
- Responsable de l’accomplissement d’une ou plusieurs actions stratégiques de la CoreTeam Data
- Devenir speaker lors de Meetup, Summit, Talks internes, auprès des écoles …
- Devenir formateur(trice) et accompagner la nouvelle génération d’Ippon dans leur montée en compétencesVous avez d’autres souhaits, pas de soucis, nous en discuterons durant notre échange et répondrons à toutes vos questions.
Les Next Steps :
1 Echange RH
1 Echange Technique
1 Echange avec la Direction
Si le match est bon des deux côtés : Vous vous lancerez sur le tatami Ippon !
Show more
Show less","{'ProgLanguage': ['Python', 'Scala', 'R', 'Go'], 'DataBase': ['SQL'], 'DataAnalytics': ['R'], 'BigData': ['Databricks'], 'MachingLearning': [], 'DataSerialization': [], 'DataVisualization': ['Tableau', 'Power BI'], 'Statistics': [], 'CloudComputing': ['AWS', 'Azure'], 'DevTools': [], 'Os': [], 'DBMS': ['Snowflake', 'Snowflake', 'BigQuery'], 'SoftBigDataProcessing': [], 'Automation': ['Airflow'], 'InfrastructureAsCode': [], 'NetworkSecurty': [], 'Virtualisation': [], 'Containers': [], 'Collaboration': [], 'Other': ['DevOps', 'Cloud'], 'FrSoftSkills': ['Adaptabilité', 'Leadership'], 'EnSoftSkils': ['Leadership']}","{'JobDetail': ['Full'], 'TypeContract': [], 'Salary': [], 'Level': [], 'Experience': ['a', 'n', 's']}"
Architecte Data,FRG Technology Consulting,"Paris, Île-de-France, France",https://fr.linkedin.com/jobs/view/architecte-data-at-frg-technology-consulting-3917370845?position=4&pageNum=2&refId=Hr1jrWraPrOM1ewZklXlRA%3D%3D&trackingId=ldGCQJhE3%2FimqhFOWnMh1Q%3D%3D&trk=public_jobs_jserp-result_search-card,"Notre client, entreprise renommée dans le secteur du luxe et des cosmétiques, basé sur Paris, est à la recherche de son/sa futur(e) Architecte Data.
En tant que membre de la DSI, votre rôle est de participer à la transformation digitale de l’entreprise, par une meilleure capture, analyse et exploitation des données clients.
Principales missions :
Analyse et réponses aux besoins des métiers (BI, analyses externes, etc.),
Conception de nouveaux modèles de données
Construction des pipelines de données
Transformation de données (Pyspark) et le stockage de données dans le Data Lake / Data Warehouse du Groupe
Run et le suivi de la TMA
Description du profil :
Titulaire Bac +5 informatique ou diplôme ingénieur
6 années minimum en expertise Data
Une bonne maîtrise des outils suivants : Azure, SQL, Snowflake, Databricks, Spark, Python, ELK,..
Une bonne affinité avec les best practices DevOps, CI/CD, unit-testing et méthodologies de travail agile
Des notions en data science sur l’entraînement, la validation et le déploiement de modèles ML supervisés et non-supervisés serait un plus.
Qualités requises : Bon esprit analytique et de synthèse, rigoureux, autonome, bonne communication, curieux, force de proposition, vulgarisation des problématiques techniques auprès du métier
Avantages :
Package (variable / participation / intéressement) + avantages attractifs
Équipe Data à taille humaine (très bon accompagnement en interne)
Forte valeur ajoutée des projets
Télétravail
Candidatures confidentielles
Show more
Show less","{'ProgLanguage': ['Python', 'R', 'Go'], 'DataBase': ['SQL'], 'DataAnalytics': ['R'], 'BigData': ['Spark', 'Databricks'], 'MachingLearning': [], 'DataSerialization': [], 'DataVisualization': [], 'Statistics': [], 'CloudComputing': ['Azure'], 'DevTools': ['Git'], 'Os': [], 'DBMS': ['Snowflake', 'Snowflake'], 'SoftBigDataProcessing': [], 'Automation': [], 'InfrastructureAsCode': [], 'NetworkSecurty': [], 'Virtualisation': [], 'Containers': [], 'Collaboration': [], 'Other': ['DevOps', 'ML', 'CI/CD'], 'FrSoftSkills': ['Communication'], 'EnSoftSkils': ['Communication']}","{'JobDetail': [], 'TypeContract': [], 'Salary': ['Package'], 'Level': [], 'Experience': ['a', 'n', 's']}"
Data Architect Azure,FRG Technology Consulting,"Paris, Île-de-France, France",https://fr.linkedin.com/jobs/view/data-architect-azure-at-frg-technology-consulting-3902057360?position=5&pageNum=2&refId=Hr1jrWraPrOM1ewZklXlRA%3D%3D&trackingId=6ncj9HOlhCXpvAYS2QjQDA%3D%3D&trk=public_jobs_jserp-result_search-card,"FRG Consulting recrute pour l'un de ses clients, une société finale renommée dans le secteur du luxe et des cosmétiques, un Data Architect expert en Azure. Niché au cœur de Paris, vous aurez l'opportunité de travailler au sein d'une équipe passionnée par la recherche et l'innovation, évoluant dans un environnement stimulant et créatif.
Vos missions captivantes :
Contribuer à l'évolution de nos systèmes en développant de nouveaux connecteurs et pipelines pour l'extraction de données, qu'il s'agisse de batch (utilisant Sqoop, scripts bash, Java ou des API) ou de streaming (via Kafka, ELK).
Participer activement à la transformation des données à l'aide de Pyspark, ainsi qu'au stockage dans notre Data Lake et notre Data Warehouse.
Concevoir de nouveaux modèles de données et mettre à disposition des tables ad-hoc sur Snowflake et Impala, répondant ainsi aux besoins métier en termes de BI et d'analyses externes.
Assurer le bon fonctionnement et le suivi de la TMA du Data Lake, garantissant ainsi la fiabilité et la performance de nos systèmes.
Profil recherché :
Vous bénéficiez d'au moins 8 ans d'expérience dans le domaine.
Vous maîtrisez les outils et frameworks de notre stack technique Big Data : Azure, SQL, Snowflake, Databricks, Spark, Python, ELK.
Vous êtes familier des best practices DevOps, CI/CD, et des méthodologies de travail agile.
Des compétences en data science, notamment sur l'entraînement, la validation et le déploiement de modèles ML supervisés et non-supervisés, seraient grandement appréciées.
La maîtrise de l'anglais est indispensable pour évoluer dans un environnement international et dynamique.
Show more
Show less","{'ProgLanguage': ['Python', 'Java', 'R', 'Bash'], 'DataBase': ['SQL'], 'DataAnalytics': ['R'], 'BigData': ['Spark', 'Databricks'], 'MachingLearning': [], 'DataSerialization': [], 'DataVisualization': [], 'Statistics': [], 'CloudComputing': ['Azure'], 'DevTools': [], 'Os': [], 'DBMS': ['Snowflake', 'Snowflake'], 'SoftBigDataProcessing': [], 'Automation': [], 'InfrastructureAsCode': [], 'NetworkSecurty': [], 'Virtualisation': [], 'Containers': [], 'Collaboration': [], 'Other': ['DevOps', 'Big Data', 'ML', 'CI/CD'], 'FrSoftSkills': [], 'EnSoftSkils': []}","{'JobDetail': [], 'TypeContract': [], 'Salary': [], 'Level': [], 'Experience': ['a', 'n', 's', '8', '8', '8']}"
Data Architect Senior - Freelance (H/F),TeamWork Corporate,"Saint-Priest, Auvergne-Rhône-Alpes, France",https://fr.linkedin.com/jobs/view/data-architect-senior-freelance-h-f-at-teamwork-corporate-3916528778?position=6&pageNum=2&refId=Hr1jrWraPrOM1ewZklXlRA%3D%3D&trackingId=Mb%2FF51kJwBrvYyKEB3hlnA%3D%3D&trk=public_jobs_jserp-result_search-card,"Description de l'entreprise
TeamWork est un acteur majeur du conseil, de l’intégration technologique et de l’innovation, implanté en Europe, en Asie et en Amérique du Nord.
Au travers de ses univers, SAP Business Solutions, Data Analytics, Technology Platform et Salesforce, nous sommes reconnus par nos clients pour accroître leur performance opérationnelle.
La transformation digitale est un enjeu majeur pour toute organisation.
La nécessité de digitaliser ses processus, d’imaginer de nouvelles façons d’interagir avec ses clients, d’en conquérir de nouveaux et de proposer de nouveaux outils pour anticiper les besoins de pilotage n’a jamais été aussi forte.
L’univers Data Analytics de TeamWork accompagne les organisations autour de :
La réflexion et identification de cas d’usage pour les transformer en trajectoires moyen et long terme
Le design et l’implémentation de plateforme de données et des outils périphériques (data ingestion/intégration)
La mise en place des premières solutions d’Analytics (Business Intelligence, EPM,)
Support, extension et optimisation des solutions
Dans le cadre du développement de ces activités, nous recrutons un
Data Architect Senior (H/F)
en Freelance pour une mission entre 2 à 3 mois.
Description du poste
En tant qu’Architecte Data vous intervenez dans le cadre de projets et missions qui répondent aux enjeux clients d’exploitation des données. Vous participez aux phases d’avant-vente, aux études d’architecture, et à la réalisation des solutions avec une responsabilité d’encadrement technique des projets (tant sur des forfaits que des missions clients). Vous aurez des missions avec de réelles responsabilités et très diversifiées (secteurs d’activités variés).
Vos principales missions s’articulent autour de :
L’analyse et la qualification des besoins et problématiques « métiers » de nos clients
Assurer la conception, le développement et la mise en oeuvre de l'architecture des données sur la plateforme Databricks
La définition et mise en œuvre des architectures Data adaptées aux contextes des projets : Modern Datawarehouse, LakeHouse, DataMesh etc.
L’accompagnement des Consultants et des Ingénieurs spécialistes Data sur les projets. Vous œuvrez à qualité de leurs réalisations et des livrables.
La collaboration sur tous les domaines d’activités DATA : BI, Big Data, IoT, IA
L’apport d’un regard critique et la capacité à conseiller sur le choix des technologies Data
La participation à la définition des bonnes pratiques de mises en œuvres techniques et la veille à leurs applications selon les méthodes en vigueur (Zero Trust Security, DataOps, Infra-as-Code, Tests automatisés etc.)
Qualifications
Techniques :
Vous avez :
Très bonnes connaissances de Databricks
La capacité à réaliser la conception et l’implémentation de solutions d’analytique à l’échelle de l’entreprise ; SQL
La connaissance d’un ou plusieurs outils ETL (Azure Data Factory ou autres) et Data Visualisation (PowerBI par exemple)
La capacité à mettre en place une solution Data end-to-end La connaissances des typologies d’architectures (Modern Datawarehouse, LakeHouse ou DataMesh)
Vous connaissez l’environnement Azure, MSBI, SQL Server ou si vous avez des notions dans l’IA (Python, R, Machine Learning)
Maitrise le traitement et l'analyse des données en Python (Expérience dans la conception et le développement de processus ETL/ELT)
Maitrise d’outils de traitement et de stockage distribués parmi Hadoop, Spark, Databricks, Snowflake et/ou Kafka
Connaissance des bonnes pratiques de conception d’architecture data (sécurité, disponibilité, scalabilité, confidentialité) et des principes d’une architecture Data Mesh.
Capacité à concevoir des architectures basées sur les services d’une plateforme Cloud : AWS ou Azure
Soft Skills
:
Vous êtes proactif et appréciez travailler dans un environnement ambitieux et innovant.
Vous aimez ne pas rester sur vos acquis et toujours apprendre par le biais de formations, votre veille technologique ou encore par la participation aux événements communautaires.
Habitué à travailler aussi bien de façon autonome qu’à collaborer en équipe
Connaissance des méthodologies Agile (SCRUM ou autres)
Envie d’apprendre et de partager vos savoir-faire
Curiosité
Langues :
Français (Courant)
Anglais (A l’aise en communication orale et écrite)
Formation
:
Véritable passionné par la DATA et diplômé d’une école d’ingénieur (Bac+3 minimum) ou d'une formation spécifique orientée Data avec une expérience significative en Data Engineering et architecture.
Vous avez une expérience de plus de 7 ans en environnement informatique, dont 3 à 4 ans minimum sur un poste senior en environnement Databricks (Team Lead, Architecte ou encore Consultant Senior).
Nous attacherons davantage d’importance à votre capacité à vouloir apprendre et progresser et votre motivation qu’à votre diplôme.
Informations supplémentaires
TeamWork, où votre épanouissement professionnel est clé. Récompensés par le label 'Great Place to Work 2023', nous plaçons l'humain au cœur de notre entreprise.
Au-delà des compétences, nous valorisons les personnalités qui partagent nos valeurs de solidarité et d'esprit d'équipe.
Si ces principes vous parlent, rejoignez-nous ! Nous sommes dédiés à l'équité et à la diversité, ouvrant nos portes à tous les talents, y compris aux personnes en situation de handicap.
Postulez et devenez un acteur de notre réussite collective chez TeamWork.
Show more
Show less","{'ProgLanguage': ['Python', 'Scala', 'R'], 'DataBase': ['SQL'], 'DataAnalytics': ['R'], 'BigData': ['Hadoop', 'Spark', 'Databricks'], 'MachingLearning': [], 'DataSerialization': [], 'DataVisualization': ['PowerBI'], 'Statistics': [], 'CloudComputing': ['AWS', 'Azure'], 'DevTools': ['Git'], 'Os': [], 'DBMS': ['SQL Server', 'Snowflake', 'Snowflake'], 'SoftBigDataProcessing': [], 'Automation': [], 'InfrastructureAsCode': [], 'NetworkSecurty': [], 'Virtualisation': [], 'Containers': [], 'Collaboration': [], 'Other': ['Big Data', 'Machine Learning', 'Cloud'], 'FrSoftSkills': ['Communication', 'Collaboration', 'Organisation'], 'EnSoftSkils': ['Communication', 'Teamwork', 'Collaboration']}","{'JobDetail': ['Senior'], 'TypeContract': [], 'Salary': [], 'Level': ['Bac+3'], 'Experience': ['a', 'n', 's', '7', '7', '7']}"
Airbus Atlantic - Architecte Data (All Gender),Airbus,Greater Saint-Nazaire Area,https://fr.linkedin.com/jobs/view/airbus-atlantic-architecte-data-all-gender-at-airbus-3916426275?position=7&pageNum=2&refId=Hr1jrWraPrOM1ewZklXlRA%3D%3D&trackingId=wNs%2B43IJhU2z4ktFzkencA%3D%3D&trk=public_jobs_jserp-result_search-card,"Job Description
Et si VOTRE aventure avec NOUS commençait ?!
Nous vous proposons de travailler chez Airbus Atlantic, nouveau champion de dimension mondiale, n°2 des aérostructures, n°1 des sièges pilotes et dans le Top 3 des fauteuils passagers Premium.
Notre site Airbus Atlantic basé
à Toulouse (possibilité de travailler à Montoir de Bretagne)
recherche son futur
Architecte Data (All Gender)
Le poste d’architecte Data est rattaché au domaine « Architecture » au sein du département « Architecture Digital & Sécurité ».
Vous serez en interface avec les architectes du Système d'Information et les différents métiers consommateurs des architectures.
Vos Principales Missions Seront Les Suivantes
Fixer les orientations et définir des politiques concernant la modélisation des données, en collaboration avec les autres architectes,
Créer des modèles de données logiques et physiques en utilisant les meilleures pratiques pour garantir une qualité élevée des données et une réduction de leur redondance,
Instancier, implémenter, construire, tester et maintenir les architectures data définies
Analyser, évaluer, tester et recommander les briques technologiques nécessaires pour l’acquisition, l’analyse et l’implémentation des données,
Analyser les problèmes d'intégration des systèmes liés aux données et proposer des solutions appropriées,
Déterminer les « Data set process » c’est à dire comment les données sont intégrées et transformées pour qu’elles soient prêtes à être analysées (ex : ETL)
Participer aux processus d'extraction performants et qualitatifs des données des sources requises afin de répondre aux besoins de l'entreprise
Maintenir les modèles de données conceptuels, logiques et physiques ainsi que les métadonnées correspondantes (pour la data gouvernance).
Développer les meilleures pratiques pour les conventions de dénomination standard et les pratiques de codage afin d'assurer la cohérence des modèles de données,
Respecter les normes de sécurité des données, de contrôle des exportations et de protection des données.
Construire les pipelines qui permettront aux Data Scientist/Analysts/Developers de mettre leurs modèles en production
Etre garant de la fiabilité, de la qualité et de l’efficacité du traitement des données
Maintenir les modèles créés.
Participer aux idéations et proposer des innovations aux services.
Documenter ses activités et mettre à jour le référentiel documentaire.
Parlons de vous !
Vous disposez d'une
e
xp
érience de minimum 5 ans en Data & Informatique sur un poste similaire.
Les compétences techniques à détenir pour le poste :
L’optimisation et les standards Qualité des données informatiques
Comprendre et savoir mettre en place les différentes Structure et stockage de données
Gestion des problèmes lié à la donnée, l'architecture
Idéalement, l'expérience des technologies suivantes serait un plus : Ressources & services data MS Azure (Databricks, Azure ML …), SGBD (SQL, MongoDB, PostGreSQL, redis), Outils ETL (Qlik replicate, Alteryx, …), Outils BI (PowerBI, Qlik, Grafana ...),
Langages de programmation (python, SCALA, R, DAX)
Les certifications de Azure (DP-203, AZ-300, AZ-303, AZ-304, AZ-400, AI-900) seraient un plus,
Votre Personnalité
Fort volonté de travailler en équipe
Bonnes habitudes de documentation
Niveau avancé en Français et en Anglais (niveau minimum B1)
Faire preuve d’innovation et être source de proposition
Savoir exprimer ses idées de manière claire et concise
Etre à l'écoute
Parlons de nous !
Environnement & Conditions De Travail
Airbus Atlantic c’est aussi :
Prendre part à des projets ambitieux, à la pointe de la technologie pour construire l’avion de demain, en lien avec les enjeux environnementaux.
Un environnement qui valorise la proximité et la dimension humaine, au sein d’un collectif engagé et solidaire.
L’opportunité d’apprendre et d’évoluer tout au long de votre parcours, en étant accompagné dans votre développement pour une carrière sur-mesure.
Avoir la liberté d’entreprendre et de laisser libre court à vos initiatives.
Ses conditions de travail attractives et ses avantages : restaurant d’entreprise sur site, CSE (avantages loisirs & famille), parking entreprise, mutuelle d’entreprise (famille).
Sa politique de diversité et d'inclusion : Airbus Atlantic s’engage en faveur de l’égalité des chances pour tous.
Son plan d'actionnariat salarié et son plan d’épargne salariale.
Notre Processus De Recrutement
Nous avons à cœur de mieux vous connaître et de comprendre ce qui vous motive à nous rejoindre. Aussi, notre process de recrutement se déroule en plusieurs étapes après analyse de votre candidature :
Entretien vidéo différé via la plateforme Hirevue
Entretien avec le Manager Recruteur
Entretien avec le/la Chargé(e) de Recrutement qui peut être complété par un questionnaire de personnalité
Entretien avec le/la Human Resources Business Partner.
This job requires an awareness of any potential compliance risks and a commitment to act with integrity, as the foundation for the Company’s success, reputation and sustainable growth.
Company
Airbus Atlantic
Contract Type
Permanent
Classe Emploi (France): Classe G13
Experience Level
Professional
Job Family
Digital
By submitting your CV or application you are consenting to Airbus using and storing information about you for monitoring purposes relating to your application or future employment. This information will only be used by Airbus.
Airbus is committed to achieving workforce diversity and creating an inclusive working environment. We welcome all applications irrespective of social and cultural background, age, gender, disability, sexual orientation or religious belief.
Airbus is, and always has been, committed to equal opportunities for all. As such, we will never ask for any type of monetary exchange in the frame of a recruitment process. Any impersonation of Airbus to do so should be reported to emsom@airbus.com.
At Airbus, we support you to work, connect and collaborate more easily and flexibly. Wherever possible, we foster flexible working arrangements to stimulate innovative thinking.
Show more
Show less","{'ProgLanguage': ['Python', 'Scala', 'R', 'Go'], 'DataBase': ['SQL', ' MongoDB'], 'DataAnalytics': ['R'], 'BigData': ['Databricks'], 'MachingLearning': [], 'DataSerialization': [], 'DataVisualization': ['PowerBI'], 'Statistics': [], 'CloudComputing': ['Azure'], 'DevTools': ['Git'], 'Os': [], 'DBMS': ['PostgreSQL'], 'SoftBigDataProcessing': [], 'Automation': [], 'InfrastructureAsCode': [], 'NetworkSecurty': [], 'Virtualisation': [], 'Containers': [], 'Collaboration': [], 'Other': ['ML'], 'FrSoftSkills': ['Collaboration'], 'EnSoftSkils': ['Collaboration', 'Initiative']}","{'JobDetail': [], 'TypeContract': [], 'Salary': [], 'Level': [], 'Experience': ['a', 'n', 's', '5', '5', '5']}"
