title,company,location,link,description,skills,details
Architecte / Conseil Data H/F,EXAKIS NELITE,"Grenoble, Auvergne-Rhône-Alpes, France",https://fr.linkedin.com/jobs/view/architecte-conseil-data-h-f-at-exakis-nelite-3813458944?position=34&pageNum=0&refId=LKlSDx2iXah6OaZeWO8rpg%3D%3D&trackingId=x8E%2FuP03vnH2E2KVcZaitw%3D%3D&trk=public_jobs_jserp-result_search-card,"Exakis Nelite, entité du groupe
Magellan Partners
, est le
1er partenaire pure-player Microsoft
indépendant en France avec l’ambition de devenir le premier partenaire Européen et en Afrique Francophone avec sa forte présence au Maroc.
Nés du rapprochement de 2 leaders spécialistes de l’intégration des solutions Microsoft, nous allions expertise technique et fonctionnelle pour répondre concrètement aux enjeux de demain : accélération de la transformation digitale,
CyberSécurité, Intelligence Artificielle, IoT, Data, transformation vers le cloud Azure, Services Cognitifs …
En rejoignant la communauté Exakis Nelite dans l’une de nos 12 agences (680 collaborateurs), vous intégrerez une équipe passionnée et impliquée dans les projets les plus innovants. Vous rejoindrez une structure construite autour de valeurs tournées vers ses collaborateurs : intelligence collective, convivialité et bienveillance.
Exakis Nelite a reçu la certification
Great Place to Work
et se place
3ème de sa catégorie
en 2024 parmi les entreprises où il fait bon travailler en France !
À quoi ressembleront vos futures missions ?
En tant qu’Architecte et Conseil, dans les domaines Data et Business Intelligence, vous serez amené à travailler sur des projets d’envergure mettant à l’épreuve votre expérience des systèmes de données et votre ouverture vers les technologies de BI moderne et cloud.
Votre rôle d’architecte et de conseil auprès de nos clients trouvera son sens dans la compétence que pourrez apporter autour des solutions Microsoft (Power BI, Azure…), et aussi dans la connaissance globale que vous aurez acquise par vos expériences variées. Cette combinaison compétence/expérience aura pour but d’orchestrer l’implémentation des technologies Microsoft dans des systèmes d’information et décisionnels technologiquement hétérogènes.
Votre passion, votre curiosité et votre envie sont les maîtres mots pour réussir dans ce poste. Vous êtes motivé pour travailler dans un environnement dynamique où la donnée se décline autour de nos projets innovants (IoT, Industrie 4.0, IA…). Vous avez une vision claire des enjeux actuels autour de la donnée.
Description du poste
Selon les missions vous serez amené à :
Accompagner nos clients dans leur stratégie digitale
Animer des ateliers d’architecture technique
Appréhender les besoins fonctionnels et les contraintes techniques du client
Préconiser des architectures complexes pour répondre à une problématique ou un besoin métier
Définir et améliorer les standards, patterns d’architecture et le catalogue de services
Superviser et mettre en œuvre, dans le cadre des projets, les préconisations techniques établies dans le cadre des cahiers des charges
Réaliser l’architecture de données dans des environnements on Premise
Intervenir sur l’architecture Azure data
Rédiger les documents associés (HLD, LLD, etc.)
Piloter des projets et des hommes
Intervenir en toute autonomie sur les phases de cadrage technique et/ou avant ventes
Assurer une veille technologique
Profil
Fort d’une expérience de 3 à 15 ans dans les domaines, Data, BI et Big Data, vous portez de l’intérêt aux technologies du Cloud, aux approches de BI moderne et à leur développement. Vous êtes un professionnel aguerri des environnements Data, de l’architecture et de l’utilisation des technologies Cloud.
La connaissance des environnements Microsoft (Power BI, SQL Server, Azure…) est un plus mais n’est pas une obligation. La diversité de vos expériences dans le champ d’activité Data/BI est le facteur clef de succès de ce poste.
Curieux et dynamique, vous avez le gout du challenge et souhaitez prendre part au développement important d’Exakis Nelite et de Magellan Partners dans le domaine des Data-sciences.
Show more
Show less","{'ProgLanguage': ['R', 'Go'], 'DataBase': ['SQL'], 'DataAnalytics': ['R'], 'BigData': [], 'MachingLearning': [], 'DataSerialization': [], 'DataVisualization': ['Power BI'], 'Statistics': [], 'CloudComputing': ['Azure'], 'DevTools': ['Git'], 'Os': [], 'DBMS': ['SQL Server'], 'SoftBigDataProcessing': [], 'Automation': [], 'InfrastructureAsCode': [], 'NetworkSecurty': [], 'Virtualisation': [], 'Containers': [], 'Collaboration': [], 'Other': ['Big Data', 'Cloud'], 'FrSoftSkills': [], 'EnSoftSkils': []}","{'JobDetail': [], 'TypeContract': [], 'Salary': [], 'Level': [], 'Experience': ['a', 'n', 's', '15', '15', '15']}"
Airbus Atlantic - Architecte Data (All Gender),Airbus,"Toulouse, Occitanie, France",https://fr.linkedin.com/jobs/view/airbus-atlantic-architecte-data-all-gender-at-airbus-3916426276?position=35&pageNum=0&refId=LKlSDx2iXah6OaZeWO8rpg%3D%3D&trackingId=88boRhkPs1oWs1A4Z0Mzgg%3D%3D&trk=public_jobs_jserp-result_search-card,"Job Description
Et si VOTRE aventure avec NOUS commençait ?!
Nous vous proposons de travailler chez Airbus Atlantic, nouveau champion de dimension mondiale, n°2 des aérostructures, n°1 des sièges pilotes et dans le Top 3 des fauteuils passagers Premium.
Notre site Airbus Atlantic basé
à Toulouse (possibilité de travailler à Montoir de Bretagne)
recherche son futur
Architecte Data (All Gender)
Le poste d’architecte Data est rattaché au domaine « Architecture » au sein du département « Architecture Digital & Sécurité ».
Vous serez en interface avec les architectes du Système d'Information et les différents métiers consommateurs des architectures.
Vos Principales Missions Seront Les Suivantes
Fixer les orientations et définir des politiques concernant la modélisation des données, en collaboration avec les autres architectes,
Créer des modèles de données logiques et physiques en utilisant les meilleures pratiques pour garantir une qualité élevée des données et une réduction de leur redondance,
Instancier, implémenter, construire, tester et maintenir les architectures data définies
Analyser, évaluer, tester et recommander les briques technologiques nécessaires pour l’acquisition, l’analyse et l’implémentation des données,
Analyser les problèmes d'intégration des systèmes liés aux données et proposer des solutions appropriées,
Déterminer les « Data set process » c’est à dire comment les données sont intégrées et transformées pour qu’elles soient prêtes à être analysées (ex : ETL)
Participer aux processus d'extraction performants et qualitatifs des données des sources requises afin de répondre aux besoins de l'entreprise
Maintenir les modèles de données conceptuels, logiques et physiques ainsi que les métadonnées correspondantes (pour la data gouvernance).
Développer les meilleures pratiques pour les conventions de dénomination standard et les pratiques de codage afin d'assurer la cohérence des modèles de données,
Respecter les normes de sécurité des données, de contrôle des exportations et de protection des données.
Construire les pipelines qui permettront aux Data Scientist/Analysts/Developers de mettre leurs modèles en production
Etre garant de la fiabilité, de la qualité et de l’efficacité du traitement des données
Maintenir les modèles créés.
Participer aux idéations et proposer des innovations aux services.
Documenter ses activités et mettre à jour le référentiel documentaire.
Parlons de vous !
Vous disposez d'une
e
xp
érience de minimum 5 ans en Data & Informatique sur un poste similaire.
Les compétences techniques à détenir pour le poste :
L’optimisation et les standards Qualité des données informatiques
Comprendre et savoir mettre en place les différentes Structure et stockage de données
Gestion des problèmes lié à la donnée, l'architecture
Idéalement, l'expérience des technologies suivantes serait un plus : Ressources & services data MS Azure (Databricks, Azure ML …), SGBD (SQL, MongoDB, PostGreSQL, redis), Outils ETL (Qlik replicate, Alteryx, …), Outils BI (PowerBI, Qlik, Grafana ...),
Langages de programmation (python, SCALA, R, DAX)
Les certifications de Azure (DP-203, AZ-300, AZ-303, AZ-304, AZ-400, AI-900) seraient un plus,
Votre Personnalité
Fort volonté de travailler en équipe
Bonnes habitudes de documentation
Niveau avancé en Français et en Anglais (niveau minimum B1)
Faire preuve d’innovation et être source de proposition
Savoir exprimer ses idées de manière claire et concise
Etre à l'écoute
Parlons de nous !
Environnement & Conditions De Travail
Airbus Atlantic c’est aussi :
Prendre part à des projets ambitieux, à la pointe de la technologie pour construire l’avion de demain, en lien avec les enjeux environnementaux.
Un environnement qui valorise la proximité et la dimension humaine, au sein d’un collectif engagé et solidaire.
L’opportunité d’apprendre et d’évoluer tout au long de votre parcours, en étant accompagné dans votre développement pour une carrière sur-mesure.
Avoir la liberté d’entreprendre et de laisser libre court à vos initiatives.
Ses conditions de travail attractives et ses avantages : restaurant d’entreprise sur site, CSE (avantages loisirs & famille), parking entreprise, mutuelle d’entreprise (famille).
Sa politique de diversité et d'inclusion : Airbus Atlantic s’engage en faveur de l’égalité des chances pour tous.
Son plan d'actionnariat salarié et son plan d’épargne salariale.
Notre Processus De Recrutement
Nous avons à cœur de mieux vous connaître et de comprendre ce qui vous motive à nous rejoindre. Aussi, notre process de recrutement se déroule en plusieurs étapes après analyse de votre candidature :
Entretien vidéo différé via la plateforme Hirevue
Entretien avec le Manager Recruteur
Entretien avec le/la Chargé(e) de Recrutement qui peut être complété par un questionnaire de personnalité
Entretien avec le/la Human Resources Business Partner.
This job requires an awareness of any potential compliance risks and a commitment to act with integrity, as the foundation for the Company’s success, reputation and sustainable growth.
Company
Airbus Atlantic
Contract Type
Permanent
Classe Emploi (France): Classe G13
Experience Level
Professional
Job Family
Digital
By submitting your CV or application you are consenting to Airbus using and storing information about you for monitoring purposes relating to your application or future employment. This information will only be used by Airbus.
Airbus is committed to achieving workforce diversity and creating an inclusive working environment. We welcome all applications irrespective of social and cultural background, age, gender, disability, sexual orientation or religious belief.
Airbus is, and always has been, committed to equal opportunities for all. As such, we will never ask for any type of monetary exchange in the frame of a recruitment process. Any impersonation of Airbus to do so should be reported to emsom@airbus.com.
At Airbus, we support you to work, connect and collaborate more easily and flexibly. Wherever possible, we foster flexible working arrangements to stimulate innovative thinking.
Show more
Show less","{'ProgLanguage': ['Python', 'Scala', 'R', 'Go'], 'DataBase': ['SQL', ' MongoDB'], 'DataAnalytics': ['R'], 'BigData': ['Databricks'], 'MachingLearning': [], 'DataSerialization': [], 'DataVisualization': ['PowerBI'], 'Statistics': [], 'CloudComputing': ['Azure'], 'DevTools': ['Git'], 'Os': [], 'DBMS': ['PostgreSQL'], 'SoftBigDataProcessing': [], 'Automation': [], 'InfrastructureAsCode': [], 'NetworkSecurty': [], 'Virtualisation': [], 'Containers': [], 'Collaboration': [], 'Other': ['ML'], 'FrSoftSkills': ['Collaboration'], 'EnSoftSkils': ['Collaboration', 'Initiative']}","{'JobDetail': [], 'TypeContract': [], 'Salary': [], 'Level': [], 'Experience': ['a', 'n', 's', '5', '5', '5']}"
DATA / ARCHITECT Manager,SIBIOS,"Lyon, Auvergne-Rhône-Alpes, France",https://fr.linkedin.com/jobs/view/data-architect-manager-at-sibios-3881612188?position=36&pageNum=0&refId=LKlSDx2iXah6OaZeWO8rpg%3D%3D&trackingId=SAcquf4FODRAmTAPdVgKRQ%3D%3D&trk=public_jobs_jserp-result_search-card,"SIBIOS recherche un consultant Senior DATA / ARCHITECT Manager avec minium 10 ans d'expérience pour un nouveau projet dans le secteur industriel.
Une bonne connaissance d'architecture fonctionnelle et l'urbanisation data, ainsi que des règles de sécurité.
Vous avez une maîtrise de la gestion des données et des outils/langages correspondants (SQL, Power BI, modélisation et visualisation des données, ...)
Diriger des projets Data sur divers domaines fonctionnels (Métier et IT) pour définir les feuilles de route.
Définir la gouvernance de chaque projet et suivre le planning, le budget, la qualité et les risques sur chaque projet
Piloter la gestion du changement et communiquer autour des projets
Industrialisation des innovations digitales : gouvernance, socle technique, documentation et support
Pour un entretien immédiat, merci de nous faire suivre votre cv mis á jour en word format ainsi que votre date de disponibilité et TJM.
Show more
Show less","{'ProgLanguage': ['R', 'Go'], 'DataBase': ['SQL'], 'DataAnalytics': ['R'], 'BigData': [], 'MachingLearning': [], 'DataSerialization': [], 'DataVisualization': ['Power BI'], 'Statistics': [], 'CloudComputing': [], 'DevTools': ['Git'], 'Os': [], 'DBMS': [], 'SoftBigDataProcessing': [], 'Automation': [], 'InfrastructureAsCode': [], 'NetworkSecurty': [], 'Virtualisation': [], 'Containers': [], 'Collaboration': [], 'Other': [], 'FrSoftSkills': [], 'EnSoftSkils': []}","{'JobDetail': ['Senior'], 'TypeContract': [], 'Salary': [], 'Level': [], 'Experience': ['a', 'n', 's', '10', '10', '10']}"
Architecte Data,Sibylone,"Paris, Île-de-France, France",https://fr.linkedin.com/jobs/view/architecte-data-at-sibylone-3888828561?position=37&pageNum=0&refId=LKlSDx2iXah6OaZeWO8rpg%3D%3D&trackingId=ma%2F%2BKT6%2BQdGHjRRbN33e8w%3D%3D&trk=public_jobs_jserp-result_search-card,"SIBYLONE, société de conseil spécialisée dans les systèmes d’information de synthèse et de pilotage, aide ses clients à tirer toute la valeur de leur patrimoine de données, levier stratégique majeur de développement et de rentabilité.
Notre ambition : rendre les différents acteurs de l’entreprise autonomes dans l’exploitation des données, libérer les usages Métier, pour qu’ils soient en mesure de relever les défis de performance, de couverture de risque, de financement, de conquête client, de RSE… qui s’imposent à eux.
Spécialistes reconnus, nos consultants s’appuient pour cela sur une connaissance approfondie de l’activité business de nos clients, en lien avec nos trois piliers que sont le Métier, la Data et le Projet.
Vos missions
Réaliser
les études de faisabilité technique et proposer une
migration vers le Cloud.
Assister et conseiller
les équipes dans les différentes étapes des projets
Prendre en charge
les instructions d’études techniques (réalisation des livrables correspondant, coordination des contributeurs techniques)
Construire
l’architecture technique et de sécurité des applications concernés
Définir et concevoir
les architectures techniques des projets métiers
Garantir
l’exploitabilité, l’évolutivité et la performance des architectures proposées
Collaborer et animer
la communauté d’experts techniques pour définir les bonnes pratiques d’architecture et d’exploitabilité des solutions
Documenter et partager
les modes opératoires suite aux migrations effectuées.
Rédiger et présenter
les dossiers d’architecture devant les différents comités de validation
Réaliser la veille technologique
sur les outils et pratiques de développement
Assurer
la cohérence et l’industrialisation du SI
Optimiser
le design de l’architecture et le dimensionnement des infrastructures en fonction des évolutions des besoins
Vous évoluerez dans un environnement technique nécessitant une
bonne maîtrise des architectures n-tiers, des problématiques liées au Cloud, des API (Management, REST) et webservices.
Pourquoi pas vous ?
Formation supérieure Bac +5 en informatique
Expérience réussie de migration de workflow on premise vers le Cloud.
Connaissances techniques dans certains des domaines suivants : design de blueprint Cloud, architecture de bases de données, technologies Big Data Analytics, Machine Learning, virtualisation, architecture de stockage, sécurité.
Première bonne expérience réussie dans un ou des projets de transformation et de transitions vers le Cloud.
Expérience > 6 ans en conception d’applications au sens large
Une expérience dans un environnement agile est un plus
Les + Sibylone !
Evoluer au sein d’une société qui exige le meilleur de ses collaborateurs tout en cultivant la cohésion et l’esprit d’équipe !
S’engager dans une politique RSE exigeante : labellisation Ecovadis
Avoir un Partenariat EcoTree France : 1 recrutement = 1 arbre planté !
Un Lab RSE ouvert à tous, pour améliorer la qualité de vie au travail des collaborateurs et nos engagements environnementaux au sein de SIBYLONE
Contribuer activement au bien-être de ses collaborateurs : participation aux frais d’abonnements activités ou achat 2 roues
Avoir de nombreux moments de convivialités : séminaires, afterworks, conférences et petits déjeuners, sports en groupe via l’application Gymlib
Les actions et missions solidaires : notre partenariat avec la start-up spécialisée en RSE Vendredi permet à nos collaborateurs de réaliser des missions auprès d’associations
Donner une offre de formation innovante et à la pointe des nouvelles technologies
Accord de télétravail en vigueur
Vous vous reconnaissez dans la description du poste ?
Vous souhaitez travailler dans un environnement stimulant et dynamique ?
Vous souhaitez rejoindre une société ambitieuse ?
Vous souhaitez comprendre l’origine de Sibylone ?
Venez-nous rencontrer : Notre Team Talent Acquisition
sera ravie d’échanger avec vous !
Ce poste est ouvert aux personnes en situation de handicap.
Show more
Show less","{'ProgLanguage': ['R'], 'DataBase': [], 'DataAnalytics': ['R'], 'BigData': [], 'MachingLearning': [], 'DataSerialization': [], 'DataVisualization': [], 'Statistics': [], 'CloudComputing': [], 'DevTools': [], 'Os': [], 'DBMS': [], 'SoftBigDataProcessing': [], 'Automation': [], 'InfrastructureAsCode': [], 'NetworkSecurty': [], 'Virtualisation': [], 'Containers': [], 'Collaboration': [], 'Other': ['Big Data', 'ML', 'Machine Learning', 'Cloud'], 'FrSoftSkills': [], 'EnSoftSkils': []}","{'JobDetail': [], 'TypeContract': [], 'Salary': [], 'Level': [], 'Experience': ['a', 'n', 's', '6', '6', '6']}"
