title,company,location,link,description,skills,details
"Architecte Avant-Vente Cloud Application, Data & Innovation H/F",EXAKIS NELITE,Greater Lyon Area,https://fr.linkedin.com/jobs/view/architecte-avant-vente-cloud-application-data-innovation-h-f-at-exakis-nelite-3813459501?position=10&pageNum=7&refId=eGRce79h42IyMfX8LUiQzA%3D%3D&trackingId=%2BRlEXENWAcYvhUmnQvLNug%3D%3D&trk=public_jobs_jserp-result_search-card,"Exakis Nelite, entité du groupe
Magellan Partners
, est le
1er partenaire pure-player Microsoft
indépendant en France avec l’ambition de devenir le premier partenaire Européen et en Afrique Francophone avec sa forte présence au Maroc.
Nés du rapprochement de 2 leaders spécialistes de l’intégration des solutions Microsoft, nous allions expertise technique et fonctionnelle pour répondre concrètement aux enjeux de demain : accélération de la transformation digitale,
CyberSécurité, Intelligence Artificielle, IoT, Data, transformation vers le cloud Azure, Services Cognitifs …
En rejoignant la communauté Exakis Nelite dans l’une de nos 12 agences (680 collaborateurs), vous intégrerez une équipe passionnée et impliquée dans les projets les plus innovants. Vous rejoindrez une structure construite autour de valeurs tournées vers ses collaborateurs : intelligence collective, convivialité et bienveillance.
Exakis Nelite a reçu la certification
Great Place to Work
et se place
3ème de sa catégorie
en 2024 parmi les entreprises où il fait bon travailler en France !
Selon les missions vous serez amené à :
Aborder une posture de conseil pour accompagner nos clients stratégiques
Définir les offres et propositions de valeurs qui feront le portefeuille de services autour de la transformation digitale vers le Cloud
Assurer le Bid Management des réponses commerciales au client
Définir, choisir et argumenter des architectures applicatives et techniques
Imaginer des scénarios de valorisation des données
Concevoir une architecture en adéquation avec les besoins métier
Prendre en considération les problématiques de performance et de sécurité
Accompagner l’intégration des solutions dans le système d’information
Réaliser de la veille technologique sur les solutions et les innovations
Accompagner nos équipes de Delivery et nos experts dans la prise en compte des nouveaux enjeux, des projets, et des solutions
Participer et piloter les phases critiques des projets innovants
Mettre en place des partenariats avec les acteurs clés du marché
C’est pour vous si ...
De formation BAC+5 idéalement en ingénierie, vous justifiez d’un minimum de 10 ans d’expérience dont 5 sur des sujets d’architecture dans le cadre de projets de développement Cloud et Data à forte valeur ajoutée.
Vous avez la capacité de :
Leader les avant ventes structurantes
Proposer des orientations stratégiques autour des applications à destination du Cloud public et de la gouvernance de la Data
Relever des défis pour répondre aux enjeux des clients
Être force de proposition
Coacher, animer, et suivre des consultants passionnés
Vous avez une expertise avérée sur plusieurs des domaines suivants :
Les services Cloud tels qu’Azure, Azure DevOps, Github (Git, Action), Développement back-end : .NET (Core, Framework, Standard), Écosystème Azure, Node.js …
Développement front-end : Vue.js, React, Angular, TypeScript, …, CI/CD, TDD/BDD, DevSecOps,Docker, Kubernetes,Infrastructure as code, ARM, Terraform, Ansible, Architecture micro services, DDD, Event Storming, CQRS
Solution de stockage des données : SQL Server, Cosmos DB, Redis Cache, MongoDB, Apache Spark, Gremlin, Big Data, SQL DatawareHouse, Datalake…
IoT, Service d’Intelligence Artificielle et Machine Learning, SmartCity et Smart Building, Industry 4.0
Show more
Show less","{'ProgLanguage': ['R', 'Go'], 'DataBase': ['SQL', ' MongoDB'], 'DataAnalytics': ['R'], 'BigData': ['Spark'], 'MachingLearning': [], 'DataSerialization': [], 'DataVisualization': [], 'Statistics': [], 'CloudComputing': ['Azure'], 'DevTools': ['Git', 'Docker'], 'Os': [], 'DBMS': ['SQL Server'], 'SoftBigDataProcessing': [], 'Automation': ['Ansible', 'Kubernetes'], 'InfrastructureAsCode': ['Terraform'], 'NetworkSecurty': [], 'Virtualisation': [], 'Containers': ['Docker', 'Kubernetes'], 'Collaboration': [], 'Other': ['DevOps', 'Big Data', 'ML', 'Machine Learning', 'Cloud', 'CI/CD'], 'FrSoftSkills': [], 'EnSoftSkils': []}","{'JobDetail': [], 'TypeContract': [], 'Salary': [], 'Level': ['Bac+5'], 'Experience': ['a', 'n', 's', '10', '10', '10']}"
"Solutions Architect, Migration & Modernization",Amazon Web Services (AWS),"Paris, Île-de-France, France",https://fr.linkedin.com/jobs/view/solutions-architect-migration-modernization-at-amazon-web-services-aws-3877272046?position=1&pageNum=10&refId=g8dI2iv69kKCojjJFhfDsg%3D%3D&trackingId=m9NcLi%2BfS56gYAt1RJJWbQ%3D%3D&trk=public_jobs_jserp-result_search-card,"Description
As a Migration & Modernisation Specialist Solutions Architect at AWS, you’ll build technical relationships with customers of all sizes and develop solutions to accelerate their cloud migration journey. You will operate as their trusted advisor, ensuring they get the most out of the cloud at every stage of their journey. You will engage with senior customer leaders and technical stakeholders to help them achieve increased agility and significant business value by leading their migration to AWS.
You’ll manage the technical relationship between AWS and our customers, making recommendations on security, cost, performance, reliability and operational efficiency to accelerate their large scale Migration projects.
Internally, you will be the voice of the customer, sharing their needs and wants to inform the roadmap of AWS features. Externally, The Migration & Modernization Specialist Solutions Architect works with senior enterprises, helping them to effectively lead their migration assessment readiness and strategy.
In this role, your creativity will link technology to tangible solutions, with the opportunity to define cloud-native reference architectures for a variety of use cases.
You will participate in the creation and sharing of best practices, technical content and new reference architectures (e.g. white papers, code samples, blog posts) and evangelize and educate about AWS technology (e.g. through workshops, user groups, meetups, public speaking, online videos or conferences).
Can you work equally well with executives and technologists, leading high-visibility, high-impact IT transformation projects that are technically broad and deep? Do you understand the technical challenges of enterprise level cloud migration projects?
Come and build the future with us!
AWS Sales, Marketing, and Global Services (SMGS) is responsible for driving revenue, adoption, and growth from the largest and fastest growing small- and mid-market accounts to enterprise-level customers including public sector. The AWS Global Support team interacts with leading companies and believes that world-class support is critical to customer success. AWS Support also partners with a global list of customers that are building mission-critical applications on top of AWS services.
About The Team
Diverse Experiences
Amazon values diverse experiences. Even if you do not meet all of the preferred qualifications and skills listed in the job description, we encourage candidates to apply. If your career is just starting, hasn’t followed a traditional path, or includes alternative experiences, don’t let it stop you from applying.
Why AWS
Amazon Web Services (AWS) is the world’s most comprehensive and broadly adopted cloud platform. We pioneered cloud computing and never stopped innovating — that’s why customers from the most successful startups to Global 500 companies trust our robust suite of products and services to power their businesses.
Work/Life Balance
We value work-life harmony. Achieving success at work should never come at the expense of sacrifices at home, which is why flexible work hours and arrangements are part of our culture. When we feel supported in the workplace and at home, there’s nothing we can’t achieve in the cloud.
Inclusive Team Culture
Here at AWS, it’s in our nature to learn and be curious. Our employee-led affinity groups foster a culture of inclusion that empower us to be proud of our differences. Ongoing events and learning experiences, including our Conversations on Race and Ethnicity (CORE) and AmazeCon (gender diversity) conferences, inspire us to never stop embracing our uniqueness.
Mentorship and Career Growth
We’re continuously raising our performance bar as we strive to become Earth’s Best Employer. That’s why you’ll find endless knowledge-sharing, mentorship and other career-advancing resources here to help you develop into a better-rounded professional.
We are open to hiring candidates to work out of one of the following locations:
Courbevoie, 75, FRA | Courbevoie, FRA | Paris, 75, FRA | Paris, FRA
Basic Qualifications
Background in any of the following: Cloud Architecture, Systems Design, Software Development, Infrastructure Architecture, Data Engineering or DevOps
Technical Degree (Computer Science, Maths, Engineering or equivalent) and/or relevant tech experience.
Fluent written and verbal communication skills in English, and French
A passion for technology and for learning
Preferred Qualifications
In-depth knowledge in a technology domain such as: Infrastructure architecture; Database architecture; Networking; Zero downtime migrations, IT Security; Data Center Operations, Cloud operating models, Software design or development
Experience working in a customer-facing role or a role which involved public speaking
AWS certification (e.g. AWS Solutions Architect Associate or Professional) or other industry certification
Amazon est un employeur engagé pour l'égalité des chances. Nous sommes convaincus qu'une main d'oeuvre diversifée est essentielle à notre réussite. Nous prenons nos décisions de recrutement en fonction de votre expérience et de vos compétences. Nous apprécions votre envie de découvrir, d'inventer, de simplifier et de construire. La protection de votre vie privée et la sécurité de vos données constituent depuis longtemps une priorité absolue pour Amazon. Veuillez consulter notre Politique de Confidentialité pour en savoir plus sur la façon dont nous collectons, utilisons et traitons les données personnelles de nos candidats.
Company
- AWS EMEA SARL (France Branch) - G48
Job ID: A2600188
Show more
Show less","{'ProgLanguage': ['R', 'Go'], 'DataBase': [], 'DataAnalytics': ['R'], 'BigData': [], 'MachingLearning': [], 'DataSerialization': [], 'DataVisualization': [], 'Statistics': [], 'CloudComputing': ['AWS'], 'DevTools': [], 'Os': [], 'DBMS': [], 'SoftBigDataProcessing': [], 'Automation': [], 'InfrastructureAsCode': [], 'NetworkSecurty': [], 'Virtualisation': [], 'Containers': [], 'Collaboration': [], 'Other': ['DevOps', 'Cloud'], 'FrSoftSkills': ['Communication'], 'EnSoftSkils': ['Communication', 'Creativity']}","{'JobDetail': ['Senior'], 'TypeContract': [], 'Salary': [], 'Level': [], 'Experience': ['a', 'n', 's']}"
Staff Data Architect,Komodo Health,"Paris, Île-de-France, France",https://fr.linkedin.com/jobs/view/staff-data-architect-at-komodo-health-3831726901?position=2&pageNum=10&refId=g8dI2iv69kKCojjJFhfDsg%3D%3D&trackingId=oh1%2B%2F9jozU4D%2FMtD5OxzjA%3D%3D&trk=public_jobs_jserp-result_search-card,"We Breathe Life Into Data
At Komodo Health, our mission is to reduce the global burden of disease. And we believe that smarter use of data is essential to this mission. That's why we built the Healthcare Map — the industry's largest, most complete, precise view of the U.S. healthcare system — by combining de-identified, real-world patient data with innovative algorithms and decades of clinical experience. The Healthcare Map serves as our foundation for a powerful suite of software applications, helping us answer healthcare's most complex questions for our partners. Across the healthcare ecosystem, we're helping our clients unlock critical insights to track detailed patient behaviors and treatment patterns, identify gaps in care, address unmet patient needs, and reduce the global burden of disease.
As we pursue these goals, it remains essential to us that we stay grounded in our values: be awesome, seek growth, deliver ""wow,"" and enjoy the ride. At Komodo, you will be joining a team of ambitious, supportive Dragons with diverse backgrounds but a shared passion to deliver on our mission to reduce the burden of disease — and enjoy the journey along the way.
The Opportunity at Komodo Health
Komodo aims to build the best healthcare data analytics platform in the industry. As we are maturing, we are investing in our core data assets, building on our strengths in medical and prescription claims, to create the best healthcare data management system to support self-service exploration and advanced analytics.
The Staff Data Architect will act as a key enabler and contributor to the different engineering teams in enhancing their maturity in terms of adopting modern data stack for healthcare data ingestion, preparation & analytics. This position will integrate the transversal Office of the CTO (OCTO) group.
Looking back on your first 12 months at Komodo Health, you will have…
Supported the design, development and deployment in production of end-to-end data flows, including compute and storage of big healthcare datasets in a multi-tenant environment.
Advised on technologies, scout and identified technologies which can support our heavy data processing constraints for cleansing & analytics
Developed data pipelines in modern data stack environment
Interacted with the product teams in order to refine technical assumptions
Enabled our Engineering teams in adopting the best practices and maturing their techniques to develop and operate SaaS data pipelines.
What you bring to Komodo Health:
Creative spirit that develops and seeks ideas. Screening of various sensors and innovation source
Proficiency in a data processing-friendly language (Python, Java, SQL…)
Expertise in Big Data environment (Spark, K8S, Databricks, AWS Glue, Snowflake)
Strong understanding of modern data modeling and data architecture practices, including Data Governance and Data Quality & Ops;
Deep knowledge of change data capture and event-driven architectures.
Proficiency in cloud-native orchestrators (Serverless, Kubernetes, Docker...) is a plus;
Demonstrated capabilities to communicate to business and technical stakeholders and work across departments
Ability to communicate effectively and clearly in English, both verbally and in writing.
Experience in working within a distributed & international agile team environment.
Additionally:
Passion! We hope you are passionate about our mission and technology
Ownership! We hope you own your work, be accountable, and push it through the finish line. We hope you treat yourself as a cofounder and do not hesitate to share any idea that helps Komodo
Expertise! We do not need you to know everything, but we hope you have deep knowledge in at least one area and can start contributing quickly. And we would love to learn from you in your area(s) of expertise
Where You'll Work
Komodo Health has a hybrid work model; we recognize the power of choice and importance of flexibility for the well-being of both our company and our individual Dragons. Roles may be completely remote based anywhere in the country listed, remote but based in a specific region, or local (commuting distance) to one of our hubs in San Francisco, New York City, or Chicago with remote work options.
What We Offer
This position will be eligible for company benefits in accordance with Company policy. We offer a competitive total rewards package including medical, dental and vision coverage along with a broad range of supplemental benefits including 401k Retirement Plan, prepaid legal assistance, and more. We also offer paid time off for vacation, sickness, holiday, and bereavement. We are pleased to be able to provide 100% company-paid life insurance and long-term disability insurance. This information is intended to be a general overview and may be modified by the Company due to business-related factors.
Equal Opportunity Statement
Komodo Health provides equal employment opportunities to all applicants and employees. We prohibit discrimination and harassment of any type with regard to race, color, religion, age, sex, national origin, disability status, genetics, protected veteran status, sexual orientation, gender identity or expression, or any other characteristic protected by federal, state, or local laws.
Show more
Show less","{'ProgLanguage': ['Python', 'Java', 'R', 'Go'], 'DataBase': ['SQL'], 'DataAnalytics': ['R'], 'BigData': ['Spark', 'Databricks'], 'MachingLearning': [], 'DataSerialization': [], 'DataVisualization': [], 'Statistics': [], 'CloudComputing': ['AWS'], 'DevTools': ['Docker'], 'Os': [], 'DBMS': ['Snowflake', 'Snowflake'], 'SoftBigDataProcessing': [], 'Automation': ['Kubernetes'], 'InfrastructureAsCode': [], 'NetworkSecurty': [], 'Virtualisation': [], 'Containers': ['Docker', 'Kubernetes'], 'Collaboration': ['Teams'], 'Other': ['Big Data', 'Cloud'], 'FrSoftSkills': [], 'EnSoftSkils': ['Flexibility']}","{'JobDetail': ['Remote'], 'TypeContract': [], 'Salary': ['401k'], 'Level': [], 'Experience': ['a', 'n', 's']}"
"Solutions Architect, Migration & Modernization",Amazon Web Services (AWS),"Paris, Île-de-France, France",https://fr.linkedin.com/jobs/view/solutions-architect-migration-modernization-at-amazon-web-services-aws-3877265933?position=3&pageNum=10&refId=g8dI2iv69kKCojjJFhfDsg%3D%3D&trackingId=Vk%2BA6wgfUJiIwj3JfHXGAA%3D%3D&trk=public_jobs_jserp-result_search-card,"Description
As a Migration & Modernisation Specialist Solutions Architect at AWS, you’ll build technical relationships with customers of all sizes and develop solutions to accelerate their cloud migration journey. You will operate as their trusted advisor, ensuring they get the most out of the cloud at every stage of their journey. You will engage with senior customer leaders and technical stakeholders to help them achieve increased agility and significant business value by leading their migration to AWS.
You’ll manage the technical relationship between AWS and our customers, making recommendations on security, cost, performance, reliability and operational efficiency to accelerate their large scale Migration projects.
Internally, you will be the voice of the customer, sharing their needs and wants to inform the roadmap of AWS features. Externally, The Migration & Modernization Specialist Solutions Architect works with senior enterprises, helping them to effectively lead their migration assessment readiness and strategy.
In this role, your creativity will link technology to tangible solutions, with the opportunity to define cloud-native reference architectures for a variety of use cases.
You will participate in the creation and sharing of best practices, technical content and new reference architectures (e.g. white papers, code samples, blog posts) and evangelize and educate about AWS technology (e.g. through workshops, user groups, meetups, public speaking, online videos or conferences).
Can you work equally well with executives and technologists, leading high-visibility, high-impact IT transformation projects that are technically broad and deep? Do you understand the technical challenges of enterprise level cloud migration projects?
Come and build the future with us!
AWS Sales, Marketing, and Global Services (SMGS) is responsible for driving revenue, adoption, and growth from the largest and fastest growing small- and mid-market accounts to enterprise-level customers including public sector. The AWS Global Support team interacts with leading companies and believes that world-class support is critical to customer success. AWS Support also partners with a global list of customers that are building mission-critical applications on top of AWS services.
About The Team
Diverse Experiences
Amazon values diverse experiences. Even if you do not meet all of the preferred qualifications and skills listed in the job description, we encourage candidates to apply. If your career is just starting, hasn’t followed a traditional path, or includes alternative experiences, don’t let it stop you from applying.
Why AWS
Amazon Web Services (AWS) is the world’s most comprehensive and broadly adopted cloud platform. We pioneered cloud computing and never stopped innovating — that’s why customers from the most successful startups to Global 500 companies trust our robust suite of products and services to power their businesses.
Work/Life Balance
We value work-life harmony. Achieving success at work should never come at the expense of sacrifices at home, which is why flexible work hours and arrangements are part of our culture. When we feel supported in the workplace and at home, there’s nothing we can’t achieve in the cloud.
Inclusive Team Culture
Here at AWS, it’s in our nature to learn and be curious. Our employee-led affinity groups foster a culture of inclusion that empower us to be proud of our differences. Ongoing events and learning experiences, including our Conversations on Race and Ethnicity (CORE) and AmazeCon (gender diversity) conferences, inspire us to never stop embracing our uniqueness.
Mentorship and Career Growth
We’re continuously raising our performance bar as we strive to become Earth’s Best Employer. That’s why you’ll find endless knowledge-sharing, mentorship and other career-advancing resources here to help you develop into a better-rounded professional.
We are open to hiring candidates to work out of one of the following locations:
Courbevoie, 75, FRA | Courbevoie, FRA | Paris, 75, FRA | Paris, FRA
Basic Qualifications
Background in any of the following: Cloud Architecture, Systems Design, Software Development, Infrastructure Architecture, Data Engineering or DevOps
Technical Degree (Computer Science, Maths, Engineering or equivalent) and/or relevant tech experience.
Fluent written and verbal communication skills in English, and French
A passion for technology and for learning
Preferred Qualifications
In-depth knowledge in a technology domain such as: Infrastructure architecture; Database architecture; Networking; Zero downtime migrations, IT Security; Data Center Operations, Cloud operating models, Software design or development
Experience working in a customer-facing role or a role which involved public speaking
AWS certification (e.g. AWS Solutions Architect Associate or Professional) or other industry certification
Amazon est un employeur engagé pour l'égalité des chances. Nous sommes convaincus qu'une main d'oeuvre diversifée est essentielle à notre réussite. Nous prenons nos décisions de recrutement en fonction de votre expérience et de vos compétences. Nous apprécions votre envie de découvrir, d'inventer, de simplifier et de construire. La protection de votre vie privée et la sécurité de vos données constituent depuis longtemps une priorité absolue pour Amazon. Veuillez consulter notre Politique de Confidentialité pour en savoir plus sur la façon dont nous collectons, utilisons et traitons les données personnelles de nos candidats.
Company
- AWS EMEA SARL (France Branch) - G48
Job ID: A2600188
Show more
Show less","{'ProgLanguage': ['R', 'Go'], 'DataBase': [], 'DataAnalytics': ['R'], 'BigData': [], 'MachingLearning': [], 'DataSerialization': [], 'DataVisualization': [], 'Statistics': [], 'CloudComputing': ['AWS'], 'DevTools': [], 'Os': [], 'DBMS': [], 'SoftBigDataProcessing': [], 'Automation': [], 'InfrastructureAsCode': [], 'NetworkSecurty': [], 'Virtualisation': [], 'Containers': [], 'Collaboration': [], 'Other': ['DevOps', 'Cloud'], 'FrSoftSkills': ['Communication'], 'EnSoftSkils': ['Communication', 'Creativity']}","{'JobDetail': ['Senior'], 'TypeContract': [], 'Salary': [], 'Level': [], 'Experience': ['a', 'n', 's']}"
