srouce,title,company,location,link,description,skills,details
LinkedIn,Data Engineer (H/F),MP DATA,"Toulouse, Occitanie, France",https://fr.linkedin.com/jobs/view/data-engineer-h-f-at-mp-data-3908719610?position=54&pageNum=0&refId=3%2BsKCnzKBomYeuJjjsOexw%3D%3D&trackingId=6BLg7dCoO3iP33cOMKL%2B9g%3D%3D&trk=public_jobs_jserp-result_search-card,"MP DATA est une société spécialisée dans l’acquisition, le traitement, et la valorisation des données.
Depuis sa création en 2015, MP DATA accompagne ses clients, majoritairement industriels, dans le management de leur performance et l’exploitation de leurs données.
Les collaborateurs, tous issus de grandes écoles, incarnent au quotidien les valeurs d’Excellence, de Partage et d’Engagement.
Ils associent savoir-faire technique, méthodologie et passion et mettent leurs compétences au service de missions et projets au sein de grands groupes français.
MP DATA accompagne ses clients sur toute la chaine au travers de 3 pôles d’expertise : Conseil et Stratégie, Infrastructure & CloudOPS, Data Science.
Chez MP DATA, les équipes commerciales cherchent des missions en fonction des envies des collaborateurs et non pas l’inverse. Les consultants sont accompagnés dans tous leurs projets, de la mobilité géographique, au changement de secteur d’activité en passant par le développement de nouvelles compétences.
Rejoindre MP DATA, c’est la garantie de travailler sur des sujets passionnants avec un cadre technique fort.
Descriptif du poste :
Nous recherchons un Data Engineer expérimenté pour rejoindre notre équipe.
En tant que Data Engineer, vous serez responsable de la conception, du développement et de la mise en œuvre de pipelines de traitement de données en temps réel à grande échelle.
Vous travaillerez avec des technologies telles que Kafka, Flink, Kinesis et vous utiliserez les services du cloud AWS pour stocker et traiter les données.
Vos responsabilités :
Utiliser Kafka pour le traitement de flux de données en temps réel à grande échelle, en travaillant avec les producteurs, les consommateurs et les topics.
Mettre en œuvre des pipelines de traitement de données en streaming avec Flink, en appliquant des transformations complexes et en gérant les états.
Écrire du code efficace et maintenable en Java / Python pour manipuler et analyser les données en temps réel.
Utiliser Kubernetes pour déployer et gérer des applications conteneurisées à grande échelle, en assurant la résilience et l’évolutivité des services.
Utiliser les services AWS tels que Amazon S3, AWS Lambda, Elastic Kubernetes Service (EKS), Elastic Container Service (ECS) et Elastic Compute Cloud (EC2) pour le stockage, le traitement et le calcul des données en temps réel.
Suivre les meilleures pratiques pour une utilisation efficace du cloud, en assurant la gestion des coûts, la sécurité des données et la disponibilité des services.
Collaborer avec l’équipe de développement logiciel et la gestion de projets pour assurer un flux de développement fluide et une livraison efficace des fonctionnalités.
Bon à savoir :
CDI / ASAP / Toulouse
Profil recherché:
Nous recherchons un candidat diplômé d'une grande école d'Ingénieur avec une première expérience.
Compétences nécessaires :
Expérience significative dans un environnement industriel en mode DevOps, avec des outils tels que CICD, gitlab, Jenkins, Sonar, Nexus, XLdeploy, Camunda, etc.
Maîtrise des langages de programmation tels que Python, Java et expertise dans l’écriture et l’optimisation du code SQL
Maîtrise du français et bonne maitrise de l’anglais.
Capacité à travailler en équipe et esprit d’équipe.
Le processus de recrutement se déroule en 3 entretiens :
Prise de contact
1er entretien : Présentation et projet du candidat + présentation MP DATA
2ème entretien : Entretien de qualification technique
3ème entretien : Rencontre avec les équipes dans les locaux MP DATA + Proposition de collaboration
Show more
Show less","{'ProgLanguage': ['Python', 'Java', 'R'], 'DataBase': ['SQL'], 'DataAnalytics': ['R'], 'BigData': ['Flink'], 'MachingLearning': [], 'DataSerialization': [], 'DataVisualization': [], 'Statistics': [], 'CloudComputing': ['AWS'], 'DevTools': ['Git', 'Jenkins'], 'Os': [], 'DBMS': [], 'SoftBigDataProcessing': [], 'Automation': ['Kubernetes'], 'InfrastructureAsCode': [], 'NetworkSecurty': [], 'Virtualisation': [], 'Containers': ['Kubernetes'], 'Collaboration': [], 'Other': ['DevOps', 'Cloud'], 'FrSoftSkills': ['Collaboration'], 'EnSoftSkils': ['Collaboration']}","{'JobDetail': [], 'TypeContract': ['CDI'], 'Salary': [], 'Level': [], 'Experience': ['a', 'n', 's']}"
LinkedIn,Data engineer,SEVETYS,"Paris, Île-de-France, France",https://fr.linkedin.com/jobs/view/data-engineer-at-sevetys-3905649273?position=55&pageNum=0&refId=3%2BsKCnzKBomYeuJjjsOexw%3D%3D&trackingId=Lf0jM8Rc3OE5oWaxmOH4DQ%3D%3D&trk=public_jobs_jserp-result_search-card,"Sevetys, premier groupe français de cliniques vétérinaires, est présent dans toute la France avec plus de 150 établissements. Créé en 2016, le groupe souhaite moderniser le métier et mettre la qualité des soins et la satisfaction client au cœur de son projet.
Le projet d’entreprise se caractérise par son hyper croissance et une culture de type start-up axée sur le collectif, la cohésion, et l’engagement.
Fort de son succès, Sevetys poursuit sa structuration et recrute un / une :
Data Engineer
​Le
Data Engineer
travaille en étroite collaboration avec une équipe Agile pluridisciplinaire pour construire des pipelines de données de haute qualité permettant de mettre en œuvre des solutions analytiques. Ces solutions génèreront des informations à partir de nos données collectées, permettant de faire progresser les capacités de prise de décision du management de l’entreprise. Ce rôle nécessite une compréhension approfondie de l'architecture des données, de l'ingénierie des données, de l'analyse des données, du reporting. Le candidat idéal est un ingénieur en données/logiciel ayant au moins une première expérience dans la création de produits de données soutenant des solutions analytiques.
Missions :
Conçoit, développe, optimise et maintient une architecture de données et des pipelines qui respectent les objectifs de l'entreprise ;
Résout des problèmes de données afin de fournir des informations qui aident notre entreprise à atteindre ses objectifs ;
Crée des jeux de données pour les membres de l'équipe d'analyse afin d'améliorer leur productivité ;
Favorise une culture du partage, de la réutilisation, de la stabilité de la conception à l'échelle et de l'efficacité opérationnelle des données et des solutions analytiques ;
Contribue à l'évaluation, la mise en œuvre et le déploiement d'outils et de processus émergents pour l'ingénierie des données analytiques afin d'améliorer notre productivité en tant qu'équipe ;
Élabore et met en œuvre des plans de communication/éducation sur les capacités, les normes et les processus d'ingénierie des données analytiques ;
Travaille en partenariat avec des analystes business et des architectes de solutions pour développer des architectures techniques pour les projets et initiatives stratégiques de l'entreprise.
Expertises techniques :
Expérience du développement de bases de données et d'une variété de technologies de bases de données relationnelles ;
Expérience des entrepôts de données ;
Expertise en SQL et en analyse de données ; maîtrise Python ;
Idéalement certifié des technologies BI du Cloud Azure (Synapse, Azure Data Factory, PurView) ;
Connaissance de l'intelligence artificielle, des statistiques et/ou des mathématiques appliquées ;
Expérience dans le développement de solutions sur des services et infrastructures de cloud computing dans le domaine des données et de l'analyse ;
Expérience du déploiement de Power BI ;
Expérience conceptuelle des données et de l'analyse, par exemple ETL, modélisation dimensionnelle, outils de reporting, gouvernance des données, entreposage des données, données structurées et non structurées, qualité de données ;
Connaissance CI/CD et GitLab fortement apprécié.
Expérience agile / Digitale / gouvernance :
Passionné(e) le développement basé sur les données, la fiabilité et l'expérimentation ;
Expérience souhaitée de travail au sein d'une équipe produit Agile collaborative ;
Connaissance de la gouvernance de la donnée.
Skills Individuels :
Motivé(e) et doté(e) de solides compétences en matière de résolution de problèmes et d'apprentissage ;
Flexibilité face aux changements d'orientation du travail au fur et à mesure de l'évolution du projet ;
Excellentes capacités de communication, d'écoute et de persuasion.
Attitude attendue :
Sens aigu des chiffres, curiosité intellectuelle et volonté d'adapter sa position sur la base d'informations complémentaires ;
Forte éthique de travail ; capacité à travailler à un niveau abstrait et à obtenir un consensus.
Informations supplémentaires :
Poste à pourvoir dès que possible ;
Remboursement des frais de transports + Mutuelle ;
Possibilité de télétravail jusqu'à un jour par semaine.
Show more
Show less","{'ProgLanguage': ['Python', 'R', 'Go'], 'DataBase': ['SQL'], 'DataAnalytics': ['R'], 'BigData': [], 'MachingLearning': [], 'DataSerialization': [], 'DataVisualization': ['Power BI'], 'Statistics': ['Statistiques'], 'CloudComputing': ['Azure'], 'DevTools': ['Git'], 'Os': [], 'DBMS': [], 'SoftBigDataProcessing': [], 'Automation': [], 'InfrastructureAsCode': [], 'NetworkSecurty': [], 'Virtualisation': [], 'Containers': [], 'Collaboration': [], 'Other': ['Statistiques', 'Cloud', 'CI/CD'], 'FrSoftSkills': ['Communication', 'Résolution de problèmes', 'Collaboration', 'Flexibilité'], 'EnSoftSkils': ['Communication', 'Collaboration', 'Initiative']}","{'JobDetail': [], 'TypeContract': [], 'Salary': [], 'Level': [], 'Experience': ['a', 'n', 's']}"
LinkedIn,Data engineer H/F,Akkodis,Greater Lille Metropolitan Area,https://fr.linkedin.com/jobs/view/data-engineer-h-f-at-akkodis-3890779946?position=56&pageNum=0&refId=3%2BsKCnzKBomYeuJjjsOexw%3D%3D&trackingId=utcB03oN0vsGUS9G8IIHTw%3D%3D&trk=public_jobs_jserp-result_search-card,"La ligne de service Consulting & Solutions d’Akkodis France renforce ses équipes en région Hauts-de-France et recrute un
Data engineer H/F
en
CDI
sur la
métropole lilloise
:
Description de la mission :
Concevoir, mettre en oeuvre et maintenir des pipelines de données efficaces et évolutifs dans un environnement cloud (comme AWS, Azure, Google Cloud Platform…)
Assurer la qualité des données et des modèles
Définir les bonnes pratiques de développement en implémentant des outils de CI/CD
Assurer une veille technologique sur les technologies Cloud
Capacité à interagir avec des parties prenantes diverses : business analyst, architecte, métier…
Veiller au bon fonctionnement des pipelines en production
Profil :
De formation
Bac +4/5 en informatique
ou issu d'une
école d'ingénieur
, vous possédez une expérience de
3 ans
minimum en tant que data engineer ainsi que les compétences suivantes :
Une bonne connaissance des écosystèmes liés à la data (Kafka, ETL, base de données…)
Une première expérience sur un cloud provider (AWS, Azure, GCP)
Une bonne maitrise de langages de programmation tels que SQL, Python, Scala
Akkodis accompagne ses clients dans la mondialisation de leurs projets, aussi un anglais courant est requis pour l’ensemble de nos collaborateurs.
Processus de recrutement :
Une chargée de recrutement vous contacte pour échanger sur votre projet professionnel
Vous échangez ensuite avec un.e manager sur les aspects techniques, les projets
Chez Akkodis nous sommes convaincus que de l’intelligence collective naît le succès. Il n’existe pas qu’un modèle, nous valorisons l’agilité et l’excellence, l’audace et la créativité.
Et si nous parlions ensemble de vos ambitions pour les prochaines années ?
Akkodis est une entreprise handi-engagée et inclusive. Tous nos postes sont ouverts aux handicaps et à la diversité. Tous différents, tous compétents !
Akkodis, est un acteur mondial de l’ingénierie et de l’IT et un leader dans la smart industrie. Nous accompagnons nos clients dans leurs projets de transformation digitale via 4 lignes de service : Consulting, Solutions, Talent et Academy. Akkodis est un partenaire technologique de confiance pour ses clients à l’échelle internationale. Nous co-créons et nous imaginons des solutions de pointe pour répondre aux défis majeurs de notre société, qu'il s'agisse d'accélérer la transition énergétique et de développer la mobilité verte, ou encore de construire des approches centrées sur les utilisateurs.
Dotés d’une forte culture de l’inclusion et de la diversité, nos 50 000 experts en IT et en ingénierie, présents dans 30 pays, allient les meilleures compétences technologiques à une connaissance transverse de toutes les industries pour façonner un futur plus durable. Nous sommes passionnés par l’idée d’inventer ensemble un avenir meilleur.
Akkodis en France, ce sont près de 9.000 experts en IT et en ingénierie répartis sur l'ensemble du territoire, des collaborateurs partageant des valeurs fortes d'honnêteté, de respect, d'équité et d'inclusion. Notre engagement : leur permettre au quotidien d'être eux-mêmes au travail, et acteurs de leur vie et de leur développement au sein d'Akkodis.
*Akkodis est une marque commerciale sous laquelle les entités AKKA et Modis opèrent
Show more
Show less","{'ProgLanguage': ['Python', 'Scala', 'R', 'Go'], 'DataBase': ['SQL'], 'DataAnalytics': ['R'], 'BigData': [], 'MachingLearning': [], 'DataSerialization': [], 'DataVisualization': [], 'Statistics': [], 'CloudComputing': ['AWS', 'Azure', 'Google Cloud Platform'], 'DevTools': ['Git'], 'Os': [], 'DBMS': [], 'SoftBigDataProcessing': [], 'Automation': [], 'InfrastructureAsCode': [], 'NetworkSecurty': [], 'Virtualisation': [], 'Containers': [], 'Collaboration': [], 'Other': ['Cloud', 'CI/CD'], 'FrSoftSkills': ['Créativité'], 'EnSoftSkils': []}","{'JobDetail': [], 'TypeContract': ['CDI'], 'Salary': [], 'Level': [], 'Experience': ['a', 'n', 's', '3', '3', '3']}"
LinkedIn,Data engineer python,FINAXYS,"Paris, Île-de-France, France",https://fr.linkedin.com/jobs/view/data-engineer-python-at-finaxys-3887107285?position=57&pageNum=0&refId=3%2BsKCnzKBomYeuJjjsOexw%3D%3D&trackingId=8PYxM2n53IXQxAe8yjEkSw%3D%3D&trk=public_jobs_jserp-result_search-card,"LE CONTEXTE
Leader en
IT
, dans les domaines Banque
,
Finance
et
Assurance
,
Finaxys
est un cabinet de
conseil
créé en 2008. Nous accompagnons au quotidien les plus grandes banques du pays sur leur
transformation digitale
(BNP Paribas, Société Générale, Crédit Agricole, Natixis, etc.)
Nos clients bancaires travaillent également dans des contextes Big Data sur des applications centrales rattachées aux Datalakes.
LES MISSIONS
Développement et traitements sur des applications Big Data (Python)
Être force de proposition sur les choix techniques les plus pertinents
Maintenir la qualité des solutions, mesure de cette qualité, alerte sur les non-conformités et validation des solutions définitives.
Analyser des risques liés aux solutions envisagées et proposition des actions de remédiation.
Apporter des solutions IT répondant au mieux aux besoins du business porté par la/le Product Owner (Métiers/Fonctions) en cherchant toujours la maximisation de la valeur générée
Accompagner les équipes dans les migrations Cloud
ENVIRONNEMENT TECHNIQUE
Python
Pandas
Scirpting Big Data
Culture DevOps (Jenkins, Maven, Ansible)
PROFIL
Compétences Techniques et Fonctionnelles requises
Maitrise obligatoire de l’anglais
Show more
Show less","{'ProgLanguage': ['Python', 'R'], 'DataBase': [], 'DataAnalytics': ['Pandas', 'R'], 'BigData': [], 'MachingLearning': [], 'DataSerialization': [], 'DataVisualization': [], 'Statistics': [], 'CloudComputing': [], 'DevTools': ['Git', 'Jenkins'], 'Os': [], 'DBMS': [], 'SoftBigDataProcessing': [], 'Automation': ['Ansible'], 'InfrastructureAsCode': [], 'NetworkSecurty': [], 'Virtualisation': [], 'Containers': [], 'Collaboration': [], 'Other': ['DevOps', 'Big Data', 'Cloud'], 'FrSoftSkills': [], 'EnSoftSkils': []}","{'JobDetail': [], 'TypeContract': [], 'Salary': [], 'Level': [], 'Experience': ['a', 'n', 's']}"
LinkedIn,DATA ENGINEER,Apside,"Nantes, Pays de la Loire, France",https://fr.linkedin.com/jobs/view/data-engineer-at-apside-3909772916?position=58&pageNum=0&refId=3%2BsKCnzKBomYeuJjjsOexw%3D%3D&trackingId=njzYBPoccfJwy9kiqugRwg%3D%3D&trk=public_jobs_jserp-result_search-card,"Offre d'Emploi : DATA ENGINEER H/F chez Apside
Description du poste :
Nous sommes à la recherche d'un Data Engineer passionné pour rejoindre notre équipe dynamique. Si vous avez une expertise dans le Big Data, la Data Science, l'analyse de données et l'architecture de données, cette opportunité est faite pour vous. Intégrer notre communauté Data, c’est l’assurance de progresser, innover, partager, vous certifier et rendre service à nos clients.
Vos missions :
Développement des jobs Spark pour la collecte et la transformation des données comptables disponibles dans les bucket S3.
Optimisation des jobs Spark.
Développement des batchs Java et écriture des données au formats comptables.
Écriture et ordonnancement des DAGs Airflow.
Support du développement Spark Scala.
Maintenance applicative.
Production des événements dédiés à la plateforme de données.
.
Votre rôle, vos compétences :
Vous maîtrisez au minimum un langage de programmation appliqué à l’analyse de données (SQL, Scala, Python, Java).
Vous êtes passionné par le Big Data et le Machine Learning.
Vous concevez et mettez en œuvre des stratégies sécurisées d'acquisition et d'intégration de données.
Vous configurez des référentiels de données à la pointe de la technologie dans des environnements distribués, majoritairement dans le cloud (Google Cloud Platform, Azure, AWS) et/ou en environnement Hadoop (distribution MapR, Cloudera, Hortonworks).
Environnement technique :
SQL
Python/Spark
Cloud AWS: AWS Glue, AWS Lambda (possibilité de vous former sur AWS)
Stockage objet (AWS S3)
Orchestration et scheduling de tâches (Apache Airflow)
Bases analytiques et bases NoSQL (ElasticSearch, AWS Athena)
Votre profil :
Fort de 4 années d’expérience en Data Engineer/ DATA ANALYST
Titulaire d’une formation supérieure IT.
Capacité à s’intégrer dans un cadre technique client tout en étant à même de proposer des pistes d’améliorations pertinentes.
Autonome dans la gestion des projets.
Curieux et impliqué, vous êtes bon communicant avec les clients et les acteurs de culture technique différente.
De bonnes raisons de rejoindre Apside ?
Un esprit start-up avec la stabilité d’un grand groupe, qui favorise l’agilité, le travail d’équipe et la proximité. Alors qu’Apside ne cesse d’agrandir sa famille déjà forte de plus de 3000 consultants, nous sommes à la recherche de nos nouveaux talents !
CDI + package salarial avantageux (Mutuelle offerte, RTT, Tickets Restaurant, Intéressement ...)
Participez et animez nos soirées techniques (Project Lab, Test Lab…),
Devenez speaker (Devoxx, DevFest, NCraft…),
Formez vous avec l’Academy By Apside (e-learning, formation, certification).
Développez votre réseau (Soirées trimestrielles, Afterwork, Soirées d’intégration…),
Intégrez notre Communautés d’Experts et testez les dernières innovations techniques sur notre Bac à Sable !
Apside s’engage en faveur de l’emploi des personnes en situation de handicap avec sa filiale Apsid’EA : 1ère entreprise adaptée totalement intégrée à une ESN !
Pour aller plus loin avec APSIDE !
https://www.apside.com/fr/nos-offres-emploi/?_joboffer-agency=17833&_paged=2
Ce poste de DATA ENGINEER est fait pour vous !
Show more
Show less","{'ProgLanguage': ['Python', 'Java', 'Scala', 'R', 'Go'], 'DataBase': ['SQL', 'NoSQL', 'Elasticsearch'], 'DataAnalytics': ['R'], 'BigData': ['Hadoop', 'Spark', 'Apache Airflow'], 'MachingLearning': [], 'DataSerialization': [], 'DataVisualization': [], 'Statistics': [], 'CloudComputing': ['AWS', 'Azure', 'Google Cloud Platform'], 'DevTools': [], 'Os': [], 'DBMS': [], 'SoftBigDataProcessing': [], 'Automation': ['Airflow'], 'InfrastructureAsCode': [], 'NetworkSecurty': [], 'Virtualisation': [], 'Containers': [], 'Collaboration': [], 'Other': ['Big Data', 'Machine Learning', 'Cloud'], 'FrSoftSkills': [], 'EnSoftSkils': []}","{'JobDetail': [], 'TypeContract': ['CDI'], 'Salary': ['17833'], 'Level': [], 'Experience': ['a', 'n', 's']}"
