srouce,title,company,location,link,description,skills,details
LinkedIn,Ingénieur Linux/Middleware  F/H,Orange Business,"Île-de-France, France",https://fr.linkedin.com/jobs/view/ing%C3%A9nieur-linux-middleware-f-h-at-orange-business-3790146230?position=29&pageNum=0&refId=gVb8Q5OryTN63mrKy677qQ%3D%3D&trackingId=5vFjntxsd62edbGy4W4b1Q%3D%3D&trk=public_jobs_jserp-result_search-card,"L'ambition d'Orange Business est de devenir l'intégrateur réseaux et numérique de référence en Europe, en nous appuyant sur nos forces autour des solutions de connectivité nouvelle génération, du cloud et de la cybersécurité. Nos 30 000 femmes et hommes présents dans 65 pays, dont chaque voix compte, sont tous animés par la même détermination et le même esprit d'équipe, pour construire les solutions digitales d'aujourd'hui et de demain et créer un impact positif pour nos clients, pour leurs employés et pour la planète. Nous offrons des opportunités passionnantes grâce à des projets innovants dans la data et le digital, le cloud, l'IA, la cybersécurité, l'IoT, ou encore le digital Workspace et le big data. Venez vivre cette aventure avec nous !
Missions :
Vous travaillerez pour une grande société de transports français, dans le cadre d’un contrat d’infogérance, avec la responsabilité de l’exploitation/administration de l’ensemble de ses applications informatiques.
En tant qu'Ingénieur Linux, vous serez le référent technique de votre domaine dans la gestion opérationnelle de l’infrastructure d’hébergement des applications informatiques du client.
Vos activités :
· Coordination des tâches d’administration et d’ingénierie au sein de l’équipe et suivi de la roadmap technique
· Gestion des incidents et des problèmes de Niveau 3 afin de garantir le maintien en condition opérationnelle et d'aider nos équipes d'exploitation à tenir nos engagements auprès de notre client.
· Assistance/Formation des équipes de support Niveau 2 dans le but de délivrer un niveau de support reconnu, apprécié et en autonomie
· Audits techniques sur les environnements clients de manière réactive ou proactive.
· Participation active aux projets d’évolution de ces infrastructures,
· Rédaction de documents techniques (Documents d’architecture technique, Procédure technique Installation, procédure technique d’exploitation, Retour d’expérience) et/ou de tutoriels écrits (et vidéos) – Best pratiques Utilisateurs,
· Élaboration de nouvelles procédures (standardisation, industrialisation), règles, normes concernant ces infrastructures
· Qualification, intégration, test de non-régression et recette de nouvelles versions des produits constituant ces infrastructures
· Proposition d’innovations techniques au client avec conduite d’expérimentation sous forme de Proof Of Concept (POC)
Profil :
De formation supérieure Bac+4/5 (Ingénieur ou équivalent), vous disposez d'une solide expérience (7 ans minimum) à haut niveau dans le secteur informatique système Cloud.
· Spécialiste système Linux depuis plusieurs années majoritairement sur les environnements Red Hat 7/8
· Forte maîtrise de l'environnement VMWare
· Maitrise Apache, Tomcat, Liaweb
· Maitrise en développement et scripting : Python et bash notamment
· Maîtrise des outils d'orchestration : Ansible Tower, Terraform, Jenkins
· Bonne connaissance des concepts de micro-services et des conteneurs Kubernetes Openshift (Docker, K8S).
· Compétences complémentaires appréciées : Backup & restore (NetBackup, Veeam), Zabbix/Grafana, OS Windows, etc.
Fort d’une expérience réussie au sein d’un environnement opérationnel, vous souhaitez enrichir votre parcours dans l’IT en l’exerçant sur une des plus importantes infrastructures de production informatique en France.
Vous possédez un esprit d'analyse et de synthèse, appréciez travailler dans un milieu opérationnel et technique et en travail d’équipe. Tout en sachant vous adapter à vos interlocuteurs et faire preuve d’une bonne capacité d’écoute, vous êtes rigoureux, méthodique, force de proposition et faire preuve d’initiative
Vous êtes convaincu que le cloud est un véritable levier pour accélérer la transformation digitale d'un SI et vous disposez d'une expérience significative dans le domaine.
Vous aimez le challenge, souhaitez partager votre solide expertise autour de l'écosystème de l’intégration de solution et de la virtualisation des SI, rejoignez-nous !
Ce poste est à pourvoir au sein de la Direction Cloud d’Orange Business SA.
Le poste est localisé à Massy. Possibilité de 2 jours de télétravail par semaine.
Quel que soit votre âge, genre, origine, religion, orientation sexuelle, neuroatypie, handicap ou apparence, nous encourageons la diversité au sein de nos équipes car c'est une force pour le collectif et un vecteur d'innovation.
L'innovation est essentielle à votre métier, construisons la ensemble !
Orange obtient la certification Top Employer Global 2021. Cette certification consacre les meilleures politiques et pratiques en termes de programmes de ressources humaines. Le Groupe est certifié « Top Employer » depuis maintenant 12 ans.
Show more
Show less","{'ProgLanguage': ['Python', 'R', 'Go', 'Bash'], 'DataBase': [], 'DataAnalytics': ['R'], 'BigData': [], 'MachingLearning': ['Orange'], 'DataSerialization': [], 'DataVisualization': [], 'Statistics': [], 'CloudComputing': [], 'DevTools': ['Git', 'Docker', 'Jenkins'], 'Os': ['Linux', 'Windows'], 'DBMS': [], 'SoftBigDataProcessing': [], 'Automation': ['Ansible', 'Kubernetes'], 'InfrastructureAsCode': ['Terraform'], 'NetworkSecurty': [], 'Virtualisation': ['VMware'], 'Containers': ['Docker', 'Kubernetes', 'OpenShift'], 'Collaboration': [], 'Other': ['Big Data', 'Cloud'], 'FrSoftSkills': [], 'EnSoftSkils': ['Initiative']}","{'JobDetail': [], 'TypeContract': [], 'Salary': [], 'Level': [], 'Experience': ['a', 'n', 's', '7', '7', '7']}"
LinkedIn,Zaraz Systems Engineer,Cloudflare,France,https://fr.linkedin.com/jobs/view/zaraz-systems-engineer-at-cloudflare-3902355926?position=30&pageNum=0&refId=gVb8Q5OryTN63mrKy677qQ%3D%3D&trackingId=ZZn5Rhxa8vpIb8Mo91etPQ%3D%3D&trk=public_jobs_jserp-result_search-card,"About Us
At Cloudflare, we are on a mission to help build a better Internet. Today the company runs one of the world’s largest networks that powers millions of websites and other Internet properties for customers ranging from individual bloggers to SMBs to Fortune 500 companies. Cloudflare protects and accelerates any Internet application online without adding hardware, installing software, or changing a line of code. Internet properties powered by Cloudflare all have web traffic routed through its intelligent global network, which gets smarter with every request. As a result, they see significant improvement in performance and a decrease in spam and other attacks. Cloudflare was named to Entrepreneur Magazine’s Top Company Cultures list and ranked among the World’s Most Innovative Companies by Fast Company.
We realize people do not fit into neat boxes. We are looking for curious and empathetic individuals who are committed to developing themselves and learning new skills, and we are ready to help you do that. We cannot complete our mission without building a diverse and inclusive team. We hire the best people based on an evaluation of their potential and support them throughout their time at Cloudflare. Come join us!
About The Department
Emerging Technologies & Incubation (ETI) is where new and bold products are built and released within Cloudflare. Rather than being constrained by the structures which make Cloudflare a massively successful business, we are able to leverage them to deliver entirely new tools and products to our customers. Cloudflare’s edge and network make it possible to solve problems at massive scale and efficiency which would be impossible for almost any other organization.
About The Team
Cloudflare Zaraz allows engineers and product teams to fuel the growth of their web applications using 3rd party tools while maintaining high performance metrics, minimizing security risks, and respecting privacy obligations. In doing so, the team helped establish the open source Managed Components initiative as a new Internet standard to improve how third party code is packaged for inclusion in digital products across a range of devices.
Building on its successful adoption so far, we’re looking to expand the Cloudflare Zaraz category & catalog with a fresh complement of growth tools to continue removing obstacles in the path to develop thriving Internet properties.
We are a tight-knit team, communicating & collaborating regularly. We like to celebrate our achievements, support each other when we make mistakes, and hold each other and our work to the highest standard.
What You'll Do
In this role, you will join world class engineers in shaping new products built entirely on Cloudflare’s global network, while continuing to nurture the growing impact of Cloudflare Zaraz on the Internet - ensuring continual reliability, maintaining best-in-class performance, and implementing new features and functionality.
You will be encouraged to bring ideas and own your code from inception to release, delivering solutions at all layers of the software stack to empower Cloudflare customers. On any given day, you might write a design document that outlines how you plan to solve a specific problem, ship a new feature layered upon 3 different technologies, or fix a bug in how our user experience renders. You can expect to interact with a variety of languages and technologies including, but not limited to Typescript, Go, Rust. We use Workers heavily and creatively.
If applicable to ongoing projects, you will also support the health and availability of services by being part of an on-call rotation.
About You
We want you to love it here! This role is a good fit for you if:
you bring a passion for meeting business needs while building technically innovative solutions, and excel at shifting between the two - understanding how big-picture goals inform technical details, and vice-versa.
you are bold and persistent in your efforts to get your work across the finish line
you are excited to collaborate & communicate with engineers across Cloudflare, and contribute at many layers of the stack
you take pride in shipping effective, reliable code
you are energized by learning new skills, battling through mind-bending debugging sessions, and sharing your knowledge with others
you feel that documenting your work is just as important as delivering the code
you want to join a team that upholds a culture of support, open and honest communication, and vulnerability, and that values collaboration over heroism
Examples Of Desirable Skills, Knowledge And Experience
5+ years experience working with high volume software applications, with a strong focus on TypeScript programming language
Ability to scope, work on and deliver initiatives independently
Knowledge of at least one modern strongly-typed programming language such as Go, Rust, or C++
Strong written communication skills for contributing to internal and public-facing technical documentation, and authoring blog posts
Solid understanding of computer science fundamentals including data structures, algorithms, and object-oriented or functional design
Bonus Points
Understanding of the web and technologies such as web browsers, HTTP, JavaScript
Experience building reliable, high performance distributed systems or on cloud platforms
Experience using the Cloudflare Workers development platform
Experience contributing to OSS software development or maintaining OSS projects
Available Locations
: Lisbon or remote PT, London or Remote UK, Paris of Remote FR, Amsterdam or Remote NL, Munich or Remote DE
What Makes Cloudflare Special?
We’re not just a highly ambitious, large-scale technology company. We’re a highly ambitious, large-scale technology company with a soul. Fundamental to our mission to help build a better Internet is protecting the free and open Internet.
Project Galileo
: We equip politically and artistically important organizations and journalists with powerful tools to defend themselves against attacks that would otherwise censor their work, technology already used by Cloudflare’s enterprise customers--at no cost.
Athenian Project
: We created Athenian Project to ensure that state and local governments have the highest level of protection and reliability for free, so that their constituents have access to election information and voter registration.
Path Forward Partnership
: Since 2016, we have partnered with Path Forward, a nonprofit organization, to create 16-week positions for mid-career professionals who want to get back to the workplace after taking time off to care for a child, parent, or loved one.
1.1.1.1
: We released 1.1.1.1 to help fix the foundation of the Internet by building a faster, more secure and privacy-centric public DNS resolver. This is available publicly for everyone to use - it is the first consumer-focused service Cloudflare has ever released. Here’s the deal - we don’t store client IP addresses never, ever. We will continue to abide by our privacy commitment and ensure that no user data is sold to advertisers or used to target consumers.
Sound like something you’d like to be a part of? We’d love to hear from you!
This position may require access to information protected under U.S. export control laws, including the U.S. Export Administration Regulations. Please note that any offer of employment may be conditioned on your authorization to receive software or technology controlled under these U.S. export laws without sponsorship for an export license.
Cloudflare is proud to be an equal opportunity employer. We are committed to providing equal employment opportunity for all people and place great value in both diversity and inclusiveness. All qualified applicants will be considered for employment without regard to their, or any other person's, perceived or actual race, color, religion, sex, gender, gender identity, gender expression, sexual orientation, national origin, ancestry, citizenship, age, physical or mental disability, medical condition, family care status, or any other basis protected by law. We are an AA/Veterans/Disabled Employer.
Cloudflare provides reasonable accommodations to qualified individuals with disabilities. Please tell us if you require a reasonable accommodation to apply for a job. Examples of reasonable accommodations include, but are not limited to, changing the application process, providing documents in an alternate format, using a sign language interpreter, or using specialized equipment. If you require a reasonable accommodation to apply for a job, please contact us via e-mail at hr@cloudflare.com or via mail at 101 Townsend St. San Francisco, CA 94107.
Show more
Show less","{'ProgLanguage': ['Java', 'C++', 'R', 'Go', 'JavaScript'], 'DataBase': [], 'DataAnalytics': ['R'], 'BigData': [], 'MachingLearning': [], 'DataSerialization': [], 'DataVisualization': [], 'Statistics': [], 'CloudComputing': ['AWS'], 'DevTools': ['Git'], 'Os': [], 'DBMS': [], 'SoftBigDataProcessing': [], 'Automation': [], 'InfrastructureAsCode': [], 'NetworkSecurty': [], 'Virtualisation': [], 'Containers': [], 'Collaboration': ['Teams'], 'Other': ['Cloud'], 'FrSoftSkills': ['Communication', 'Collaboration'], 'EnSoftSkils': ['Communication', 'Collaboration', 'Organization', 'Initiative']}","{'JobDetail': ['Remote'], 'TypeContract': [], 'Salary': ['3'], 'Level': [], 'Experience': ['a', 'n', 's']}"
LinkedIn,Ingénieur Systèmes et Infrastructure,SPIE ICS,"Nantes, Pays de la Loire, France",https://fr.linkedin.com/jobs/view/ing%C3%A9nieur-syst%C3%A8mes-et-infrastructure-at-spie-ics-3919587946?position=31&pageNum=0&refId=gVb8Q5OryTN63mrKy677qQ%3D%3D&trackingId=bKqxWbT7U3g4ZRZwEoX4jw%3D%3D&trk=public_jobs_jserp-result_search-card,"SPIE ICS - Ingénieur Systèmes et Infrastructures H/F - Nantes.
Dans le cadre de projets de déploiement d'infrastructures chez nos clients, nous recherchons
un ingénieur Infrastructure H/F
pour intégrer nos équipes de delivery à Lille.
Vous aurez pour principales missions:
Delivery & Sauvegarde chez nos clients
Assurer le déploiement et la configuration des solutions de sauvegardes (respect des délais, exigences techniques…)
Apporter un support technique de haut niveau auprès des clients
Assurer la formation et le transfert de compétences auprès équipes internes et des clients
Participer à l'amélioration continue des solutions et des processus
Maintenir en condition opérationnelle (MCO) en veillant au respect des normes et des critères de performance
Analyser et gérer les incidents d'exploitation, opérer la restitution ou le retour en arrière et assurer les opérations de maintenance
Veiller à la conformité des plateformes
Mettre en place les changements sur les plateformes de stockage et de sauvegarde
Votre profil
De formation supérieure (bac+5) en école d'ingénieurs ou équivalent, vous avez une expérience de minimum 2 ans dans 'intégration des infrastructures IT.
Vous êtes capable d'évoluer dans un environnement en mutation et vous appréciez le travail collaboratif.
Anglais : lu, écrit, parlé.
Vous êtes force de proposition et avez l'habitude de travailler en équipe.
Show more
Show less","{'ProgLanguage': ['R'], 'DataBase': [], 'DataAnalytics': ['R'], 'BigData': [], 'MachingLearning': [], 'DataSerialization': [], 'DataVisualization': [], 'Statistics': [], 'CloudComputing': [], 'DevTools': [], 'Os': [], 'DBMS': [], 'SoftBigDataProcessing': [], 'Automation': [], 'InfrastructureAsCode': [], 'NetworkSecurty': [], 'Virtualisation': [], 'Containers': [], 'Collaboration': [], 'Other': [], 'FrSoftSkills': [], 'EnSoftSkils': []}","{'JobDetail': [], 'TypeContract': [], 'Salary': [], 'Level': ['Bac+5'], 'Experience': ['a', 'n', 's', '2', '2', '2']}"
LinkedIn,Ingénieur Système H/F,Diot-Siaci,"Lyon, Auvergne-Rhône-Alpes, France",https://fr.linkedin.com/jobs/view/ing%C3%A9nieur-syst%C3%A8me-h-f-at-diot-siaci-3890787575?position=32&pageNum=0&refId=gVb8Q5OryTN63mrKy677qQ%3D%3D&trackingId=x8EJiZIhb2B7RljmzutxIw%3D%3D&trk=public_jobs_jserp-result_search-card,"Diot-Siaci est un groupe multispécialiste de conseil et de courtage d’assurance et de réassurance leader en France et en Europe, présent notamment en Asie, au Moyen-Orient et en Afrique. Il conçoit et imagine des solutions innovantes sur mesure pour ses clients Grandes Entreprises, ETI, PME-PMI et professionnels aussi bien en assurances de personnes qu’en assurances de biens et de responsabilités. Diot-Siaci dispose d’un actionnariat stable et familial qui lui permet d’accompagner ses clients dans leur transformation en répondant à leurs besoins sur toute la chaîne de valeur. Son offre s’étend des risques IARD, Transport, Responsabilité Civile Professionnelle, Protection Sociale et Conseil et Mobilité Internationale ainsi que l’assurance-crédit et la réassurance. Avec près de 5000 collaborateurs et un vaste réseau international, le Groupe exerce son activité dans le monde entier et totalise un chiffre d’affaires proche de 800 M€ en 2022.
Nous protégeons le progrès pour imaginer un avenir durable et serein.
Nous rejoindre, c'est :
- participer à une aventure humaine enrichissante dans un Groupe en forte expansion, pour relever des challenges ambitieux
- bénéficier d’un cadre favorable à la construction de votre carrière et au développement de votre potentiel
- contribuer au développement et à la promotion des engagements RSE et des valeurs fortes du Groupe
Dans le cadre de la hausse de notre activité nous recherchons un Ingénieur système linux H/F afin de renforcer l'équipe de la Digital Factory sur notre site de Lyon Part-Dieu. Entité en charge de l'ensemble des projets digitaux et de l'innovation, elle propose les avantages d'une petite équipe (pragmatisme, réactivité, évolution rapide) mais tout en restant au sein d'un grand groupe.
Les principales missions afférentes au poste sont les suivantes :
- Gestion de l'infrastructure : Gérer et maintenir les environnements d'infrastructure (IAAS), y compris les serveurs, les bases de données et les services cloud.
- Automatisation des tâches : Développer, maintenir et améliorer des scripts d'automatisation pour les tâches de déploiement, de configuration et de gestion des infrastructures
- Intégration continue et déploiement continu (CI/CD) : Contribuer à la mise en place et à la gestion des pipelines CI/CD pour permettre des déploiements automatisés et rapides.
- Sécurité : Collaborer avec l'équipe de sécurité pour mettre en œuvre des pratiques de sécurité et de conformité, y compris la surveillance et la gestion des vulnérabilités.
- Supervision et dépannage : Surveiller les performances des systèmes, diagnostiquer et résoudre les problèmes rapidement.
- Documenter : Tenir à jour la documentation des procédures d'exploitation et des configurations système.
D'une formation BAC + 2 ou supérieure en informatique, vous êtes passionné, curieux, autonome et organisé. Vous avez envie de construire, de participer à la mise en place de nouveaux systèmes et de toujours améliorer l'existant.
- Maitrise des environnements linux (Debian / Ubuntu server)
- Connaissance des principes DevOps et de la culture DevOps.
- Maîtrise des outils de gestion de versions tels que Git.
- Connaissance des langages de script (par exemple, Shell, Python) pour l'automatisation.
- Familiarité avec les principes de base de la sécurité informatique.
Une expérience avec des outils d'automatisation tels que Ansible, Terraform, Packer est un plus.
Une expérience de gestion de projet infrastructure est également un plus.
Au sein de notre Groupe, vous bénéficiez de 2 à 3 jours de télétravail par semaine et d’avantages sociaux.
Venez construire votre avenir avec nous.
Nous nous engageons en faveur de la diversité, de l'inclusion et de la lutte contre toute discrimination. Tous nos postes à pourvoir sont ouverts aux personnes en situation de handicap.
Le Groupe DIOT-SIACI est signataire de la Charte de la Diversité.
Pour en savoir plus, consultez notre page LinkedIn et notre site carrière.
Show more
Show less","{'ProgLanguage': ['Python', 'R'], 'DataBase': [], 'DataAnalytics': ['R'], 'BigData': [], 'MachingLearning': [], 'DataSerialization': [], 'DataVisualization': [], 'Statistics': [], 'CloudComputing': [], 'DevTools': ['Git'], 'Os': ['Linux'], 'DBMS': [], 'SoftBigDataProcessing': [], 'Automation': ['Ansible'], 'InfrastructureAsCode': ['Terraform'], 'NetworkSecurty': [], 'Virtualisation': [], 'Containers': [], 'Collaboration': [], 'Other': ['DevOps', 'Cloud', 'CI/CD'], 'FrSoftSkills': [], 'EnSoftSkils': []}","{'JobDetail': [], 'TypeContract': [], 'Salary': [], 'Level': [], 'Experience': ['a', 'n', 's']}"
