srouce,title,company,location,link,description,skills,details
LinkedIn,Ingénieur systèmes H/F,Akkodis,"Toulon, Provence-Alpes-Côte d'Azur, France",https://fr.linkedin.com/jobs/view/ing%C3%A9nieur-syst%C3%A8mes-h-f-at-akkodis-3912534499?position=1&pageNum=10&refId=hu%2BWdn3Jfa2iKN5V6pJtGw%3D%3D&trackingId=MODmebbm%2BBNbxLpi7ySdrw%3D%3D&trk=public_jobs_jserp-result_search-card,"La ligne de service Consulting & Solutions d’Akkodis France renforce ses équipes en région PACA et recrute un Ingénieur systèmes H/F en CDI à Toulon.
Responsabilités clés
-Participer à la conception et à la mise en œuvre des architectures système.
-Assurer la fiabilité, la disponibilité et la sécurité des systèmes.
-Collaborer avec les équipes de développement pour intégrer de nouvelles fonctionnalités.
-Diagnostiquer et résoudre les problèmes techniques.
-Maintenir une documentation technique précise.
Profil
De formation généraliste, vous justifiez d’une première expérience en informatique, génie logiciel, génie électrique ou bien mécatronique dans une fonction similaire.
-Expérience significative en administration système.
-Maîtrise des environnements Linux/Unix et/ou Windows.
-Connaissance des réseaux et des protocoles TCP/IP.
-Capacité à travailler efficacement en équipe et de manière autonome.
-Excellentes compétences en communication et en résolution de problèmes
Processus de recrutement :
- Un(e) chargé(e) de recrutement vous contacte pour échanger sur votre projet professionnel
- Vous échangez ensuite avec un(e) manager sur les aspects techniques, les projets
Chez Akkodis nous sommes convaincus que de l’intelligence collective naît le succès. Il n’existe pas qu’un modèle, nous valorisons l’agilité et l’excellence, l’audace et la créativité.
Et si nous parlions ensemble de vos ambitions pour les prochaines années ?
Akkodis est une entreprise handi-engagée et inclusive. Tous nos postes sont ouverts aux handicaps et à la diversité. Tous différents, tous compétents !
Akkodis, est un acteur mondial de l’ingénierie et de l’IT et un leader dans la smart industrie. Nous accompagnons nos clients dans leurs projets de transformation digitale via 4 lignes de service : Consulting, Solutions, Talent et Academy. Akkodis est un partenaire technologique de confiance pour ses clients à l’échelle internationale. Nous co-créons et nous imaginons des solutions de pointe pour répondre aux défis majeurs de notre société, qu'il s'agisse d'accélérer la transition énergétique et de développer la mobilité verte, ou encore de construire des approches centrées sur les utilisateurs.​
Dotés d’une forte culture de l’inclusion et de la diversité, nos 50 000 experts en IT et en ingénierie, présents dans 30 pays, allient les meilleures compétences technologiques à une connaissance transverse de toutes les industries pour façonner un futur plus durable. Nous sommes passionnés par l’idée d’inventer ensemble un avenir meilleur.​
Akkodis en France, ce sont près de 9.000 experts en IT et en ingénierie répartis sur l'ensemble du territoire, des collaborateurs partageant des valeurs fortes d'honnêteté, de respect, d'équité et d'inclusion. Notre engagement : leur permettre au quotidien d'être eux-mêmes au travail, et acteurs de leur vie et de leur développement au sein d'Akkodis..​
Akkodis est la marque technologique de The Adecco Group​
​
*Akkodis est une marque commerciale sous laquelle les entités AKKA et Modis opèrent
Show more
Show less","{'ProgLanguage': ['R'], 'DataBase': [], 'DataAnalytics': ['R'], 'BigData': [], 'MachingLearning': [], 'DataSerialization': [], 'DataVisualization': [], 'Statistics': [], 'CloudComputing': [], 'DevTools': ['Git'], 'Os': ['Linux', 'Windows'], 'DBMS': [], 'SoftBigDataProcessing': [], 'Automation': [], 'InfrastructureAsCode': [], 'NetworkSecurty': [], 'Virtualisation': [], 'Containers': [], 'Collaboration': [], 'Other': [], 'FrSoftSkills': ['Communication', 'Résolution de problèmes', 'Créativité'], 'EnSoftSkils': ['Communication']}","{'JobDetail': [], 'TypeContract': ['CDI'], 'Salary': [], 'Level': [], 'Experience': ['a', 'n', 's']}"
LinkedIn,Ingénieur système Windows/Ingénieure système Windows,FAYAT IT,"Bordeaux, Nouvelle-Aquitaine, France",https://fr.linkedin.com/jobs/view/ing%C3%A9nieur-syst%C3%A8me-windows-ing%C3%A9nieure-syst%C3%A8me-windows-at-fayat-it-3910766258?position=2&pageNum=10&refId=hu%2BWdn3Jfa2iKN5V6pJtGw%3D%3D&trackingId=fYPVATQSYbmhl%2FexFV2ZEQ%3D%3D&trk=public_jobs_jserp-result_search-card,"Qui sommes nous ?
Le Groupe FAYAT est le leader français indépendant de la construction et le leader mondial du matériel routier. Il accompagne ses clients dans le monde grâce à des solutions innovantes et durables dans les sept grands Métiers autour desquels il s'est construit : Travaux Publics, Fondations, Bâtiment, Énergie & Services, Métal, Chaudronnerie et Matériel routier.
FAYAT IT est la DSI du groupe FAYAT : notre mission est de délivrer et piloter un système d'information de qualité, au service de la performance des filiales du groupe FAYAT en France et à l'International. Elle répond à trois objectifs :
Déployer et assurer la mise en œuvre de la stratégie informatique du Groupe ;
Assurer une qualité de service optimale à l'échelle internationale ;
Accompagner les filiales du Groupe dans les chantiers de transformation numérique, de mobilité et de digitalisation.
Fayat IT recherche son futur·e administrateur·trice Système Identité en CDI à Bordeaux (33).
Thomas et l'ensemble de l'équipe Identité & Workplace sont à la recherche d'un·e administrateur·trice Système h/f spécialisé·e Identité.
Basé·e à Bordeaux, vous jouerez un rôle crucial pour la mise en œuvre des solutions liées à l'identité au sein du groupe. Vous serez l'élément clé dans la sécurisation et l'optimisation de nos systèmes d'information.
Votre quotidien :
Concevoir et implémenter des solutions de gestion des identités (AD ; 365 ; Azure).
Participer à des projets d'intégration ou de migration d'annuaires AD
Développer des stratégies pour sécuriser les identités numériques.
Collaborer avec les équipes IT pour intégrer des solutions d'identité dans l'architecture existante.
Mener des analyses de risque et assurer la conformité aux normes de sécurité.
Fournir un leadership technique sur les questions d'identité numérique.
Environnement technique :
Microsoft Active Directory
Domain Name System (DNS)
Public Key Infrastructure (PKI)
Microsoft 365
Azure Active Directory
Microsoft Server Administration
PowerShell Scripting
Microsoft Azure
Votre arsenal :
Formation Supérieure dans les métiers informatiques
Expérience : 5 ans minimum sur un poste similaire
Maîtrise de l'Anglais niveau B2/C1 (environnement international)
En termes de personnalité :
Rigoureux·se, organisé·e et méthodique, vous êtes reconnu·e pour votre professionnalisme.
Vous êtes force de proposition et avez une curiosité technique qui vous permettra de relever tous les défis.
Orienté·e Client, vous avez le sens du contact et avez à cœur de répondre aux besoins des clients dans les délais qui vous seront impartis tout en garantissant leur satisfaction.
Vous êtes capable d'aborder des tâches variées, de faire preuve de polyvalence et de vous adapter à des processus changeants et à de nouveaux programmes.
Ce que l'on propose :
Un contrat en CDI, statut cadre, forfait 218 jours (avec 9 à 12 jours de RTT par an),
Un parcours d’intégration interactif et personnalisé via notre partenaire Heyteam,
Un accord télétravail de 2 jours par semaine, accessible après validation de la période d'essai,
La prise en charge à 100% de votre mutuelle pour vous et les membres de votre foyer,
La prise en charge à 100 % de votre abonnement de transport en commun.
Des horaires de travail flexibles afin de favoriser un meilleur équilibre vie pro / vie perso.
L’acquisition de Titre Restaurant à 9.80 € (pris en charge à 60%)
Un CSE attractif et accessible sans condition d'ancienneté.
Le congé menstruel pour nos collaboratrices : 1 journée de télétravail exceptionnel par mois et 2 jours par an de congés menstruels
Une dynamique d'entreprise conviviale par l'organisation de divers événements (séminaires, réunions d'équipe en région parisienne ou à Bordeaux).
Et du café Nespresso gratuit et à volonté... What Else ?!
Si votre candidature est présélectionnée :
1 échange avec Guy, le recruteur, afin de faire connaissance et évaluer vos motivations à candidater sur le poste,
1 entretien avec Thomas, le manager, où vous aurez l'occasion de rentrer dans les détails du poste,
1 entretien avec Gaelle (RRH) afin de confirmer que nous sommes tous en phase sur le poste.
Afin d'évaluer vos compétences personnelles de manière objective, nous utilisons
Assessfirst
, une solution innovante basée sur l'intelligence artificielle pour cerner votre personnalité, vos motivations et vos capacités cognitives.
A vos CV !
Tous nos postes sont accessibles aux personnes en situation de handicap.
Fayat IT : notre code source, c'est vous !
Show more
Show less","{'ProgLanguage': ['R', 'Go'], 'DataBase': [], 'DataAnalytics': ['R'], 'BigData': [], 'MachingLearning': [], 'DataSerialization': [], 'DataVisualization': [], 'Statistics': [], 'CloudComputing': ['Azure'], 'DevTools': ['Git'], 'Os': [], 'DBMS': [], 'SoftBigDataProcessing': [], 'Automation': [], 'InfrastructureAsCode': [], 'NetworkSecurty': [], 'Virtualisation': [], 'Containers': [], 'Collaboration': [], 'Other': [], 'FrSoftSkills': ['Leadership', 'Organisation'], 'EnSoftSkils': ['Leadership']}","{'JobDetail': [], 'TypeContract': ['CDI'], 'Salary': [], 'Level': [], 'Experience': ['a', 'n', 's', '5', '5', '5']}"
LinkedIn,Ingénieur infrastructure IT (F/H),EURENCO,"Sorgues, Provence-Alpes-Côte d'Azur, France",https://fr.linkedin.com/jobs/view/ing%C3%A9nieur-infrastructure-it-f-h-at-eurenco-3899672734?position=3&pageNum=10&refId=hu%2BWdn3Jfa2iKN5V6pJtGw%3D%3D&trackingId=gnCCE5qwCX7zmiJ5n1J%2Bzg%3D%3D&trk=public_jobs_jserp-result_search-card,"EURENCO, Leader Européen des matériaux énergétiques, est un acteur clé du secteur de la Défense au service de la Souveraineté.
Nous concevons, produisons et fournissons des produits et solutions innovantes à forte valeur ajoutée dans les domaines de la pyrotechnie et de la chimie pour des applications civiles et défense.
Groupe international avec des sites en France, en Belgique, en Suède et aux Etats-Unis, nous sommes les héritiers d’un savoir-faire stratégique et pluri-centenaire dans nos domaines.
Nous valorisons tous nos talents dans leur diversité et faisons vivre leurs savoir-faire sur tous les sites du Groupe. En forte croissance, interne et externe, nous avons à cœur de conserver une taille humaine et un esprit collectif reposant sur la force de l’équipe.
Travailler Chez EURENCO, C’est
Intégrer un secteur dynamique au service de la Souveraineté,
Rejoindre une équipe jeune, énergique et internationale,
Intégrer un environnement technique avec des produits à haute performance,
Découvrir une grande diversité de métiers et d’opportunités d’évolution : pyrotechnie, chimie, maintenance, R&D, prévention, qualité, supply-chain, finance, prévention et bien d’autres !
Devenez un de nos 1300 collaborateurs en postulant au poste d'ingénieur infrastructure IT (F/H).
Vous intégrez la direction des systèmes d’information composée de plus de 10 personnes présentes en France. La DSI définit, intègre et exploite les systèmes d'information et les infrastructures informatiques.
Rattaché(e) au responsable technique informatique, vous êtes garant du bon fonctionnement et de l'évolution du Système d’Information de l’entreprise. Vous intervenez sur la gestion de projet et également l’exploitation.
A ce titre, vous êtes particulièrement en charge de :
Gérer Les Projets Confiés à La DSI
Identifier les opportunités d’évolution du système d’informations. Collecter et traduire les besoins clients en solutions techniques
Constituer les dossiers de consultation, dépouiller les réponses et participer au choix des prestataires
Analyser les impacts organisationnels
Identifier les incidences sur les autres composants du système d’information.
Piloter la réalisation des projets
Assurer la mise en production des projets
Piloter Les Contrats D’infogérance
Animer et participer au comité technique
Participer au comité de pilotage
Contrôler les indicateurs (SLA)
Valider les processus de l’infogérance.
Piloter et suivre la réalisation des actions menées par les sous-traitants.
Assurer la stabilité et la disponibilité de l’infrastructure.
Assurer la satisfaction des utilisateurs.
Proposer des améliorations du service fourni par l’infogérance.
Etre Garant De L’infrastructure IT
Assurer le traitement des processus IT sur la base du référentiel ITIL avec en particulier
Gestion des incidents
Gestion des problèmes
Gestions des changements
Gestion de la capacité
Réaliser la mise à jour du système d’informations pour assurer son niveau de sécurité et gérer le cycle d’obsolescence
Les Compétences à Mettre En Œuvre (nous Pouvons Vous Former Sur Bon Nombre D’entre Elles) Pour Assurer La Mission Sont
Management fonctionnel dans le cadre de la conduite de projet
Infrastructure
Virtualisation et hyper-convergence
Environnement hybride : on premise, cloud, SaaS
Stockage : déduplication, réplication, stockage distribué
Sauvegarde et archivage
Plan reprise d’activité
Système
Windows
Linux
Services infrastructure
Messagerie
AD, DNS, CIFS, DFS
SGBD
Messagerie unifiée
Mobile Device Management
Service applicatif
ERP (aspect technique)
Intranet / Extranet
Business Intelligence
De formation supérieure en Informatique (BAC+3 à BAC+5), vous justifiez de solides compétences techniques acquises en qualité d'Ingénieur Systèmes & Réseaux ou d'Ingénieur Infrastructures.
Vous disposez idéalement d'une première expérience en gestion de projet et/ou gestion de contrat d'infogérance.
Vous êtes autonome, impliqué(e) et vous avez l’esprit d’équipe ? Alors rejoignez-nous !
Intégrez une entreprise où règne une atmosphère propice à votre évolution : participez sans plus attendre à une transformation durable grâce à une véritable aventure humaine au sein d'un grand groupe à dimension internationale.
Poste en
CDI
à pourvoir sur Sorgues (Vaucluse),
avec télétravail
(accord d'entreprise).
Vous bénéficiez d’un
package de rémunération attractif
avec plusieurs avantages comme :
Une mutuelle famille groupe, un CSE dynamique, un accord d’intéressement/participation, un Plan d’Epargne Entreprise, un 13ème mois, une part variable (bonus).
Un parcours d’intégration individualisé.
Des opportunités d’évolutions avec des passerelles.
La possibilité de suivre des formations adaptées à vos besoins.
Show more
Show less","{'ProgLanguage': ['R'], 'DataBase': [], 'DataAnalytics': ['R'], 'BigData': [], 'MachingLearning': [], 'DataSerialization': [], 'DataVisualization': [], 'Statistics': [], 'CloudComputing': [], 'DevTools': [], 'Os': ['Linux', 'Windows'], 'DBMS': [], 'SoftBigDataProcessing': [], 'Automation': [], 'InfrastructureAsCode': [], 'NetworkSecurty': [], 'Virtualisation': [], 'Containers': [], 'Collaboration': [], 'Other': ['Cloud'], 'FrSoftSkills': ['Organisation'], 'EnSoftSkils': []}","{'JobDetail': ['Hybride'], 'TypeContract': ['CDI'], 'Salary': ['Package'], 'Level': ['Bac+5', 'Bac+3'], 'Experience': ['a', 'n', 's']}"
LinkedIn,Ingénieur Systèmes Infrastructures F/H,Aix-Marseille University,"Marseille, Provence-Alpes-Côte d'Azur, France",https://fr.linkedin.com/jobs/view/ing%C3%A9nieur-syst%C3%A8mes-infrastructures-f-h-at-aix-marseille-university-3802273157?position=4&pageNum=10&refId=hu%2BWdn3Jfa2iKN5V6pJtGw%3D%3D&trackingId=SGyodQhOXQncZrdg5LpG5A%3D%3D&trk=public_jobs_jserp-result_search-card,"À propos de nous
Et si vous rejoigniez une structure en pleine mutation vers l’université de demain ?
Au premier rang des universités françaises et francophones, Aix-Marseille Université (AMU) regroupe 78 000 étudiants, 8 000 personnels, 122 structures de recherche en lien avec les plus grands organismes dans ce domaine et un budget de 720 M€.
5 grands campus accueillent les étudiants et tous les champs universitaires qu’il est possible d’étudier en France.
La diversité des sites permet de proposer aujourd’hui des opportunités de carrière uniques.
Aix-Marseille Université fait partie de l'alliance CIVIS pour la création des ""Universités Européennes"".
Aix-Marseille Université recrute et reconnait tous les talents, ses offres d'emplois sont handi-accessibles.
Mission
Au sein de la Direction du Numérique (DIRNUM) du campus Timone, vous serez directement rattaché au Responsable de la cellule système du campus.
L’équipe est composée de 15 personnes et assure le maintien en conditions opérationnelles des équipements et infrastructures du campus ainsi que la sécurisation des connexions au système d’information de l’Université.
ACTIVITÉS PRINCIPALES
Mettre en œuvre, administrer, optimiser et maintenir en condition opérationnelle les architectures matérielles et logicielles (solutions de stockage, hyperviseurs, serveurs virtuels, solutions de sauvegarde) de l'infrastructure AMU et de l'offre de services du Datacenter SUD
Planifier, installer, automatiser, superviser et améliorer les processus de production
Sécuriser la production (sauvegarder, sécuriser les flux, prévoir et mettre en pratique des solutions de repli ou de contournement : PRA, PCA)
Assurer l'assistance technique de niveau 2 et 3
Assurer une veille technologique
Gérer les incidents sur des plages horaires étendues
Conditions particulières d'exercice :
Possibilité d'horaires décalés adaptés aux nécessités de service.
Profil
Vous êtes titulaire d’un Bac+3 avec une spécialité en systèmes d’infrastructures.
Vous justifiez d'une première expérience réussie sur un poste similaire.
COMPÉTENCES REQUISES
Maîtrise des environnements VMWare VSphere
Connaissances avancées sur les solutions de stockage de classe entreprise (Mode blocs, fichiers et objets) et sur les solutions de sauvegarde à très haute volumétrie
Compétences dans un ou plusieurs langages de Scripting (Python, Powershell …)
Bonnes connaissances des systèmes d'exploitation de type Linux et Windows et des réseaux de niveau 2
Gestion et suivi de projets (SDN et DirNum)
Une certaine maîtrise de l’anglais technique est prérequise (B2)
Pour finir...
Vous êtes méthodique et avez une bonne capacité d’analyse.
Vous savez gérer les priorité et respecter les échéances.
Vous faites preuve d’initiatives, vous êtes rigoureux et réactif.
Un Processus De Recrutement Fluide Et Transparent
À réception de votre candidature, deux étapes : un échange téléphonique personnalisé avec les candidats sélectionnés, et un entretien avec les responsables de notre structure.
En cas de réussite, nous mettrons tout en œuvre pour confirmer votre recrutement rapidement. À votre arrivée, vous bénéficiez d'un parcours d'accueil et d'intégration, ainsi que de formations adaptées à vos besoins pour favoriser votre développement professionnel.
Rejoindre AMU, c’est bénéficier d’un environnement de travail socialement engagé :
Une flexibilité du travail : la possibilité de télétravailler jusqu'à 2 jours par semaine après seulement 6 mois d'ancienneté selon le service concerné
Un équilibre des temps de vie : bénéficiez jusqu'à 50 jours de congés dès la première année, puis 58 jours après un an
Une prime mensuelle et annuelle dès 12 mois d’ancienneté pour les agents non titulaires et application du RIFSEEP pour les titulaires
Un accompagnement personnalisé pour les personnels en situation de handicap
La prise en charge des transports en commun à hauteur de 75% compatible avec un forfait mobilité durable
La possibilité d’une place de parking ou d’un forfait mobilité durable pour l'utilisation de cycles sur les trajets domicile-travail
Un accès à des prestations dans différents domaines : loisir, sport, culture et social
Référence de l'offre : d92aq4ekyq
Show more
Show less","{'ProgLanguage': ['Python', 'R', 'Go'], 'DataBase': [], 'DataAnalytics': ['R'], 'BigData': [], 'MachingLearning': [], 'DataSerialization': [], 'DataVisualization': [], 'Statistics': [], 'CloudComputing': [], 'DevTools': [], 'Os': ['Linux', 'Windows'], 'DBMS': [], 'SoftBigDataProcessing': [], 'Automation': [], 'InfrastructureAsCode': [], 'NetworkSecurty': [], 'Virtualisation': ['VMware', 'vSphere'], 'Containers': [], 'Collaboration': [], 'Other': [], 'FrSoftSkills': ['Flexibilité'], 'EnSoftSkils': ['Initiative']}","{'JobDetail': [], 'TypeContract': [], 'Salary': [], 'Level': ['Bac+3'], 'Experience': ['a', 'n', 's']}"
LinkedIn,Ingénieur systèmes (F/H),Anetys,"Paris, Île-de-France, France",https://fr.linkedin.com/jobs/view/ing%C3%A9nieur-syst%C3%A8mes-f-h-at-anetys-3911816264?position=5&pageNum=10&refId=hu%2BWdn3Jfa2iKN5V6pJtGw%3D%3D&trackingId=Tt5oDCwvcZvLrQhuXaAvCg%3D%3D&trk=public_jobs_jserp-result_search-card,"Pour accompagner notre développement, nous recrutons des Ingénieurs Systèmes, afin d’intervenir pour nos clients, reconnus sur le marché.
Vous pourrez compter sur l’accès aux nombreuses ressources, la solidarité de la communauté et le soutien du management, pour progresser/évoluer dans un environnement bienveillant.
LES MISSIONS
Au quotidien, vous interviendrez auprès de nos clients et aurez comme principales missions :
Analyser les besoins des clients, prendre connaissance des projets,
Etablir les spécifications techniques,
Réaliser les projets (audit, conseil, architecture, intégration, migration…),
Réaliser les phases de tests et de recettes,
En fonction des missions: participation au RUN,
Réaliser les documentations associées,
Maintenir une veille technologique dans vos domaines de compétences.
LES + DU POSTE :
Diversité des missions et des clients à accompagner ;
Autonomie et accompagnement ;
Un suivi et un accompagnement dans votre progression de carrière et dans votre épanouissement.
LE PROFIL
Diplôme d'ingénieur ou équivalent ;
Posséder 5 ans d’expériences au minimum sur des fonctions similaires ;
Avoir une expertise en systèmes (Windows Server, Active Directory, O365, VMware) ;
Compétences en Citrix ;
Compétences en scripting API, Powershell et/ou Python
Force de proposition, sens du service et rigueur seront des atouts majeurs pour l’organisation et la qualité du service ;
Disposer de qualités relationnelles et de communication pour d’établir une relation de confiance avec vos interlocuteurs internes ;
Maîtrise de l’anglais professionnel.
POURQUOI NOUS REJOINDRE ?
Faire partie d'une organisation à taille humaine avec des ambitions fortes de croissance ;
Intervenir sur des projets de transformation stratégiques avec une dimension internationale ;
Avoir l'occasion de développer vos compétences : certifications, meet-ups etc... ;
Bénéficier d'un(e) mentor en interne qui vous accompagnera tout à long de votre parcours ;
Disposer d'une flexibilité entre présentiel et télétravail ;
Travailler dans un environnement stimulant, bienveillant et chaleureux.
A PROPOS D’ANETYS
Situé au cœur du quartier de La Défense, division Cybersécurité, Cloud et Digital Workspace en hyper-croissance du Groupe Nextedia, Anetys accompagne les entreprises afin de renforcer leur cyber-résilience, leur agilité et leur performance. Nous sommes à la recherche de talents polyvalents à qui nous offrons un environnement de travail international et joyeux, ainsi que d’exceptionnelles perspectives en interne ou au sein du groupe.
Show more
Show less","{'ProgLanguage': ['Python', 'R'], 'DataBase': [], 'DataAnalytics': ['R'], 'BigData': [], 'MachingLearning': [], 'DataSerialization': [], 'DataVisualization': [], 'Statistics': [], 'CloudComputing': [], 'DevTools': ['Git'], 'Os': ['Windows'], 'DBMS': [], 'SoftBigDataProcessing': [], 'Automation': [], 'InfrastructureAsCode': [], 'NetworkSecurty': [], 'Virtualisation': ['VMware'], 'Containers': [], 'Collaboration': [], 'Other': ['Cloud'], 'FrSoftSkills': ['Communication', 'Organisation', 'Flexibilité'], 'EnSoftSkils': ['Communication']}","{'JobDetail': [], 'TypeContract': [], 'Salary': [], 'Level': [], 'Experience': ['a', 'n', 's', '5', '5', '5']}"
