srouce,title,company,location,link,description,skills,details
LinkedIn,Data Engineer - Profils expérimentés H/F,LCL,"Villejuif, Île-de-France, France",https://fr.linkedin.com/jobs/view/data-engineer-profils-exp%C3%A9riment%C3%A9s-h-f-at-lcl-3888403052?position=31&pageNum=0&refId=3%2BsKCnzKBomYeuJjjsOexw%3D%3D&trackingId=1669O%2BXVTXi8nbyJkeSoXA%3D%3D&trk=public_jobs_jserp-result_search-card,"🏦 LCL, c’est LA banque urbaine du Groupe Crédit Agricole - avec nous, accompagnez la transformation, le développement et le maintien technologiques de nos outils avec une vision business et de satisfaction de nos 6 millions de clients.
En tant qu’acteur majeur de la banque de détail, nous nous adaptons chaque jour aux nouveaux modes de consommation et les projets de nos de clients internes et externes tout en garantissant le besoin de sécurité et de développement technologique qu’impliquent nos activités.
💡Organisées en mode Agile, les 8 squads de la tribu DATA (6 squads Métier et 2 squads transverses) œuvrent au quotidien pour répondre à un enjeu majeur pour la banque : la collecte, le stockage, la gestion et l’usage de la donnée. En interaction permanente avec les autres tribus IT et les métiers, elles étudient et proposent les solutions et architectures à déployer pour répondre au mieux aux stratégies de développement et de pilotage de l’ensemble des métiers de la banque.
Rejoignez-nous si vous souhaitez participer aux réflexions et au développement de la trajectoire technique et DataCentric du SI LCL et plus largement du Groupe CA. Vous côtoierez et serez au cœur de l’implémentation de technologies variées telles que les plateformes Teradata, les solutions d’architecture applicative des technologies BigData ou IA, des environnements analytiques ou encore des solutions de datavisualisation. Vous assurerez le traitement de données en temps réel ou en batch et exposerez les données sous différentes formes.
Que vous souhaitiez devenir expert sur les socles technologiques ou relever le challenge de la gestion de projets Métier, nous vous aiderons à atteindre vos propres objectifs.
Vous rejoindrez une équipe pluridisciplinaire, clairement orientée vers le développement de ses collaborateurs à de nouvelles technologies !
🎯 En tant que Data Engineer :
· Vous aimez analyser les besoins avec les métiers, challenger, identifier les sources de données dans les différents univers technologiques, industrialiser des algorithmes, concevoir et développer des Datalab ou des Datamart sur les plateformes ? Vous saurez relever les challenges proposés par les squads métier !
· Vous préférez travailler à l’architecture et au déploiement de nouvelles plateformes, à la levée de la dette technologique ou encore réaliser de la veille au service de notre trajectoire ? La squad Socles Data est faite pour vous !
· Au-delà des projets que vous gérerez, garant du bon fonctionnement de votre parc applicatif, vous attacherez une grande attention à la mise en œuvre de solutions optimisées.
· La rigueur, la communication, l’esprit d’équipe mais aussi la curiosité et la créativité font partie de vos soft skills ! ils vous permettront de répondre aux enjeux de sécurité, de qualité, de transmission de la connaissance et contribueront à l’atteinte des objectifs de l’IT et plus largement de LCL, au service de ses clients.
💻 Voici les principales technologies utilisées au sein de la tribu, si certaines vous sont familières, nous vous aiderons à monter en compétence sur d’autres !
Langages utilisés : SQL, Python, Scala
SGBD : Teradata et utilitaires (TPT, BTEQ, …)
Streaming : Kafka
Search : ElasticSearch, SolR
Environnement : Unix
Solutions Big Data : Hadoop Cloudera, DataIku, HDFS, Hive, Impala,
Devops : GitLab, Jenkins, Nexus
Outils de visualisation : MS BI (SSIS, SSAS, SSRS) Qlik Sens, BO
Modélisation : MEGA
Outils collaboratifs : GIT, Jira, Confluence, Teams
⚡Si les nouveaux enjeux bancaires vous intéressent, que vous souhaitez intégrer une équipe Agile au service des métiers dans laquelle vous serez force de proposition et que vous aimez travailler dans un environnement motivant et dynamique, rejoignez-nous, cette offre est faite pour vous !
🔥 Les + de notre entreprise :
Accès au Plan d’épargne Groupe, intéressement et participation aux bénéfices de l’entreprise + abondement
Prix préférentiels bancaires et avantages CSE
Parcours évolutif dans l’entreprise et/ou dans le Groupe CA.S.A
Télétravail (jusqu'à 2 jours de télétravail par semaine)
De multiples commodités sur le campus (restaurants d'entreprise, salle de sport, crèche, centre médical, médiathèque...)
Forfait et avantages pratiques « mobilité durable » pour les velotafeurs
Des équipes aussi diversifiées que structurées dans une dynamique de transformation
LCL s’engage en faveur de la diversité et nous encourageons tout(e) candidat(e) ayant l’expérience requise à postuler à nos offres. Tous nos postes sont ouverts aux personnes en situation de handicap.
Nous avons encore de nombreuses raisons à vous présenter pour vous convaincre de nous rejoindre mais pour cela, il faudra postuler ici !
Show more
Show less","{'ProgLanguage': ['Python', 'Scala', 'R', 'Go'], 'DataBase': ['SQL', 'Elasticsearch'], 'DataAnalytics': ['R'], 'BigData': ['Hadoop'], 'MachingLearning': [], 'DataSerialization': [], 'DataVisualization': [], 'Statistics': [], 'CloudComputing': [], 'DevTools': ['Git', 'Jenkins'], 'Os': [], 'DBMS': [], 'SoftBigDataProcessing': [], 'Automation': [], 'InfrastructureAsCode': [], 'NetworkSecurty': [], 'Virtualisation': [], 'Containers': [], 'Collaboration': ['JIRA', 'Confluence', 'Teams'], 'Other': ['DevOps', 'Big Data', 'Cloud'], 'FrSoftSkills': ['Communication', 'Créativité'], 'EnSoftSkils': ['Communication']}","{'JobDetail': [], 'TypeContract': [], 'Salary': [], 'Level': [], 'Experience': ['a', 'n', 's']}"
LinkedIn,Data Engineer,Ramify,Greater Paris Metropolitan Region,https://fr.linkedin.com/jobs/view/data-engineer-at-ramify-3896146641?position=32&pageNum=0&refId=3%2BsKCnzKBomYeuJjjsOexw%3D%3D&trackingId=e4XI0cdZ19g8lYZB0g9RxQ%3D%3D&trk=public_jobs_jserp-result_search-card,"ABOUT
Ramify’s mission is to help people achieve financial freedom, no matter who they are and how much they have. We are revolutionizing the private wealth management industry by making smart and affordable financial products for everyone.
No more standardized solutions, hidden fees and complicated words, Ramify enables everyone to become a smart investor. The team combines elements of its research with technology to design customized investment portfolios composed of world-class financial products.
The team comprises around 15 talented individuals. Ramify is looking for talented people in all sectors, who want to have a huge impact, move fast and deliver.
JOB DESCRIPTION
The Quantitative Investment Solutions (QIS) Team is dedicated to designing innovative investment portfolio models and developing cutting-edge investment features within our product suite. Moreover, the QIS Team is at the forefront of driving AI-based solutions for Ramify. This involves conceptualizing and implementing transformative AI solutions tailored to meet the diverse needs of various teams within Ramify.
As a Data Engineer on our QIS Team, you will play a pivotal role in shaping the future of investment strategies through data-driven insights and AI-based solutions. Collaborating closely with our talented team of quantitative researchers, and investment experts, your responsibilities will encompass architecting and implementing robust data pipelines. These pipelines will facilitate the seamless integration of diverse data sources, empowering Ramify teams to make informed decision-making.
Key Responsibilities:
Design, build and launch data pipelines at scale to move data across Ramify platform with SQL technologies.
Design and implement processes and tools for data onboarding and quality, helping to deliver an industry best-practice solution for managing the data lifecycle.
Produce stand-alone tools that can be used by other teams to automate data quality and discover faults.
Build analytical tools that provide insight into business metrics across Ramify.
Architect and lead the implementation of AI based solutions within Ramify
PREFERRED EXPERIENCE
We're looking for people who:
Want to make a difference. We are a small team effectively reshaping how people look at the industry. We need people who 'get it' and want to play an integral part in helping us accomplish this mission and are persistent in getting the job done.
Skills we're looking for:
Master’s or upper-year undergraduate-level coursework in either Computer Science, Management Information Systems, Business Information Systems, Mathematics or Finance related field.
2+ years of professional experience in data engineering.
2+ years of experience with one or more coding languages such as Python (is a must), Java.
Experience with data modeling and ETL design, implementation and maintenance.
Demonstrable mastery of industry best practices in the data lifecycle, including data quality automation and tooling.
Excellent written and verbal communication skills with ability to communicate complex designs and solutions to non-technical and highly technical audiences alike.
Good attention to detail.
Strong analytics and strategic thinking skills
Nice-to-haves :
Understanding of ML/ Generative AI technologies and their applications.
Possess a passion, curiosity, and energy for finance + investing. You understand the ins and outs of the wealth management, trading, and more importantly - know how to explain these concepts simply
Show more
Show less","{'ProgLanguage': ['Python', 'Java', 'R', 'Go'], 'DataBase': ['SQL'], 'DataAnalytics': ['R'], 'BigData': [], 'MachingLearning': [], 'DataSerialization': [], 'DataVisualization': [], 'Statistics': [], 'CloudComputing': [], 'DevTools': [], 'Os': [], 'DBMS': [], 'SoftBigDataProcessing': [], 'Automation': [], 'InfrastructureAsCode': [], 'NetworkSecurty': [], 'Virtualisation': [], 'Containers': [], 'Collaboration': ['Teams'], 'Other': ['ML'], 'FrSoftSkills': ['Communication'], 'EnSoftSkils': ['Communication']}","{'JobDetail': [], 'TypeContract': [], 'Salary': [], 'Level': [], 'Experience': ['a', 'n', 's']}"
LinkedIn,Data Engineer (F/H),Renault Digital,"Boulogne-Billancourt, Île-de-France, France",https://fr.linkedin.com/jobs/view/data-engineer-f-h-at-renault-digital-3911202728?position=33&pageNum=0&refId=3%2BsKCnzKBomYeuJjjsOexw%3D%3D&trackingId=0bxX79baJOSj%2BbQi4KG%2BzA%3D%3D&trk=public_jobs_jserp-result_search-card,"Contexte :
Dans le cadre de son programme Industrie 4.0, Renault développe depuis 2017 sa propre plateforme pour connecter et agréger les données industrielles des 22 sites du Groupe et de plus de 2500 machines.
Fort de partenariats stratégiques signés avec Google Cloud (stack data full GCP), Renault Digital est à la recherche d’un(e) Data Engineer au sein du Pôle Architecture et Data pour mettre en place des chaînes de traitement de données répondant à de nouveaux besoins métiers.
Vous collaborerez au jour le jour avec les équipes métiers ainsi qu’avec les autres fonctions du Pôle Architecture & Data (Data Analysts et Scientists, architectes, …), exploitant des téraoctets de données (événements en mode streaming, traitements en batch et temps réels et les appels aux APIs) afin entre autres d’alimenter des modèles de machine learning (segmentation clients, détection automatiquement des pannes des véhicules, …).
Responsabilités principales :
Vous participez aux phases de framing, MVP et release des produits, services et APIs orientés data ;
Vous argumentez les choix d’architecture des projets et de la plateforme datalake sur GCP ;
Vous contribuez à la valeur métier des produits orientés Data s’appuyant sur le Datalake, en mettant en place des chaînes bout en bout de traitement de la data, de l’ingestion à l’exposition d’APIs et à la visualisation des données et des solutions ML/DS ;
Vous êtes garant de la qualité des données transformées dans le Datalake, du bon fonctionnement des chaînes de traitement et de l’optimisation de l’utilisation des ressources des ressources cloud ;
Vous proposez des standards d’architecture et de développement ;
Vous êtes force de proposition, innovant(e) et bienveillant(e).
Environement technique :
Spark, Scala, Python, Java, Airflow, SQL, Google Cloud Platform (BigQuery, Cloud Storage, PubSub, Beam, Dataflow, Cloud ML, TensorFlow, Kubernetes), Git, Docker, JSON, Bash, Spotfire
Profil recherché :
Vous avez minimum 5 ans d’expérience en tant que Data Engineer ;
Vous disposez d’une expérience en développement Spark, Scala, Python et requêtage SQL sur des gros volumes de données ;
Vous avez une appétence pour la data : validation, transformation, analyse, valorisation ;
Vous possédez une expérience de développement et orchestration de chaines ETL complexes via Airflow ou équivalent ;
Vous pratiquez la méthodologie agile (Agile Scrum et/ou Kanban) ;
Vous utilisez les services cloud (préférablement GCP) ;
Vous êtes capable d’échanger en anglais technique écrit et oral.
Informations complémentaires :
Votre poste sera basé à Boulogne-Billancourt (France) en CDI (temps plein)
Vous bénéficiez de 2 à 3 jours de télétravail par semaine
Show more
Show less","{'ProgLanguage': ['Python', 'Java', 'Scala', 'R', 'Go', 'Bash'], 'DataBase': ['SQL'], 'DataAnalytics': ['R'], 'BigData': ['Spark'], 'MachingLearning': ['TensorFlow'], 'DataSerialization': ['Json'], 'DataVisualization': [], 'Statistics': [], 'CloudComputing': ['Google Cloud Platform'], 'DevTools': ['Git', 'Docker'], 'Os': [], 'DBMS': ['BigQuery'], 'SoftBigDataProcessing': [], 'Automation': ['Kubernetes', 'Airflow'], 'InfrastructureAsCode': [], 'NetworkSecurty': [], 'Virtualisation': [], 'Containers': ['Docker', 'Kubernetes'], 'Collaboration': [], 'Other': ['ML', 'Machine Learning', 'Cloud'], 'FrSoftSkills': [], 'EnSoftSkils': []}","{'JobDetail': ['Temps plein', 'Full'], 'TypeContract': ['CDI'], 'Salary': [], 'Level': [], 'Experience': ['a', 'n', 's', '5', '5', '5']}"
LinkedIn,Data Engineer H/F,Inetum,"St.-Ouen, Île-de-France, France",https://fr.linkedin.com/jobs/view/data-engineer-h-f-at-inetum-3843966639?position=34&pageNum=0&refId=3%2BsKCnzKBomYeuJjjsOexw%3D%3D&trackingId=TdwMuSB3Y6fg6jshb%2BTZRg%3D%3D&trk=public_jobs_jserp-result_search-card,"Détail de l'offre
Informations générales
Entité de rattachement
Inetum est un leader européen des services numériques. Pour les entreprises, les acteurs publics et la société dans son ensemble, les 28 000 consultants et spécialistes du groupe visent chaque jour l'impact digital des solutions qui contribuent à la performance, à l'innovation et au bien commun.
Présent dans 19 pays au plus près des territoires, et avec ses grands partenaires éditeurs de logiciels, Inetum répond aux enjeux de la transformation digitale avec proximité et flexibilité.
Porté par son ambition de croissance et d'industrialisation, Inetum a généré en 2023 un chiffre d'affaires de 2,5 milliards d'€.
Pour répondre à un marché en croissance continue depuis plus de 30ans, Inetum a fait le choix délibéré de se recentrer sur 4 métiers afin de gagner en puissance et proposer des solutions sur mesure, adaptées aux besoins spécifiques de ses clients le conseil (Inetum Consulting), la gestion des infrastructures et applications à façon (Inetum Technologies), l'implémentation de progiciels (Inetum Solutions) et sa propre activité d'éditeur de logiciels (Inetum Software). Inetum a conclu des partenariats stratégiques avec 4 grands éditeurs mondiaux - Salesforce, ServiceNow, Microsoft et SAP et poursuit une stratégie d'acquisitions dédiée afin d'entrer dans le top 5 européen sur ces technologies et proposer la meilleure expertise à ses clients.
Tous nos postes sont ouverts aux personnes en situation de handicap.
Description du poste
Métier
Applications Delivery - Software Development
Intitulé du poste
Data Engineer H/F
Contrat
CDI
Description De La Mission
Le pôle BFA de la branche Application Services du groupe INETUM, recherche plusieurs Data Engineers afin d'intervenir auprès de clients grands comptes au sein des marchés bancaires et de l'assurance.
Au sein de l'équipe Data, en tant que Data Engineer, vous participez à la réalisation de divers projets et vos missions sont
Apporter votre connaissance en Big Data permettant la manipulation des données
Concevoir les plateformes permettant de traiter des volumes de données importants
Mettre en place des bases de données
Préparer le pipeline de données pour que les données déployées soient sécurisées et claires afin d'être analysées et transformées.
Profil
De formation ingénieure en informatique Bac + 5 informatique ou scientifique
Bonne communication orale et écrite en français et niveau d’anglais professionnel
Savoir- être Bon esprit d'analyse et de synthèse, sens de l'organisation et de la qualité, force de proposition, rigueur, travail en équipe, adaptabilité.
Si vous vous reconnaissez, n'hésitez pas à postuler !
Localisation du poste
Localisation du poste
France
Ville
Saint-Ouen
Critères candidat
Niveau d'études min. requis
Bac+5
Niveau d'expérience min. requis
Plus de 2 ans
Compétences
SQL
Show more
Show less","{'ProgLanguage': ['R'], 'DataBase': ['SQL'], 'DataAnalytics': ['R'], 'BigData': [], 'MachingLearning': [], 'DataSerialization': [], 'DataVisualization': [], 'Statistics': [], 'CloudComputing': [], 'DevTools': ['Git'], 'Os': [], 'DBMS': [], 'SoftBigDataProcessing': [], 'Automation': [], 'InfrastructureAsCode': [], 'NetworkSecurty': [], 'Virtualisation': [], 'Containers': [], 'Collaboration': [], 'Other': ['Big Data'], 'FrSoftSkills': ['Communication', 'Adaptabilité', 'Organisation', 'Flexibilité'], 'EnSoftSkils': ['Communication']}","{'JobDetail': [], 'TypeContract': ['CDI'], 'Salary': [], 'Level': ['Bac+5'], 'Experience': ['a', 'n', 's', '30', '30', '30']}"
LinkedIn,Data Engineer BI - Nantes,Capgemini,"Nantes, Pays de la Loire, France",https://fr.linkedin.com/jobs/view/data-engineer-bi-nantes-at-capgemini-3803963477?position=35&pageNum=0&refId=3%2BsKCnzKBomYeuJjjsOexw%3D%3D&trackingId=0Pfx7yf7BS4uAZp8IATuug%3D%3D&trk=public_jobs_jserp-result_search-card,"Capgemini
Choisir Capgemini, c'est choisir une entreprise où vous serez en mesure de façonner votre carrière selon vos aspirations, où vous serez soutenu et inspiré par une communauté d’experts dans le monde entier, où vous pourrez réécrire votre futur. Rejoignez-nous pour redéfinir les limites de ce qui est possible, contribuer à libérer la valeur de la technologie pour les plus grandes organisations et participez à la construction d’un monde plus durable et inclusif.
Vos missions :
Intégré(e) au sein d’une équipe projet BI, Big Data ou Data Gouvernance pour des clients intervenant dans des secteurs d'activités divers, vous serez notamment en charge des missions suivantes :
Mener les analyses fonctionnelles destinées à traduire les besoins du client,
Mener les travaux de conception et de modélisation,
Diriger le développement de la solution / des traitements d'alimentation du DataWareHouse,
Organiser et préparer les travaux de recette utilisateurs,
Mettre en place les processus d'industrialisation et mener cette dernière.
Votre profil :
Diplôme d’ingénieur ou équivalent universitaire
Minimum 3 ans d'expérience
Anglais courant
Compétences en BI sur SAP BI (Hana, BW, BODS, BI 4), Microsoft BI (SQL Server, SSIS, SSAS, SSRS), Oracle (ODI, OBIEE), Teradata, Informatica (Powercenter), IBM (Datastage, Cognos, TM1), Talend, AB Initio
Maîtrise d'un ou de plusieurs outils de Dataviz : Microsoft Power BI, Tableau, Qlikview
Connaissances en Big Data (Ecosystème Hadoop (HIVE, PIG, Mahout…), Cloudera, Pivotal, Spark, HNX) ou en analytics (R, SAS, IBM SPSS)
3 raisons de nous rejoindre :
Qualité de vie au travail : accord de télétravail en France et à l’international, accord sur l’égalité
professionnelle, la parentalité, l’équilibre des temps et la mobilité durable.
Apprentissage en continu : certifications et formations en libre accès, accompagnement sur mesure avec votre carreer manager, parcours d’intégration sur 9 mois.
Avantages groupe & CSE : plan actionnariat, activités à tarifs préférentiels, remboursement partiel
vacances, remboursement de votre abonnement sportif ou culturel.
Nos engagements et priorités :
Le groupe Capgemini encourage une culture inclusive dans un cadre multiculturel et handi-accueillant. En nous rejoignant, vous intégrez un collectif qui valorise la diversité, développe le potentiel de ses talents, s’engage dans des initiatives solidaires avec ses partenaires, et se mobilise pour réduire son impact environnemental sur tous ses sites et auprès de ses clients.
Capgemini
Capgemini est un leader mondial, responsable et multiculturel, regroupant près de 350 000 personnes dans plus de 50 pays. Fort de 55 ans d’expérience, nous sommes un partenaire stratégique des entreprises pour la transformation de leurs activités en tirant profit de toute la puissance de la technologie et des innovations dans les domaines en perpétuelle évolution tels que le cloud, la data, l’Intelligence Artificielle, la connectivité, les logiciels, l’ingénierie digitale ou les
plateformes.
Get The Future You Want* | www.capgemini.com/fr-fr
*Capgemini, le futur que vous voulez
Show more
Show less","{'ProgLanguage': ['R', 'Go'], 'DataBase': ['SQL'], 'DataAnalytics': ['R'], 'BigData': ['Hadoop', 'Spark'], 'MachingLearning': [], 'DataSerialization': [], 'DataVisualization': ['Tableau', 'Power BI'], 'Statistics': [], 'CloudComputing': [], 'DevTools': ['Git'], 'Os': [], 'DBMS': ['Oracle', 'SQL Server'], 'SoftBigDataProcessing': [], 'Automation': [], 'InfrastructureAsCode': [], 'NetworkSecurty': [], 'Virtualisation': [], 'Containers': [], 'Collaboration': [], 'Other': ['Big Data', 'Cloud'], 'FrSoftSkills': ['Organisation'], 'EnSoftSkils': ['Initiative']}","{'JobDetail': [], 'TypeContract': [], 'Salary': [], 'Level': [], 'Experience': ['a', 'n', 's', '3', '3', '3']}"
LinkedIn,Data Engineer,Thales,"Ollioules, Provence-Alpes-Côte d'Azur, France",https://fr.linkedin.com/jobs/view/data-engineer-at-thales-3902424527?position=36&pageNum=0&refId=3%2BsKCnzKBomYeuJjjsOexw%3D%3D&trackingId=Tln2wh6ZyG6g2nuwAtwA0A%3D%3D&trk=public_jobs_jserp-result_search-card,"QUI SOMMES-NOUS ?
Thales est un leader mondial des hautes technologies comptant plus de 81 000 collaborateurs présents sur tous les continents. Le Groupe investit dans les innovations du numérique et de la « deep tech » – big data, intelligence artificielle, connectivité, cybersécurité et quantique – pour construire un avenir de confiance, essentiel au développement de nos sociétés, en plaçant l’humain au cœur des décisions.
Thales propose des solutions, services et produits qui aident ses clients – entreprises, organisations, Etats – dans cinq grands marchés vitaux pour le fonctionnement de nos sociétés : identité et sécurité numériques, défense, aéronautique, espace, et transport.
QUI ETES-VOUS ?
Diplômé d’un Bac+5 en école d’ingénieur ou équivalent universitaire avec une spécialisation en informatique, vous avez a
u moins 3 ans d'expérience
dans les technologies Big Data.
Passionné par le
secteur de la Défense et du Naval.
CE QUE NOUS POUVONS ACCOMPLIR ENSEMBLE :
En tant que
Data Engineer,
vous jouerez un rôle clé dans la conception, le développement et la maintenance de notre infrastructure de données, ainsi que dans la transformation et la gestion des flux de données.
VOS MISSIONS :
• Concevoir, développer et déployer des solutions Big Data en utilisant les technologies
Hadoop, Spark, Scala
.
• Mettre en place des pipelines de données performants pour l'ingestion, le traitement et le stockage des données massives.
• Collaborer étroitement avec les équipes métier pour comprendre leurs besoins en matière d'analyse de données et proposer des solutions adaptées.
• Optimiser les performances des clusters Hadoop pour garantir une exploitation efficace des données.
• Assurer la qualité et la fiabilité des données traitées, en mettant en place des processus de validation et de nettoyage.
• Identifier et résoudre les problèmes liés à l'infrastructure Big Data et proposer des améliorations.
Innovation, passion, ambition : rejoignez Thales et créez le monde de demain, dès aujourd’hui.
Show more
Show less","{'ProgLanguage': ['Scala', 'R'], 'DataBase': [], 'DataAnalytics': ['R'], 'BigData': ['Hadoop', 'Spark'], 'MachingLearning': [], 'DataSerialization': [], 'DataVisualization': [], 'Statistics': [], 'CloudComputing': [], 'DevTools': [], 'Os': [], 'DBMS': [], 'SoftBigDataProcessing': [], 'Automation': [], 'InfrastructureAsCode': [], 'NetworkSecurty': [], 'Virtualisation': [], 'Containers': [], 'Collaboration': [], 'Other': ['Big Data'], 'FrSoftSkills': ['Organisation'], 'EnSoftSkils': []}","{'JobDetail': [], 'TypeContract': [], 'Salary': [], 'Level': ['Bac+5'], 'Experience': ['a', 'n', 's', '3', '3', '3']}"
