srouce,title,company,location,link,description,skills,details
LinkedIn,Data engineer - F / H,United Robotics Group,"Paris, Île-de-France, France",https://fr.linkedin.com/jobs/view/data-engineer-f-h-at-united-robotics-group-3891680780?position=2&pageNum=0&refId=gVb8Q5OryTN63mrKy677qQ%3D%3D&trackingId=ISXwtkbVIw3VO%2FLCCBSv2g%3D%3D&trk=public_jobs_jserp-result_search-card,"Bienvenue chez
Aldebaran
, leader européen de la robotique
au sein du groupe
United Robotics Group
.
Nous concevons et industrialisons des robots innovants avec une vision sociétale ambitieuse pour façonner un monde plus humain. Depuis 2005, nous sommes à l'avant-garde de l'interaction homme-robot avec des produits emblématiques tels que NAO et Pepper.
Notre dernier-né,
Plato
,
incarne notre engagement envers la technologie de pointe et la sécurité,
fabriqué en France avec des composants européens.
Rejoignez nos équipes multiculturelles et dynamiques pour être au cœur de la révolution de la robotique.
Si vous êtes passionné.e par la robotique et l'intelligence artificielle, et que vous souhaitez contribuer à façonner l'avenir, nous vous offrons une expérience enrichissante et stimulante.
En tant que membre de notre équipe, vous bénéficierez d'une culture d'entreprise axée sur le sens de ce que nous faisons et valorisant la responsabilité sociale et environnementale.
Chez Aldebaran, nous valorisons l'innovation, la diversité et l'égalité et encourageons chacun.e à être ouvert.e, authentique, courageux.se, responsable et engagé.e.
Finalité du poste
Au sein de l'équipe Cloud-Online Services, le Data engineer intégrera l'équipe Data, responsable du développement des produits destinés à la collecte, aux process et à l'exploitation des données de nos robots.
Il aura pour rôle de définir et d'implémenter des services data, sur une infrastructure Cloud AWS, supportant des services en ligne qui gèrent les robots du groupe.
Missions principales
Le Data engineer aura pour responsabilités de :
évaluer les choix d'architecture et de solutions techniques lors de la mise en place de PoC,
concevoir et développer des services Data en respectant la spécification fonctionnelle et la méthodologie agile,
agréger et stocker de grandes quantités de données,
mettre en place des solutions de data processing,
intégrer/développer des outils de visualisation de données et analyser les KPI,
développer, tester, sélectionner et mettre en production des algorithmes qui permettent de répondre aux besoins,
réaliser des analyses de données,
mettre en place des tests de charge et fonctionnels pour les solutions Data,
investiguer et corriger les bugs remontés par les utilisateurs,
contribuer à la mise en place de l'infrastructure et outil de déploiement (CI/CD)
Rejoignez-nous pour faire partie d'une aventure passionnante où Pepper, NAO, Plato et leurs futurs successeurs attendent votre contribution pour repousser les limites de la technologie robotique !
Requirements
Pour la bonne exécution des missions confiées, vous témoignez d'au moins 6 ans d'expérience en tant que développeur sur des projets data en Cloud en Python et Spark et avec comme Cloud provider AWS.
Compétences demandées :
Bonne compréhension des technologies d'infrastructure et de déploiement,
Compétences techniques sur les services AWS : IOT core , Glue, lambda, Kinesis, S3, RDS,
Bonne compréhension technique dans la mise en place et l'automatisation de tests de charge et fonctionnels,
Bonne maitrise d'outils BI ou de dashboarding (POWER BI, TABLEAU, QUICKSIGHT)
Bonne connaissance et une expérience pratique de Scrum\Scrumban et des méthodes agiles,
Une certification AWS sera appréciée,
Un niveau de français et d'anglais courant est indispensable,
Des expériences dans des environnements fortement internationaux sont un plus
Benefits
Nos principaux avantages :
Une culture du bien-être en entreprise qui a fait ses preuves (budget célébration et moments de convivialité par équipes et directions, restauration collective de qualité, environnement de travail agréable)
Un engagement fort en matière de responsabilité sociale et environnementale (promotion de l'égalité professionnelle, performance de notre plan diversité et inclusion, référent handicap, fresque du numérique)
Une culture du télétravail encadrée de manière appropriée !
Tous nos postes sont ouverts aux personnes en situation de handicap.
Show more
Show less","{'ProgLanguage': ['Python', 'R', 'Go'], 'DataBase': [], 'DataAnalytics': ['R'], 'BigData': ['Spark'], 'MachingLearning': [], 'DataSerialization': [], 'DataVisualization': ['Tableau', 'Power BI'], 'Statistics': [], 'CloudComputing': ['AWS'], 'DevTools': [], 'Os': [], 'DBMS': [], 'SoftBigDataProcessing': [], 'Automation': [], 'InfrastructureAsCode': [], 'NetworkSecurty': [], 'Virtualisation': [], 'Containers': [], 'Collaboration': [], 'Other': ['Cloud', 'CI/CD'], 'FrSoftSkills': [], 'EnSoftSkils': []}","{'JobDetail': [], 'TypeContract': [], 'Salary': [], 'Level': [], 'Experience': ['a', 'n', 's', '6', '6', '6']}"
LinkedIn,Data Engineer,Shippeo,Greater Paris Metropolitan Region,https://fr.linkedin.com/jobs/view/data-engineer-at-shippeo-3908268236?position=3&pageNum=0&refId=gVb8Q5OryTN63mrKy677qQ%3D%3D&trackingId=IYIKyNqEx%2B3wDr%2FsH95yWg%3D%3D&trk=public_jobs_jserp-result_search-card,"Founded in 2014, Shippeo is a French based SaaS company providing supply chain visibility. Shippeo has grown from 70 to 220 employees during the last two years and is continuing to rapidly scale after an additional $40M fundraising round in October 2022.
Shippeo is an exceptionally diverse company with colleagues from 27 different nationalities and speaking 29 languages. With offices throughout Europe, North America and recently Asia, Shippeo provides global coverage to all of our clients.
Our product is composed of a mission critical SaaS web platform (API everywhere), with high traffic inbound/outbound integrations.
Our mission is to anticipate problems and proactively alert end-customers so they can efficiently manage exceptions. We achieve this by collecting and matching millions of theoretical and real data from different stakeholders.
The Data Intelligence Tribe is responsible for leveraging Shippeo’s data from our large shipper and carrier base, to build data products that help our users (shippers and carriers alike) and ML models to provide predictive insights. This tribe’s typical responsibilities are to:
get accurately alerted in advance of any potential delays on their multimodal flows or anomalies so that they can proactively anticipate any resulting disruptions
extract the data they need, get direct access to it or analyze it directly on the platform to gain actionable insights that can help them increase their operational performance and the quality and compliance of their tracking
provide best-in-class data quality by implementing advanced cleansing & enhancement rules
As a Data Engineer at Shippeo, your objective is to ensure that data is available and exploitable by our Data Scientists and Analysts on our different data platforms. You will contribute to the construction and maintenance of Shippeo’s modern data stack that’s composed of different technology blocks:
Data Acquisition (Kafka, KafkaConnect, RabbitMQ),
Batch data transformation (Airflow, DBT),
Cloud Data Warehousing (Snowflake, BigQuery),
Stream/event data processing (Python, docker, Kubernetes) and all the underlying infrastructure that support these use cases.
Qualifications
Required:
You have a degree (MSc or equivalent) in Computer Science.
3+ years of experience as a Data Engineer.
Experience building, maintaining, testing and optimizing data pipelines and architectures
Programming skills in Python and experience with asynchronous event processing (asyncio).
Advanced working knowledge of SQL, experience working with relational databases and familiarity with a variety of databases.
Working knowledge of message queuing and stream processing.
Knowledge of Docker and Kubernetes.
Knowledge of a cloud platform (preferably GCP).
Experience working with workflow management systems such as Airflow.
Desired:
Experience with cloud based data warehouse solutions (BigQuery, Snowflake).
Experience with Kafka and KafkaConnect (Debezium).
Experience with Infrastructure as code (Terraform/Terragrunt).
Experience building and evolving CI/CD pipelines with Github Actions.
Monitoring and alerting on Grafana / Prometheus.
Experience working on Apache Nifi.
Informations supplémentaires
We are looking for talents who share our values:
🚀 Ambition
💙 Care
🎯 Deliver
🤝 Collaboration
Find out more about our values in
Our Culture Book
If you identify with our values and enjoy working in a fast-paced and international environment, Shippeo is just the place for you!
We are committed to fostering diversity and inclusion within our workplace as we value the unique perspectives and experiences that individuals from all backgrounds bring to our team. We are dedicated to providing equal employment opportunities to all candidates, regardless of their background or abilities, and our commitment to inclusion is reflected in our policies, practices, and workplace culture.
We understand that candidates may have unique needs or questions related to disability inclusion. To facilitate this, you can reach our dedicated Disability Advisor at
inclusion@shippeo.com
with any inquiries or requests for accommodations during the application process.
Show more
Show less","{'ProgLanguage': ['Python', 'R'], 'DataBase': ['SQL'], 'DataAnalytics': ['R'], 'BigData': [], 'MachingLearning': [], 'DataSerialization': [], 'DataVisualization': [], 'Statistics': [], 'CloudComputing': [], 'DevTools': ['Git', 'Docker'], 'Os': [], 'DBMS': ['Snowflake', 'Snowflake', 'BigQuery'], 'SoftBigDataProcessing': [], 'Automation': ['Kubernetes', 'Airflow'], 'InfrastructureAsCode': ['Terraform'], 'NetworkSecurty': [], 'Virtualisation': [], 'Containers': ['Docker', 'Kubernetes'], 'Collaboration': [], 'Other': ['ML', 'Cloud', 'CI/CD'], 'FrSoftSkills': ['Collaboration'], 'EnSoftSkils': ['Collaboration']}","{'JobDetail': [], 'TypeContract': [], 'Salary': [], 'Level': [], 'Experience': ['a', 'n', 's']}"
LinkedIn,Data Engineer / Ops H/F,Chantelle,"Cachan, Île-de-France, France",https://fr.linkedin.com/jobs/view/data-engineer-ops-h-f-at-chantelle-3909858815?position=4&pageNum=0&refId=gVb8Q5OryTN63mrKy677qQ%3D%3D&trackingId=BEPo5jOeq6EyO9Eu1hUyrA%3D%3D&trk=public_jobs_jserp-result_search-card,"La Direction des Systèmes d'Information et du Digital du groupe Chantelle recherche son/sa futur.e Data Engineer / Ops H/F, pour le lancement du grand chantier de rénovation de l'architecture Data : la bascule de l'intégralité de son Data Warehouse vers Google Big Query.
Vos Missions Sont Les Suivantes
Vous concevez et mettez en œuvre une infrastructure autour de Google Cloud Platform permettant de collecter, transformer, charger et historiser les données générées par l'entreprise.
Vous travaillez en étroite proximité avec le lead data engineer de l'équipe, l'équipe
intégration en charge du développement des interfaces, avec notre équipe de Data Analysts qui sont en charge d'exposer cette donnée au reste de l'entreprise ainsi qu'avec l'équipe technique en charge des infrastructures transverses.
Vous collaborez avec l'ensemble des domaines fonctionnels de la DSI (MasterData, Supply Chain, Manufacturing, B2B, et B2C, Finance ...) dans le cadre des projets menés par le Groupe.
Vous apportez l'assertivité technique sur tous les sujets d'architecture data, et êtes force de proposition, par exemple choix de mise en place de pipeline temps réels ou au contraire de flux de données en mode batch, ou bien encore stockage sur Big Query / Big Table en fonction des cas d'usage.
Vous définissez ces éléments structurants, en justifiant vos choix, et les
mettez en œuvre.
Les enjeux sont forts et les use cases nombreux à l'échelle du groupe : amélioration du pilotage de nos stocks en dimensionnant mieux nos quantités à produire et nos assortiments, par magasin, meilleure adéquation des achats matières premières vs objectifs de stocks, produits finis, personnalisation de nos sites e-commerce en temps réel en fonction de nos profils client, refonte de nos flux / Apisation, ...
Show more
Show less","{'ProgLanguage': ['R', 'Go'], 'DataBase': [], 'DataAnalytics': ['R'], 'BigData': [], 'MachingLearning': [], 'DataSerialization': [], 'DataVisualization': [], 'Statistics': [], 'CloudComputing': ['Google Cloud Platform'], 'DevTools': ['Git'], 'Os': [], 'DBMS': ['Big Query'], 'SoftBigDataProcessing': [], 'Automation': [], 'InfrastructureAsCode': [], 'NetworkSecurty': [], 'Virtualisation': [], 'Containers': [], 'Collaboration': [], 'Other': ['Cloud'], 'FrSoftSkills': [], 'EnSoftSkils': []}","{'JobDetail': [], 'TypeContract': [], 'Salary': [], 'Level': [], 'Experience': ['a', 'n', 's']}"
LinkedIn,System Engineer,Glocomms,France,https://fr.linkedin.com/jobs/view/system-engineer-at-glocomms-3913692536?position=5&pageNum=0&refId=gVb8Q5OryTN63mrKy677qQ%3D%3D&trackingId=u0x5PL8yt3XhVhPX9EMGpw%3D%3D&trk=public_jobs_jserp-result_search-card,"Job Title: Systems Engineer
Location: Paris (Remote)
Remote Work: Fully remote
Contract Length: 12 months, renewable
About the Project:
This long-term engagement focuses on modernizing our client's e-commerce platform and enhancing their digital infrastructure. The project presents a unique opportunity to utilize cutting edge technology and drive digital transformation in the retail industry.
Key Responsibilities:
Lead the migration of legacy on-premises infrastructure to Google Cloud Platform (GCP), with a specific focus on optimizing performance and scalability for the client's e-commerce platform.
Collaborate closely with cross-functional teams, including software developers, network engineers, and security specialists, to ensure seamless integration of cloud-based solutions with existing systems.
Implement automation workflows using Terraform and Ansible to streamline deployment and configuration processes, with the goal of improving efficiency and reducing manual intervention.
Architect and implement monitoring and alerting solutions to ensure the reliability and availability of critical e-commerce services, leveraging GCP monitoring tools and third-party solutions.
Develop disaster recovery and business continuity plans to mitigate risks and ensure the resilience of the client's e-commerce platform against potential disruptions.
Provide technical guidance and support to project teams, facilitating knowledge transfer and fostering collaboration across departments.
Required Skills:
Proven experience as a Systems Engineer, with a strong background in cloud platforms, particularly Google Cloud Platform (GCP).
Expertise in infrastructure as code (IaC) tools such as Terraform and configuration management tools like Ansible.
Hands-on experience with container orchestration platforms such as Kubernetes, with a focus on deploying and managing containerized applications in production environments.
Proficiency in scripting languages such as Python, Bash, or PowerShell for automation and orchestration tasks.
Strong understanding of networking concepts and experience in designing and implementing secure, scalable network architectures.
Excellent problem-solving skills and the ability to thrive in a dynamic, fast-paced environment.
If you are interested in finding out more about this mission then please apply now!
Show more
Show less","{'ProgLanguage': ['Python', 'Scala', 'R', 'Go', 'Bash'], 'DataBase': [], 'DataAnalytics': ['R'], 'BigData': [], 'MachingLearning': [], 'DataSerialization': [], 'DataVisualization': [], 'Statistics': [], 'CloudComputing': ['Google Cloud Platform'], 'DevTools': ['Git'], 'Os': [], 'DBMS': [], 'SoftBigDataProcessing': [], 'Automation': ['Ansible', 'Kubernetes'], 'InfrastructureAsCode': ['Terraform'], 'NetworkSecurty': [], 'Virtualisation': [], 'Containers': ['Kubernetes'], 'Collaboration': ['Teams'], 'Other': ['ML', 'Cloud'], 'FrSoftSkills': ['Collaboration'], 'EnSoftSkils': ['Collaboration']}","{'JobDetail': ['Remote', 'Full'], 'TypeContract': [], 'Salary': [], 'Level': [], 'Experience': ['a', 'n', 's']}"
LinkedIn,Senior Infrastructure Engineer,Hour Consulting,"Paris, Île-de-France, France",https://fr.linkedin.com/jobs/view/senior-infrastructure-engineer-at-hour-consulting-3905972387?position=6&pageNum=0&refId=gVb8Q5OryTN63mrKy677qQ%3D%3D&trackingId=oY3rn5dU5d3OzMGEGYyB%2Fw%3D%3D&trk=public_jobs_jserp-result_search-card,"We are looking to hire a Senior Infrastructure Engineer.
Our client, a global technology company focused on Higher Education technology. Their goal is to improve student success and college graduation rates worldwide by crafting digital experiences that build community and increase student engagement. They are a global, enterprise SaaS company with 7M+ students in 25 countries actively using their platform. They are working with higher education institutions internationally across North America, Europe and the UK.
Tens of thousands of university administrators and millions of students rely on their products to do their work. Ensuring that systems are highly available, and that the product & engineering teams can iterate rapidly to deliver value are critical to their work of improving student success. They are looking for people with a strong background (and interest) in infrastructure, systems and DevOps engineering to help them architect, build, as well as maintain their ever-expanding platform. As an Infrastructure Engineer, you will be working across their entire technology stack and with all engineering teams to help make their products more reliable and easier to work with than ever before. Your work will not only directly and tangibly impact all engineers on the team, but also the success of millions of students across the world.
In terms of the role and responsibilities, you will
Design, build, manage, and improve the core infrastructure used by all of the engineering teams
Help debug production issues across various services and levels of stack, and improve the observability and traceability of systems to make the process more efficient
Help scrutinize, reason, and drive the technology and architecture choices they make in building the platform
Work with the other engineers and architects to ensure that the development, testing, and deployment of their technology is as easy and dependable as possible
Help ensure that the security of systems is state-of-the-art and exceeds the requirements and expectations of their higher education customers
Help to continuously improve the team processes of the engineering team
What we're looking for
Have at least 5 years of experience in a Infrastructure Engineering role or DevOps Engineering role, with a focus on cloud-hosted microservice-based technologies
Have a strong systems engineering background and be interested in building durable systems
Care deeply about the reliability and ease-of-use of infrastructure, and want to empower the rest of the engineering team to do more with less
Have extensive experience operating within at least one popular cloud hosting provider (e.g. AWS, GCP, Azure)
Have extensive experience building highly available, secure, and cost-efficient infrastructure that utilize a variety of technologies and data stores, including private cloud networking topologies, load-balanced web applications, Nginx, MySQL, Redis, Elasticsearch
Have experience administrating and optimizing common databases such as MySQL, Redis, Elasticsearch, and MongoDB
Be proficient in Python or a similar scripting language
Have good administrative Linux skills
What will make you stand out
Experience working with Python web applications
Experience working in enterprise technology space, with a higher level of compliances on security (e.g. in education or healthcare technology)
AWS Solutions Architect/DevOps Engineer certification, or similar for other providers
Experience leading Infrastructure Team or DevOps team or DevOps/Infrastructure projects
What you can expect
A chance to work towards an amazing mission of helping students succeed as a team member of a global tech startup
Remote-friendly work environment, with an opportunity to work from our offices in Paris, Liverpool and Utrecht
Generous paid vacation time
Continuous learning and growth culture with many opportunities to develop professionally
Health Benefits including health, dental, life , disability insurance and travel coverage
A chance to work with a global collaborative, friendly and diverse team
A fully remote team.
This is a remote role based anywhere in North America, UK, Netherlands, France
Show more
Show less","{'ProgLanguage': ['Python', 'R', 'Go'], 'DataBase': ['SQL', ' MongoDB', 'Elasticsearch'], 'DataAnalytics': ['R'], 'BigData': [], 'MachingLearning': [], 'DataSerialization': [], 'DataVisualization': [], 'Statistics': [], 'CloudComputing': ['AWS', 'Azure'], 'DevTools': ['Git'], 'Os': ['Linux'], 'DBMS': ['MySQL'], 'SoftBigDataProcessing': [], 'Automation': [], 'InfrastructureAsCode': [], 'NetworkSecurty': [], 'Virtualisation': [], 'Containers': [], 'Collaboration': ['Teams'], 'Other': ['DevOps', 'Cloud'], 'FrSoftSkills': [], 'EnSoftSkils': []}","{'JobDetail': ['Remote', 'Full', 'Senior'], 'TypeContract': [], 'Salary': [], 'Level': [], 'Experience': ['a', 'n', 's']}"
